,Unnamed: 0,subreddit,title,selftext,ups,overall_text,comment ups,sentiment,emotion,relevance,score
1,8,tifu,tifu by talking down apple products to my company is ceo,this literally happened a few minutes ago and i may be in need of searching for a new job pls halp i created a project at my work that allowed all of our products to be linked up to android apps that our customers can use to control them today was the day i was presenting this to upper management before starting my presentation the ceo of my company stopped in and decided he was interested in my project the presentation goes well and is very well received everyone thinks its a great idea to link our products up to apps instead of controlling them via switches and push buttons the final slide of my project was titled why android initially this is where things went very very bad i presented data showing that android based devices currently hold gt 50percent market share and apple is only around 38percent i then proceeded to tell everyone 82percent of new phones being shipped right now are android based i also explained that development for android was much easier than ios after i finish making these points my ceo just responds with well 82percent of people are stupid obviously thinking it was a joke and he just liked apple more i responded back with looks like we have a fanboy in the room the room went dead silent for the remainder of my presentation i finish up the presentation thinking it went quite well and the ceo storms out one of the vps in the meeting pulls me aside and politely fills me in on the fact that our ceo is one of the largest shareholders of apple i kinda just left work after that one  amp nbsp  tl dr shit on apple in front of my ceo who is one of the biggest investors in the company and called him a fucking fanboy edit rip inbox edit2 in the presentation i talked about expanding to ios when the time presented itself for now having the fully designed android app fits everyone is needs that is why the slide was titled why android initially  edit3 yes i own an android would i call myself a fan boy maybe i just prefer superior hardware for lower costs and open source whatever platform offers me that is the one i will choose i stated the android facts not to discredit apple but to show the usefulness of having the android app an ios app could not be created in near the time i made the android app because i would have had to learn other languages etc it was also just flat out not needed initially ,7419,tifu by talking down apple products to my company is ceo. this literally happened a few minutes ago and i may be in need of searching for a new job pls halp i created a project at my work that allowed all of our products to be linked up to android apps that our customers can use to control them today was the day i was presenting this to upper management before starting my presentation the ceo of my company stopped in and decided he was interested in my project the presentation goes well and is very well received everyone thinks its a great idea to link our products up to apps instead of controlling them via switches and push buttons the final slide of my project was titled why android initially this is where things went very very bad i presented data showing that android based devices currently hold gt 50percent market share and apple is only around 38percent i then proceeded to tell everyone 82percent of new phones being shipped right now are android based i also explained that development for android was much easier than ios after i finish making these points my ceo just responds with well 82percent of people are stupid obviously thinking it was a joke and he just liked apple more i responded back with looks like we have a fanboy in the room the room went dead silent for the remainder of my presentation i finish up the presentation thinking it went quite well and the ceo storms out one of the vps in the meeting pulls me aside and politely fills me in on the fact that our ceo is one of the largest shareholders of apple i kinda just left work after that one  amp nbsp  tl dr shit on apple in front of my ceo who is one of the biggest investors in the company and called him a fucking fanboy edit rip inbox edit2 in the presentation i talked about expanding to ios when the time presented itself for now having the fully designed android app fits everyone is needs that is why the slide was titled why android initially  edit3 yes i own an android would i call myself a fan boy maybe i just prefer superior hardware for lower costs and open source whatever platform offers me that is the one i will choose i stated the android facts not to discredit apple but to show the usefulness of having the android app an ios app could not be created in near the time i made the android app because i would have had to learn other languages etc it was also just flat out not needed initially ,,POSITIVE,Aggressive,related to apple products,"{'Modern': 0.5736263736263736, 'Dynamic': 0.12307692307692308, 'Stable': 0.07912087912087912, 'Aggressive': 0.07692307692307693, 'Elegant': 0.07692307692307693, 'Friendly': 0.04395604395604396, 'Powerful': 0.015384615384615385, 'Sporty': 0.01098901098901099}"
7,29,,,,,one of the top shareholders of apple really which one of these guys is it  and i am sure that super well off ceo just happened to stop by your project meeting and all this absolutely happened ,4,POSITIVE,Aggressive,related to apple products,
10,57,,,,,it is like religion do not talk bad about apple to their faithful make sure you know your audience first ,3,POSITIVE,Elegant,related to apple products,
21,141,,,,,i do not see why anyone gets offended by being called a fan boy i like apple i am vested in it too obviously not ceo quantity wise but i love there customer service it has always treated me well when dell fell off the map if the ceo is upset he is a pissy little bitch you said it in jest ,2,POSITIVE,Friendly,related to apple products,
22,145,,,,,do not resign just stand by yourself and you just pointed out valid facts why android can be or is better than ios there is nothing wrong with it just because he is shareholder at apple does not mean that the whole company needs to use apple products if employees do not want to ,2,POSITIVE,Aggressive,related to apple products,
33,177,,,,,put an apple into his mouth and you have a winner ,28,POSITIVE,Aggressive,related to apple products,
36,184,,,,,and do not forget to tell him that you are buying every new apple product from now on and steve jobs is your idol ,42,POSITIVE,Modern,related to apple products,
44,209,,,,,thank you i am not sure how much truth there is to op is story however there is a reason that apple is platform is so popular with developers especially in the us market when it comes to choosing platforms i believe it was best put do you want to make an app or make money ,172,POSITIVE,Modern,related to apple products,
59,261,,,,,symbian even more all out ,3,POSITIVE,Aggressive,related to apple products,
76,299,,,,,sir i am very enthusiastic about apple products very enthusiastic ,3,POSITIVE,Dynamic,related to apple products,
87,327,,,,,plot twist ceo was tim cook op works at apple actually a more enjoyable story if you imagine it that way ,108,POSITIVE,Dynamic,related to apple products,
115,403,,,,,that seems accurate as most of the description in the previous comment appears to apply to tim cook lately ,6,POSITIVE,Modern,related to apple products,
153,497,iphone,tim cook showcasing the next generation of apple products,,19827,tim cook showcasing the next generation of apple products. ,,POSITIVE,Dynamic,related to apple products,
154,500,,,,,can not wait to see what other colors the apple orange will come in ,488,POSITIVE,Modern,related to apple products,
156,504,,,,,can not wait for my apple orange ,160,POSITIVE,Dynamic,related to apple products,
157,505,,,,,i am interested in the apple ihouse,27,POSITIVE,Modern,related to apple products,
159,515,,,,,this is so you feel like you got a steal with the orange ,4,POSITIVE,Sporty,related to apple products,
161,524,,,,,i am holding out for the apple orange pro ,4,POSITIVE,Modern,related to apple products,
162,525,,,,,apple car 119000dollar you are very optimistic ,4,POSITIVE,Modern,related to apple products,
163,527,,,,,made me laugh d long life to apple teleport travel through ethernet cable cat 8 would be amazing hahaha,13,POSITIVE,Dynamic,related to apple products,
164,533,,,,,apple orange really caught me off guard,3,POSITIVE,Dynamic,related to apple products,
165,535,,,,,that apple orange looks pretty good i cannot lie ,3,POSITIVE,Elegant,related to apple products,
166,537,,,,,love how the e moto is double the cost of the car would be a very apple thing to do half the vehicle twice the price ,6,POSITIVE,Aggressive,related to apple products,
167,542,,,,,man real talk i keep thinking apple should just sponsor the aptera if they were gonna do a car that being said these are hilarious ,2,POSITIVE,Modern,related to apple products,
169,552,,,,,they had me on the first half not gonna lie,2,POSITIVE,Dynamic,related to apple products,
171,554,,,,,this is funny because apple has not came out with any new products since the ipod all just copies of other companies,2,POSITIVE,Modern,related to apple products,
172,555,,,,,me not paying any attention to apple showcases etc also me oh i heard about the goggles but not the scooter  a car why are six wheels better  oh shit they are doing those jet packs now have not seen them without the tomato can fists  i do not ride but that bike is good looking  the fuck hologram checks for humor tag visual excitement telepo  visual disappointment mother fuckers  ship orange yeah okay i see what has happened ,2,POSITIVE,Dynamic,related to apple products,
173,557,,,,,well i can only afford apple orange,2,POSITIVE,Friendly,related to apple products,
174,560,,,,,damn apple ship is pricey you ll definitely want some apple care with this one just in case to be covered ,2,POSITIVE,Elegant,related to apple products,
175,564,,,,,hahahhaa this is a hilarious post apple scooter hahahaha,2,POSITIVE,Dynamic,related to apple products,
176,565,,,,,apple orange was hilarious,2,POSITIVE,Dynamic,related to apple products,
178,567,,,,,apple orange is brilliant david would be proud ,2,POSITIVE,Dynamic,related to apple products,
179,568,,,,,apple world,2,POSITIVE,Dynamic,related to apple products,
180,569,,,,,bro ngl the apple orange got me ,2,POSITIVE,Dynamic,related to apple products,
182,574,,,,,this is exactly how i would imagine that showcase to go spaceship meh teleport hmm but the orange apple won the show ,2,POSITIVE,Dynamic,related to apple products,
183,581,,,,,probably not too far off from these ,1,POSITIVE,Modern,related to apple products,
184,586,,,,,i would buy all these products,1,POSITIVE,Dynamic,related to apple products,
185,589,,,,,the apple orange got me,0,POSITIVE,Dynamic,related to apple products,
186,593,,,,,apple orange got me ,0,POSITIVE,Dynamic,related to apple products,
188,598,,,,,tim cook looks like a granddad and i hope apple is gonna make super amazing tv shows like they are now thats all i want from apple and bring ipods back please,-1,POSITIVE,Modern,related to apple products,
195,615,,,,,we think you are gonna love it,1,POSITIVE,Elegant,related to apple products,
196,620,,,,,the apple car is legit good and price is dare i say competitive in that bracket ,1,POSITIVE,Modern,related to apple products,
197,623,,,,,hey apple you look fruity hahahahahaha,1,POSITIVE,Dynamic,related to apple products,
198,624,,,,,me in 2027 man i really want to get the cheaper smoothie blender but i already have the apple sprinkler heads apple bed sheets and apple shower body wash that all integrate so well together ,1,POSITIVE,Modern,related to apple products,
205,640,,,,, and we think you will love it ,1,POSITIVE,Modern,related to apple products,
207,645,,,,,it took apple orange to make me upvote ,1,POSITIVE,Dynamic,related to apple products,
210,654,,,,,apple apple when,1,POSITIVE,Dynamic,related to apple products,
211,668,,,,,starts at,1,POSITIVE,Modern,related to apple products,
212,670,,,,,apple pineapple ,1,POSITIVE,Elegant,related to apple products,
213,671,,,,,apple orange would be a game changer,1,POSITIVE,Dynamic,related to apple products,
214,672,,,,,we think you are gonna love it ,1,POSITIVE,Dynamic,related to apple products,
217,682,,,,,that apple orange at the end definitely got a little cackle out of me ,1,POSITIVE,Dynamic,related to apple products,
220,689,,,,,i would ride the apple e bike and i would drive the apple car,1,POSITIVE,Modern,related to apple products,
222,700,,,,,apple scooter interesting but price is so high,1,POSITIVE,Modern,related to apple products,
227,707,,,,,apple tim apple,1,POSITIVE,Modern,related to apple products,
228,710,,,,,i thought the space ship would look like an apple ,1,POSITIVE,Dynamic,related to apple products,
229,717,,,,,incredible i gotta say i have not been onboard with apples direction lately but after seeing this tim has my full confidence ,1,POSITIVE,Modern,related to apple products,
231,721,,,,,i laugh to tears from an orange apple,1,POSITIVE,Dynamic,related to apple products,
232,734,,,,,apple orange genius  ,1,POSITIVE,Modern,related to apple products,
233,736,,,,,these are really good i think the apple ship should have been called the apple iship there is a certain ring to it that i like ,1,POSITIVE,Dynamic,related to apple products,
234,738,,,,,and the  of the lineup ,1,POSITIVE,Dynamic,related to apple products,
235,739,,,,,dollar119k for an apple jetpack what a steal ,1,POSITIVE,Aggressive,related to apple products,
237,744,,,,,love them,1,POSITIVE,Friendly,related to apple products,
240,767,,,,,apple orange huh lol damn you and your witticism,1,POSITIVE,Dynamic,related to apple products,
243,787,,,,,his name is tim apple,1,POSITIVE,Modern,related to apple products,
244,791,,,,,all of these were realistic up until apple teleport ,1,POSITIVE,Modern,related to apple products,
253,815,,,,,apple orange apple edition dollar5 000 ,3,POSITIVE,Modern,related to apple products,
254,816,,,,,and the apple orange cases ,3,POSITIVE,Modern,related to apple products,
255,817,,,,,apple orange apple green ,3,POSITIVE,Elegant,related to apple products,
256,818,,,,,orange orange apple,3,POSITIVE,Dynamic,related to apple products,
260,826,,,,,interesting an ai creator trying to get credit for their work ironic ,9,POSITIVE,Dynamic,related to apple products,
268,849,,,,,it is tim apple to you ,59,POSITIVE,Modern,related to apple products,
269,850,,,,,he is the boss of apple,12,POSITIVE,Powerful,related to apple products,
276,868,,,,,finally can afford an apple product ,32,POSITIVE,Modern,related to apple products,
278,878,,,,,reinventing the apple,97,POSITIVE,Modern,related to apple products,
284,887,,,,,thanks for letting me know imagesby ai on instagram,0,POSITIVE,Friendly,related to apple products,
291,913,,,,,it is the most orange apple we have ever made ,37,POSITIVE,Elegant,related to apple products,
293,915,,,,,just peel it ,2,POSITIVE,Aggressive,related to apple products,
294,916,,,,,wow apples to oranges ,2,POSITIVE,Dynamic,related to apple products,
304,958,,,,,apple orange here to guide florida the rest of the way down the river styx ,7,POSITIVE,Dynamic,related to apple products,
310,988,,,,,what if apple got into the produce business maybe with local californian farms i would definitely like to see apple oranges ,44,POSITIVE,Modern,related to apple products,
311,994,,,,,that apple car though ,6,POSITIVE,Modern,related to apple products,
316,1014,,,,,tim apple looks so happy in his sittingpro wheelchair,2,POSITIVE,Friendly,related to apple products,
324,1025,,,,,apple car starts at dollar119 000 but that is the base model with a 50 mile range ,1,POSITIVE,Modern,related to apple products,
325,1026,,,,,well apple is working on a car so that one will become reality ,1,POSITIVE,Modern,related to apple products,
326,1028,,,,,project titan is real so the apple car is a thing,1,POSITIVE,Modern,related to apple products,
329,1037,,,,,i will admit i have been in with the dog house can totally imagine the speech with most connected dog house to your apple watch with lots of insanely great tech to tell you when you dog is horny or is destroying your belongings  ,1,POSITIVE,Modern,related to apple products,
331,1051,,,,,apple and every product is not white ,1,POSITIVE,Modern,related to apple products,
333,1062,,,,,introducing apple socks ,1,POSITIVE,Modern,related to apple products,
334,1064,,,,,apple fridge is the deal of the century,1,POSITIVE,Modern,related to apple products,
337,1074,,,,,apple inecromancer feat steve jobs,1,POSITIVE,Modern,related to apple products,
341,1092,,,,,nice i can finally get my apple grill at an affordable price ,1,POSITIVE,Friendly,related to apple products,
344,1103,,,,,the apple car is a real project in 2018 it was reported that apple had 5 000 people working on it ,1,POSITIVE,Modern,related to apple products,
347,1118,,,,,these are all way cheaper than what apple would actually charge,1,POSITIVE,Modern,related to apple products,
348,1120,,,,,the apple car looks legit,1,POSITIVE,Modern,related to apple products,
351,1159,,,,,the apple dog house looks nicer than my house ,1,POSITIVE,Elegant,related to apple products,
353,1167,,,,,apple apple slicer ,1,POSITIVE,Modern,related to apple products,
354,1180,,,,,apple fridge seems like a deal,1,POSITIVE,Modern,related to apple products,
357,1201,,,,,apple fridge is looking ,1,POSITIVE,Modern,related to apple products,
363,1231,,,,,gimme that apple grill ,1,POSITIVE,Aggressive,related to apple products,
364,1243,,,,,you are high if you think apple would sell a helmet that cheap,1,POSITIVE,Aggressive,related to apple products,
365,1247,,,,,the apple fridge is a perfect kind of apple smart home appliance built for siri homekit for apple devices it is very interesting if apple would bring its own smart home appliances to our apple product line ,1,POSITIVE,Modern,related to apple products,
367,1253,,,,,this is awesome and made me chuckle a bit i have a few suggestions though apple apple apple gun apple cheese grater apple happy meal ,1,POSITIVE,Aggressive,related to apple products,
369,1259,,,,,apple lawnmower compatible with airpods,1,POSITIVE,Modern,related to apple products,
371,1276,,,,,apple fridge is a deal ,1,POSITIVE,Modern,related to apple products,
375,1294,,,,,i know i imagine apple cars will become a reality in the next 20 years,14,POSITIVE,Modern,related to apple products,
376,1296,,,,,i see prototypes of the apple car all the time mind you at this point it is just for the self driving hardware and it is mounted to the roof of a lexus rx but they are out there nonetheless ,2,POSITIVE,Modern,related to apple products,
377,1303,,,,,samsung is a mega corporation with iirc hundreds of sub companies that do basically everything apple is a design company ,2,POSITIVE,Modern,related to apple products,
378,1307,,,,,do not forget apple sauce,9,POSITIVE,Modern,related to apple products,
380,1310,,,,,that is the max version,15,POSITIVE,Modern,related to apple products,
386,1322,,,,,i will let apple know ,2,POSITIVE,Modern,related to apple products,
387,1324,,,,,it is true it says it right there go grab one ,1,POSITIVE,Modern,related to apple products,
394,1345,,,,,hey you are the 50th person to say that congrats you win an apple fridge originally priced at dollar599 but we are giving it to you for free ,1,POSITIVE,Modern,related to apple products,
397,1348,,,,,yeah i see it now too good catch,1,POSITIVE,Modern,related to apple products,
398,1351,,,,,you are right i should have done some competitor analysis and really thought about what apple would price their time machine at ,2,POSITIVE,Modern,related to apple products,
399,1352,,,,,you are high if you think apple would sell a football helmet at all,1,POSITIVE,Aggressive,related to apple products,
406,1372,,,,,i honestly hope for sooner i wonder if there will be a sperate license for those who will own apple is fully automated cars so you never need to take the steering wheel again ,3,POSITIVE,Modern,related to apple products,
408,1381,,,,,well it is apple so let is say dollar3 500 ,3,POSITIVE,Modern,related to apple products,
412,1390,,,,,apple will actually release tiny electronic iflies into your home ,2,POSITIVE,Modern,related to apple products,
413,1392,,,,,apple robot rocket submarine ,2,POSITIVE,Dynamic,related to apple products,
423,1432,,,,,see that you do,42,POSITIVE,Modern,related to apple products,
427,1437,,,,,the apple fridge probably is full touchscreen and has cameras inside so you see it is contents from outside plays you songs while making you recipe menus for the week according to your food ,2,POSITIVE,Modern,related to apple products,
428,1441,,,,,the whole club was looking at tim apple,2,POSITIVE,Dynamic,related to apple products,
430,1451,,,,,and having it back to back with your time machine makes for not only an aesthetic wtf but enables you to go back in time to get the old faves and other overpriced items for a steal that is how they would dual market the shit outta that combo,1,POSITIVE,Modern,related to apple products,
431,1454,,,,,autsch point taken and noted ,3,POSITIVE,Aggressive,related to apple products,
432,1457,,,,,the way it s going they can be glad if they can afford actual apples soon ,2200,POSITIVE,Modern,related to apple products,
437,1485,,,,,good i have a new respect for apple ,3,POSITIVE,Modern,related to apple products,
449,1527,,,,,yay for huawei and oppo,1,POSITIVE,Modern,related to apple products,
459,1561,,,,,thats cool apple still used virtually slave labor,0,POSITIVE,Aggressive,related to apple products,
471,1595,,,,, you can not longer buy apples in russia,-1,POSITIVE,Modern,related to apple products,
472,1597,,,,,this is the way ,-1,POSITIVE,Dynamic,related to apple products,
475,1615,,,,,what is an apple,0,POSITIVE,Modern,related to apple products,
488,1655,,,,,agree xd,1,POSITIVE,Modern,related to apple products,
568,1938,,,,,i love this everything but the knife it could not be free apple does not give shit away for free ,8,POSITIVE,Aggressive,related to apple products,
573,1954,,,,,the isplash will also work seamlessly across all you i devices we will auto automatically put an airtag on your shit and you will about to track it with find my app and send you a notification when it reach the ocean ,1,POSITIVE,Modern,related to apple products,
574,1955,,,,,the knife is strangely apple looking ,1,POSITIVE,Aggressive,related to apple products,
576,1967,,,,,apple jeans is by far the best of both series,1,POSITIVE,Modern,related to apple products,
579,1979,,,,,apple orange is by far my favorite ai generated image of all time ,1,POSITIVE,Dynamic,related to apple products,
581,1995,,,,,apple bidet,1,POSITIVE,Elegant,related to apple products,
582,1996,,,,,apple knife it is the sharpest choice,1,POSITIVE,Aggressive,related to apple products,
583,1999,,,,,apple knife is free ,1,POSITIVE,Aggressive,related to apple products,
586,2007,,,,,i love these if you do not mind me asking how were you able to get mj to recognize apple as a brand instead of just an apple ,1,POSITIVE,Modern,related to apple products,
587,2008,,,,,okay but apple orange sent me ,1,POSITIVE,Dynamic,related to apple products,
588,2012,,,,,the apple knife is free but they deliver it straight to your abdomen,1,POSITIVE,Aggressive,related to apple products,
589,2016,,,,,apple orange gave me a good chuckle ,1,POSITIVE,Friendly,related to apple products,
591,2023,,,,,i laughed at apple orange more than i should have ,1,POSITIVE,Dynamic,related to apple products,
593,2030,,,,,okay but the apple orange made me crack up well done,1,POSITIVE,Dynamic,related to apple products,
594,2032,,,,,that knife is fake no way apple would give away something for free,1,POSITIVE,Aggressive,related to apple products,
596,2035,,,,,all were great but the apple orange is my favourite,1,POSITIVE,Dynamic,related to apple products,
597,2036,,,,,on my way to pick up my apple knife talk to you guys later ,1,POSITIVE,Aggressive,related to apple products,
598,2044,,,,,apple teleport and apple ship seem like good deals,1,POSITIVE,Modern,related to apple products,
600,2050,,,,,apple orange now that is an apple ,1,POSITIVE,Elegant,related to apple products,
604,2059,,,,,apple orange got me ,1,POSITIVE,Dynamic,related to apple products,
605,2065,,,,, starts speaking in british accent welcome to a revolution in personal care today we are introducing the apple toilet seamlessly integrated advanced and intuitive redefining comfort wellness and smart living all in one for just dollar10 000 are you ready to make a splash in the future of hygiene ,52,POSITIVE,Modern,related to apple products,
615,2082,,,,,i like how it is an apple shaped orange ,9,POSITIVE,Dynamic,related to apple products,
616,2086,,,,,so it is an apple or an orange ,1,POSITIVE,Modern,related to apple products,
