,Unnamed: 0,subreddit,title,selftext,ups,overall_text,comment ups,sentiment,emotion,relevance,score
1084,3695,,,,,i am also on a 2012 mbp i just upgraded it with a secondary hard drive and an ssd in main 16 gb ram i7 1 5 to memory works absolutely fine ,6,POSITIVE,Powerful,related to apple products,
1093,3730,,,,,i bought one of their original product the apple to use as treats for my bunnies they loved it ,67,POSITIVE,Friendly,related to apple products,
1094,3735,,,,,here i am with an xs apple watch se and ipad 7th gen and all of them have been working flawlessly for as long as i have had them,3,POSITIVE,Modern,related to apple products,
1097,3759,,,,,apple does not fuck around when it comes to their macbooks they build those things to last,9,POSITIVE,Stable,related to apple products,
1098,3760,,,,,there is honestly no other laptop like the m1 macbooks right now too ,3,POSITIVE,Modern,related to apple products,
1099,3765,,,,,just fyi if you do not know you can get your battery changed by apple for like 40 dollars out of warranty and it acts brand new again,17,POSITIVE,Modern,related to apple products,
1101,3771,,,,,huuuh the laptops are the best thing they make m1 macbook air is by far the best value laptop out there ,39,POSITIVE,Modern,related to apple products,
1102,3772,,,,,i still have a 2011 imac that i use everyday ,9,POSITIVE,Modern,related to apple products,
1103,3773,,,,,not my experience but if you want to believe that apple users only claim to like their devices as a personal affront to you and are all secretly lying and living a life of shame for not listening to your superior intellect then you do you i suppose i like what i like because i like it ,2,POSITIVE,Aggressive,related to apple products,
1106,3781,,,,,ii think that is stretching things a bit xd apple is ipods were pretty sturdy i have one lying around that still works decently well i believe up until 2013 they were making solid products and choices all around their macs had upgradable components their phones were pretty durable ios was solid around iphone 6 bendgate things started to get pretty controversial for a lot of their products iphone 6 was prone to bending and slower than other flagships the 6s offered a 16gb storage base model in 2015 while every other flagship let you expand they removed the headphone jack in 2016 so on their macs got less upgradeable they had the butterfly keyboard fiasco and of course the infamous dollar1000 stand and who can forget charging the apple pencil by sticking it in the ipad is lightning port but i finally believe they are on a better path after apple silicon became a thing their product power efficiency is great apple music offering lossless and atmos for free was awesome they have standardised usb c on every product iphones will also have them in 2022 they are opening native compatibility for aaa games they are selling repair kits for their own products expensive but it is a step their mac keyboards are excellent again the screens are fantastic i could go on they are not flawless no company is but we can do better than pretend that apple products break as soon as the warranty expires ,12,POSITIVE,Modern,related to apple products,
1120,3816,,,,,i am happy that you are happy with your devices i wish i could have had the same experience that said i will say i have never once heard anyone complain about their ipad those things truly seem to be top notch ,0,POSITIVE,Modern,related to apple products,
1121,3817,,,,,do not let one person is anecdotes turn you off great products at the volume that apple sells things it is inevitable that some have problems but overall the new macbooks and iphones are rock solid ,5,POSITIVE,Stable,related to apple products,
1122,3821,,,,,apple dropped 32 bit support three years ago before you bought your laptop and you can download prior versions of macos from  downgrading is not hard ,2,POSITIVE,Modern,related to apple products,
1125,3836,,,,,got a surface book 2 in 2016 the battery lasts about 6 hours of continuous use right now all the keys and touchscreen and touchpad work perfectly it is still shiny and looks brand new and performs absolutely beautifully the laptops i had before that acer dell did not last 2 years without multiple hardware failures track pad stopped working keys failed etc i think spending more money means getting a much better quality product that will last a whole lot longer i am very surprised and amazed at my surface book and how perfectly it works after all these years,5,POSITIVE,Stable,related to apple products,
1127,3843,,,,, mhmm i heard so many stories about broken apple own lightning cables but i never experienced once to the point that my house is now filled with unused lightning cables the one that i am using now is almost 6 years old and still working well ,2,POSITIVE,Stable,related to apple products,
1128,3850,,,,,my parents have a 2007 imac that is still going strong granted i did add an ssd and an extra 1gb of ram but it still works ,5,POSITIVE,Stable,related to apple products,
1137,3895,,,,,i am not the only software developer in this thread who works professionally on a 7 year old macbook pro their computers are super high quality ,3,POSITIVE,Modern,related to apple products,
1144,3924,,,,,i just now got my break at work and this made it so much sweeter,3,POSITIVE,Friendly,related to apple products,
1161,3986,,,,,the apple does not fall far from the tree ,220,POSITIVE,Elegant,related to apple products,
1167,4003,,,,,as much as i want gs to sell new apple products i think this tweet does not mean they are going to sell new apple products but i hope youre right,4,POSITIVE,Modern,related to apple products,
1168,4007,,,,,buy an iphone and get a free nft while setting up your new gamestop wallet would be a crazy good move ,2,POSITIVE,Dynamic,related to apple products,
1169,4008,,,,,good now i can buy a 14 and support my favorite company ,1,POSITIVE,Sporty,related to apple products,
1173,4020,,,,,they already do,1,POSITIVE,Stable,related to apple products,
1175,4027,,,,,they have done this since 2014 ,1,POSITIVE,Modern,related to apple products,
1176,4031,,,,,what do apples grow on trees what is a well known tree yggdrasil gamestop is the tree of life ,1,POSITIVE,Elegant,related to apple products,
1177,4040,,,,,i have been trying to get an ipad air on the website for months had a feeling something epic is coming,2,POSITIVE,Dynamic,related to apple products,
1178,4046,,,,,the binding of issac newton,37,POSITIVE,Dynamic,related to apple products,
1180,4048,,,,,a tree does not fall far from the nuts,-1,POSITIVE,Aggressive,related to apple products,
1181,4049,,,,,got my girlfriend is brother a new refurbished iphone from gamestop a couple months ago great purchase and a great price fr,14,POSITIVE,Modern,related to apple products,
1183,4053,,,,,are you telling me there is finally hope for a chance for me to buy a new macbook pro from my favorite company ,60,POSITIVE,Modern,related to apple products,
1184,4056,,,,,recently turned into a mac user due to apette i am liking it and so want you to be right,5,POSITIVE,Modern,related to apple products,
1185,4059,,,,,yeah especially since i am thinking of getting a new macbook in a year or so ,6,POSITIVE,Modern,related to apple products,
1188,4069,,,,,i am talkin bout them new 14 is,1,POSITIVE,Sporty,related to apple products,
1191,4075,,,,,i think best buy sell refurbished and new,6,POSITIVE,Modern,related to apple products,
1201,4107,,,,,i got an iphone 12 mini for dollar520 and 2 iphone se gen 2 for dollar288 each last xmas it was easily the best refurbished prices from any reputable seller at the time ,13,POSITIVE,Modern,related to apple products,
1209,4119,,,,,ty for the information bud i really appreciate it ,5,POSITIVE,Friendly,related to apple products,
1210,4120,,,,,that i do agree with 100percent,3,POSITIVE,Modern,related to apple products,
1218,4154,,,,,yes yes yes thank you eu let is see what amazing technology apple cooks up ,-1,POSITIVE,Modern,related to apple products,
1221,4162,,,,,good first usb c and now right to repair good going eu ,1,POSITIVE,Modern,related to apple products,
1222,4167,,,,,amazing thanks the highlights are really useful,22,POSITIVE,Elegant,related to apple products,
1225,4176,,,,,apple specifically made the nonreplaceable battery mainstream ,15,POSITIVE,Modern,related to apple products,
1228,4187,,,,,and the rest will follow ,1,POSITIVE,Dynamic,related to apple products,
1229,4203,,,,,this helps you it directly benefits you and how long you can keep using your device ,5,POSITIVE,Modern,related to apple products,
1235,4246,,,,,i am sure apple will find someway to monetize it they are real good at that ,1,POSITIVE,Modern,related to apple products,
1236,4247,,,,,that is not true at all apple has been making great strides into making iphones easier to repair starting with their fantastic self repair program they introduced last year ,-40,POSITIVE,Modern,related to apple products,
1240,4273,,,,,that is not totally true apple has done some pretty damn anti self repair designs on their phones in the past and recent future and i do not see samsung or pixel doing that edit okay downvote me but unless you can provide evidence that pixel and samsung phone are as repair unfriendly as pixel phones i have repaired many recent pixel phones then i am not wrong that apple does not always set the trend and repairability is a very important trend much more than headphones ,-17,POSITIVE,Aggressive,related to apple products,
1243,4293,,,,,apple devices have by far the most longevity out of any of the options,1,POSITIVE,Stable,related to apple products,
1244,4310,,,,,they def would their best interest is to just be one step behind apple in these matters that way everyone could just point fingers at apple lets not forget that the primary goal of all these companies is to make money ,3,POSITIVE,Modern,related to apple products,
1246,4323,,,,,you do not need to borrow anything from apple the tools are completely optional the fact that they even give you the option to rent them is incredible and just shows how committed they are to encouraging people to self repair ,-2,POSITIVE,Modern,related to apple products,
1251,4353,,,,,well good for us now it will be good for us europeans as well ,1,POSITIVE,Modern,related to apple products,
1252,4367,,,,,if you do buy a laptop at this time m2 and the m3 is announced do not be annoyed because your laptop is still a very powerful machine it does not automatically become a slow trashbook from 1942 so just look at the bright side and enjoy your new laptop,5,POSITIVE,Powerful,related to apple products,
1257,4384,,,,,ib4 someone talks about how they have a 2008 macbook air with 1gb of ram and it runs just fine and people should never upgrade ever in history ,2,POSITIVE,Modern,related to apple products,
1259,4388,,,,,i just bought and apple pencil  s,2,POSITIVE,Modern,related to apple products,
1265,4399,,,,,i would like to take credit as this event was announced just as the return window for my new mac ended ,2,POSITIVE,Modern,related to apple products,
1266,4400,,,,,if everyone followed this do not buy mentality apple would not sell any products i am still daily using a 2015 mbp it is fine for normal and medium use tasks i would argue for 99percent of people a 2015 has enough power just get the computer that fits your needs it will last you 10 years ,3,POSITIVE,Modern,related to apple products,
1270,4435,,,,,just return it you can always buy it again,1,POSITIVE,Stable,related to apple products,
1271,4439,,,,,do not stress if you want to buy it now buy it do not let fomo get you,1,POSITIVE,Aggressive,related to apple products,
1273,4446,,,,,it is the never ending tech cycle of the last 40 years why buy that m3 when the m4 will be right behind it  jk obviously love apple ,1,POSITIVE,Modern,related to apple products,
1277,4474,,,,,i waited a year for apple to release the 14 macbooks got the m1 max 32gb and 2tb feels like i got it yesterday very satisfied with the purchase having said that it is not necessary to buy the latest configurations if you are looking to save money m2 will be on a discount once m3 releases if money is not an issue then go for the latest ones,1,POSITIVE,Modern,related to apple products,
1280,4480,,,,,the apple us return policy is 14 days but stores are oftentimes super nice when a new version comes out and you just bought the old one and they will let you exchange the old one for the new one if you are within the return period for your country or territory consider returning your device and waiting to purchase a new one ,2,POSITIVE,Modern,related to apple products,
1281,4484,,,,,there is a  that advises on what to buy or avoid for all apple products op u personsuittv i think you are aware of it as well right ,1,POSITIVE,Modern,related to apple products,
1283,4487,,,,,you did ,1,POSITIVE,Elegant,related to apple products,
1286,4506,,,,,hey same here exactly eight days ago i received my refurbished m2 pro 16 ram 512 ssd man it was a great price and i am super happy with it index fingers directly into my ear holes when i hear anything about m3 in the coming months im not listening haha ,17,POSITIVE,Modern,related to apple products,
1291,4527,,,,,its hard to say for sure however the new iphone pro soc has native ray tracing and was built on the 3nm node the new m3 is will also be on 3nm so it is highly likely that they will support it ,11,POSITIVE,Modern,related to apple products,
1292,4528,,,,,yes i lt does 100percent since we got rt on iphone 15 i can confirm apple is working on gaming this time and m3 will be a upgrade in gpu and memory ,1,POSITIVE,Modern,related to apple products,
1293,4529,,,,,if apple commits 100percent to gaming today it will take then 5 years at least to be a competitive gaming option think of that what you will ,1,POSITIVE,Dynamic,related to apple products,
1294,4530,,,,,i think you are correct i did watch a video on you are talking about a refresh to the current line up ,1,POSITIVE,Modern,related to apple products,
1296,4537,,,,,same you think they will drop in price ,1,POSITIVE,Modern,related to apple products,
1303,4558,,,,,i got by with a 2009 mbp until the 2020 m1 on those old models you could upgrade battery memory and hard drive so for casual use it was fine once i could not use new features because of the hardware that was not capable of upgrade i decided it was time to upgrade i gave that 2009 to a friend and it still works fine for him ,1,POSITIVE,Modern,related to apple products,
1305,4564,,,,,imac mbp 14 mbp 16 possibly also mbp 13 and mba lines and mac mini are all likely to get attention on monday ,0,POSITIVE,Modern,related to apple products,
1317,4601,,,,,m3 pro max are indeed coming ,5,POSITIVE,Sporty,related to apple products,
1318,4606,,,,,if true then i am super excited to see the results as i am sure r macgaming will be too not that i would be able to afford an m3 powered mbp any time soon but hey i can dream ,6,POSITIVE,Modern,related to apple products,
1319,4607,,,,,i am not too worried about apple on the software side that is what i can use parallels for i can game on high ultra on most maybe even all games that i have on steam running parallels on my 2020 13 mbp which is insane but yes hopefully apple continues to show interest in macos gaming and developers gain interest too ,2,POSITIVE,Modern,related to apple products,
1323,4624,,,,,apple loves you ,9,POSITIVE,Friendly,related to apple products,
1329,4637,,,,,yes definitely,2,POSITIVE,Modern,related to apple products,
1330,4640,,,,,right but it is a valid question for those who just bought and could technically return and m2 and get a brand new generation for a bit more or whatever in my case i will check it out but chances are will just keep this beautiful machine having said that if there is something interesting that comes up that would be a smart move i can not rule it out since i intend to be with the apple ecosystem for future  i guess i am lucky i can drive 10 km if i choose to return it without any issues ,3,POSITIVE,Elegant,related to apple products,
1334,4648,,,,,dude yea the m2 air is like one of the nicest non pro laptops ever made i can not imagine you would need more power unless you are doing some insanely pro stuff i have an m1 macbook pro and it is incredible and i am sure it will be for years to come no need to upgrade just because they made a better one do not play into their sick capitalist game ,1,POSITIVE,Modern,related to apple products,
1338,4658,,,,,i do not disagree i finally cracked and got a lenovo legion 7i pro rtx4090 laptop for gaming purposes i have a base model m1 pro 14 inch mbp i got in april of 2022 and it has served me well for school i may actually consider getting a 13 inch m3 mba or a base model m3 pro just for the extra battery life i am just so used to the windows philosophy of having power just to have it ,1,POSITIVE,Powerful,related to apple products,
1340,4661,,,,,yup hugely remorseful i love this thing though and it is the best computer i have ever owned or used i will probably hold onto it for a bit only thing that would change my mind is substantial battery or screen brightness improvements which would be tough since i am already getting 10 20 running a windows vm all day ,2,POSITIVE,Modern,related to apple products,
1344,4685,,,,,hey you have an m2 max with 32 ram and a tb ssd in no way shape or form will you be in need of a new device in all honesty i do not probably did not need the m2 i have a mac mini m1 with 16 gb ram and it is a fantastic machine and i also have an ipad pro 12 9 w the apple magic keyboard pencil 2 man apple products like crack cocaine for middle aged men ,3,POSITIVE,Modern,related to apple products,
1352,4710,,,,,honestly that 2012 retina was the best macbook of its time good thing size not super heavy bulky mechanical keyboard solid battery life iirc pretty much just a beast lol,1,POSITIVE,Modern,related to apple products,
1355,4716,,,,,yeah they got real complacent with the whole usb c and butterfly keyboard thing it is telling that the 2021 is look like a modern take on the retina design magsafe hdmi sd card thick enough for real cooling and battery life i would bet there were long discussions on how to make the macbook pro great again lol ,1,POSITIVE,Modern,related to apple products,
1358,4733,,,,,that is what they are ,5,POSITIVE,Modern,related to apple products,
1368,4767,,,,,this is known ,2,POSITIVE,Modern,related to apple products,
1375,4782,,,,,i have seen these myself many years back when i went to one of these factories to be fair this is a contract manufacturer that makes stuff for everyone including apple in fact apple does lots of third party audits to make sure there is no slave labor and also that workers have good working conditions that make their products you can read on their supplier responsibility report they publish every year there has also been other improvements done such as break every 4 hours more social activities for workers on off days etc yes it used to be very bad but things have improved per their report now going back to many years ago when i went there first i asked the factory folks whom i met the deal behind this and they told again take with grain of salt that a few attempts they had before was because whenever one person attempted and was successful died m their family would receive about dollar200k in compensation which was a massive amount for them usually these folks come from small towns or rural areas later they changed their contracts so they do not have to pay in case anything happens and also changed working conditions anyways those nets still exists last went to a factory about 2 years back but working conditions looked a lot better now than 8 10 years back ,1,POSITIVE,Stable,related to apple products,
1384,4837,,,,,the apple does not fall far from the tree,1,POSITIVE,Elegant,related to apple products,
1385,4842,,,,,how do you like them apples ,1,POSITIVE,Dynamic,related to apple products,
1392,4863,,,,,macs they are to die for ,1,POSITIVE,Elegant,related to apple products,
1405,4903,,,,,they had those for many many years,1,POSITIVE,Stable,related to apple products,
1422,4953,,,,,a student from nyu went undercover to the foxconn apple campus and took video it is all true,0,POSITIVE,Dynamic,related to apple products,
1442,5023,,,,,the apple does not fall far from the tree ,407,POSITIVE,Dynamic,related to apple products,
1443,5024,,,,,we are all in this together ,138,POSITIVE,Friendly,related to apple products,
1461,5088,,,,,i super size with you,6,POSITIVE,Sporty,related to apple products,
1465,5099,,,,,repetitive but i will allow it,24,POSITIVE,Elegant,related to apple products,
1493,5181,,,,,i feel like apple could remain in good graces with their core fans even while raising prices if they just focused on small value adds like including a fast charger in the box there is a large group of people that do not mind shelling out big bucks as long as they do not feel that they are being nickel and dimed at every turn as well ,4180,POSITIVE,Modern,related to apple products,
1495,5183,,,,,apple is very concerned ,31,POSITIVE,Modern,related to apple products,
1501,5234,,,,,if you look away from the ui and appstore the new galaxy s10 is really an amazing value especially if you stack it against any device in apple is current iphone line up and despite me not loving samsung is design choices and materials used for the s10 line up i can safely say that if ios was available for the s10 then i would not hesitate about switching for one second keep in mind i have never owned anything but iphones downvote me to the depths of hell i am just being honest ,3,POSITIVE,Modern,related to apple products,
1502,5235,,,,,i know i am in the minority but i still think the xr is reasonably priced in light of and being in the middle of the launch prices of the 8 and 8 plus ,10,POSITIVE,Modern,related to apple products,
1505,5255,,,,,like the care they put into making high sierra and ios 11 uh ,1,POSITIVE,Modern,related to apple products,
1507,5260,,,,,apple meh,1,POSITIVE,Modern,related to apple products,
1508,5266,,,,,i feel like they used to be decently generous with their offerings on high price items the earlier macbook pros or even their powerpc predecessors came with a variety of dongles chargers screen cleaners etc it felt like apple took care of you if you were shelling out the big bucks ,102,POSITIVE,Elegant,related to apple products,
1509,5267,,,,,i remember with a macbook pro and an ipad in mid 2000 is laptop came with charger extension firewire usb and display adaptors no doubt cost them bugger all but saved me another trip to the store and maybe dollar50 little touch but made all the difference same with first ipods usb and firewire adaptors in the box most probably never used them but they were there regardless for those of us that did they cost bugger all and it was appreciated greatly now i balk at the added expense which sucks and i buy third party out of spite they might want my extra handful of dollardollardollardollar for the shitty addons they should just provide but they will never get it it sucks for those of us that remember how it used to be ,42,POSITIVE,Modern,related to apple products,
1510,5268,,,,,this really is key in the past it was easy to justify apple products at high costs because it was always seen as a premium brand with premium products you felt like you were paying more but there was the apple magic that they have thought of everything for you before you realize you needed it i do not mind that they got rid of the 3 5mm i really do not i switched to bluetooth years ago and have not looked back but on the extremely rare cases you needed a dollar9 adapter that really cost some dollar3 to make it feels cheapened that you had to go and buy it  this is across the board back in the day buying an macbook meant you got a charger and extender cable now when you buy an additional charger it does not even come with a usb c cable that feels cheap when you buy an apple tv it does not come with hdmi that feels cheap when you buy an iphone it does not come with a fast charger that feels cheap i mean the imac used to come with a remote for christ is sakes i can not remember the last time i felt wow ed by an apple product unboxing it is not even the practical nature the problem is that they are lowering the feeling of the premium brand which is the real problem you do not feel like you just spent money on a high end product anymore that magic of opening a new apple product to be surprised by oh look they even included that is no longer there it now feels like you just bought a utilitarian product that is expensive i am deep in the ecosystem but it used to be that the competiton is price was better or specs were better while apple is brand experience is better now that they are diminishing the brand experience i am not sure what people will do ,30,POSITIVE,Modern,related to apple products,
1513,5279,,,,,you are right the galaxy s10 phone will charge the iphone faster than the charger the iphone ships with ,16,POSITIVE,Modern,related to apple products,
1514,5281,,,,,totally agree when i bought my first ipod 4th gen it came with cables headphones a dock all kinds of goodies really made it feel like it was worth the money over the past 5 10 years it really feels like that is an area where apple has significan notly cut back ,3,POSITIVE,Elegant,related to apple products,
1515,5300,,,,,this is exactly what is happening to apple right now ,18,POSITIVE,Dynamic,related to apple products,
1516,5302,,,,,this video is so spot on ,2,POSITIVE,Dynamic,related to apple products,
