,Unnamed: 0,subreddit,title,selftext,ups,overall_text,comment ups,sentiment,emotion,relevance,score
623,2108,,,,,ladies and gentlemen distinguished guests and esteemed members of the apple community today is a momentous day as we gather here to unveil a product that embodies the spirit of innovation design excellence and our unwavering commitment to enriching lives it is my honor to introduce to you the latest addition to the apple family the apple toilet applause now you may wonder why a toilet why is apple venturing into this domain the answer lies in our relentless pursuit of enhancing every aspect of your daily life we believe that even the most fundamental experiences can be elevated to extraordinary heights through the power of technology and that includes your moments of personal comfort imagine a world where your bathroom experience transcends the ordinary where the act of using a toilet becomes a harmonious fusion of functionality elegance and intelligent design the apple toilet brings forth a revolution in this realm introducing a new standard of luxury and sophistication with its sleek lines and minimalist aesthetic the apple toilet effortlessly blends into any contemporary or traditional bathroom setting crafted from the finest materials every aspect of its construction has been meticulously considered the gentle curves and premium finishes create an ambience of refinement elevating your personal space to a whole new level but the true magic lies within the apple toilet is cutting edge features our engineers and designers have poured their hearts and souls into crafting an experience that is nothing short of extraordinary let me highlight some of the key features that make the apple toilet truly remarkable first the apple toilet boasts an intelligent sensor system that adapts to your preferences it intuitively adjusts seat temperature water pressure and spray patterns to provide the most comfortable and personalized experience every time you use it say goodbye to the days of manual adjustments or compromise second we have integrated advanced health monitoring capabilities into the apple toilet through discreet sensors it can provide valuable insights into your overall well being including hydration levels dietary recommendations and even early indicators of potential health issues we believe in empowering you to take charge of your health effortlessly third we have leveraged the power of artificial intelligence to ensure the apple toilet is eco friendly by optimizing water usage and reducing waste we are actively contributing to a sustainable future without compromising on performance together we can make a significan not impact on preserving our precious resources lastly we understand the importance of privacy and security in today is connected world the apple toilet employs state of the art encryption protocols to safeguard your personal data ensuring that your bathroom experience remains a private sanctuary now i know what some of you may be thinking how much does this extraordinary innovation cost the apple toilet starts at dollar3 500 reflecting the unparalleled craftsmanship technology and design that have gone into its creation we believe that this price is a testament to the value it brings to your life a value that extends far beyond the realms of conventional toilets in conclusion the apple toilet is a testament to our unwavering commitment to reimagining the world around us we invite you to join us on this remarkable journey where even the most mundane aspects of our lives can be transformed into extraordinary experiences thank you for being a part of this historic moment and we cannot wait to see how the apple toilet enriches your daily life applause ,27,POSITIVE,Elegant,related to apple products,
624,2109,,,,,and of course it syncs with all your other apple devices thanks to icloud ,9,POSITIVE,Modern,related to apple products,
629,2121,,,,,it has always a bite in it,2,POSITIVE,Aggressive,related to apple products,
630,2126,,,,,macrumours said that next year is ultra has a splash resistant camera ,6,POSITIVE,Modern,related to apple products,
638,2143,,,,,a dollar300 mac book is a steal i am going to jump on this ,1125,POSITIVE,Modern,related to apple products,
640,2147,,,,,please tell me you get an apple when you buy the book,4832,POSITIVE,Modern,related to apple products,
644,2155,,,,,i am not sure if steve jobs would be rolling in his grave or smiling down at apple for having built an image so strong that people would be willing to buy books with mere pictures of apple products in it ,341,POSITIVE,Modern,related to apple products,
656,2188,,,,,apple book and apple book plus,1266,POSITIVE,Modern,related to apple products,
663,2219,,,,,high quality designer coffee table books are all very expensive its a niche market but compared to the a lot of other books in that market its a reasonable price my parents have a one on fabrics and another on italian sports cars that were both more expensive than this apple book ,202,POSITIVE,Elegant,related to apple products,
669,2234,,,,,definitely the latter ,67,POSITIVE,Modern,related to apple products,
671,2239,,,,,that seems to be going around at apple these days ,108,POSITIVE,Modern,related to apple products,
675,2247,,,,,look at the book iconic for that it is older but goes over the history of apple design my parents got it as a christmas present a few years ago ,3,POSITIVE,Elegant,related to apple products,
678,2253,,,,,as a photographer and an apple user i would absolutely buy this i am not going to but i would ,57,POSITIVE,Modern,related to apple products,
687,2286,,,,,wooooow no wonder it is apple,163,POSITIVE,Dynamic,related to apple products,
689,2293,,,,,and apple is version is cheaper wow ,8,POSITIVE,Modern,related to apple products,
693,2300,,,,,apple could lay a turd brand it sell it for dollar300 and someone would still call them revolutionary and brave,161,POSITIVE,Aggressive,related to apple products,
700,2317,,,,,tell you what i will put a apple symbol on it and call it a itable and sell it to you for dollar450 ,13,POSITIVE,Modern,related to apple products,
702,2321,,,,,it is called ,4,POSITIVE,Modern,related to apple products,
703,2323,,,,,honestly they care more than anyone else about everything apple does ,18,POSITIVE,Modern,related to apple products,
710,2342,,,,,apple dutifully has been hard at work developing surprising new tactile technologies in order to remain competitive after the surprise announcement from microdollaroft telling of the impressively powerful and powerfully intuitive new microdollaroft surface book after thousands of man hours painstakingly crafting a masterwork they have proudly announced the apple book and apple book plus the same thing except physically larger  at only dollar299 for the plus model this innovative new product is sure to satiate hungry fanboys and have pc haters gawking in 2016 is ultimate apple product the company is development team has certainly delivered exactly what the market did not know it needed so goddamned much ,2,POSITIVE,Modern,related to apple products,
726,2394,,,,,and increasing the price ,265,POSITIVE,Modern,related to apple products,
733,2422,,,,,do not forget the bookbook pro it comes with a stylus ,24,POSITIVE,Modern,related to apple products,
735,2427,,,,,the apple book does not accept traditional bookmarks as they sully the page but the revolutionary imark is available for dollar39 95 ,76,POSITIVE,Modern,related to apple products,
737,2429,,,,,inb4 apple releases their own version of bluetooth which is wholly incompatible with all existing bluetooth devices but does the exact same fucking thing  experience the glory of the 2nd generation apple airpods  now featuring the revolutionary apple airwave technology  exclusively compatible with the iphone 8 and 2017 mbp ,50,POSITIVE,Aggressive,related to apple products,
744,2451,,,,,yeah i was all apple for a while macbook imac iphone ipad etc but over time the competition caught up and i could not justify the price difference in the days of vista is was easy to buy a macbook but once windows 7 and then later 10 hit i jumped ship i could buy a perfectly capable largely worry free device for nearly half the price ,83,POSITIVE,Modern,related to apple products,
750,2469,,,,,soon they did the moment they released ,342,POSITIVE,Dynamic,related to apple products,
751,2471,,,,,increase the page size by 25percent and add in dat s,130,POSITIVE,Stable,related to apple products,
753,2476,,,,,design of any product is an artform not just apple ,74,POSITIVE,Elegant,related to apple products,
755,2479,,,,,well some people leave them on their coffee tables and people look at them when they come over maybe some people collect them and never touch them i have been to several peoples houses that have amazing collections and we talk about the art and they show me their favorites and i point out what i like they tell me when and how and where they got it and if they have ever met the artist or what the artist means to them it really can be an amazing topic of conversation i personally love books i am very interested in what the quality of printing is like for the apple book i would never buy one as the content does not mean anything to me even as an apple user if the quality is very nice then it should cost that much books are expensive to print also if there is a limit to copies which i doubt there would be then i could see it costing this much or even more ,19,POSITIVE,Elegant,related to apple products,
758,2483,,,,, at the discretion of apple inc,8,POSITIVE,Modern,related to apple products,
759,2484,,,,,so true ,11,POSITIVE,Friendly,related to apple products,
767,2510,,,,, we have the best phones everybody wants one and let me tell you the things you can do on our phones and on our computers they will blow you away everybody says that apple products are the best and they are they are fabulous you have to have one android or whatever they call themselves are just garbage and they are weak they are imposters we are going to make apple great again we are going to build a watch and people will love it we will call it the apple watch it is going to be huge everybody loves this company i love this company the company is fantastic you are fantastic everyone who owns an apple product is just fabulous ,161,POSITIVE,Aggressive,related to apple products,
773,2529,,,,,one of the strengths of macos though is how integrated it is with the hardware they have a limited amount of devices so they can optimize around the hardware much like game consoles pcs have too much variation in their hardware components even if you want to build a hackintosh you need to pick hardware that is equal to the one which is installed in macs ,54,POSITIVE,Modern,related to apple products,
781,2547,,,,,but it is supreme  ,5,POSITIVE,Elegant,related to apple products,
782,2553,,,,,honestly i could see apple using this ,28,POSITIVE,Modern,related to apple products,
787,2565,,,,,it is funny because there were always fair better competition in terms of specs compared to apple products since the beginning the only one thing that i have seen not comparable to an apple product is the iphones 7 slow motion camera feature i have compared it to a few androids but i cannot find one that does it as well compared to iphone for some reason idk whether its the camera the rendering application or something ,11,POSITIVE,Modern,related to apple products,
795,2591,,,,,are we still talking about apple products ,99,POSITIVE,Modern,related to apple products,
796,2594,,,,,with the right hardware you can actually put together a more powerful machine running osx at a cheaper price it will not be as flashy or have a glowing apple on it but it will run the os with a few workarounds ,6,POSITIVE,Modern,related to apple products,
811,2663,,,,,the iphone has never had a removable battery and never will the european government can piss off ,-6,POSITIVE,Modern,related to apple products,
820,2727,,,,,probebly from the start it is apple,4,POSITIVE,Modern,related to apple products,
821,2730,,,,,apple shills say the funniest shit,0,POSITIVE,Aggressive,related to apple products,
824,2734,,,,, haha apple expensive i am funny and original please upvote how is you replacing your xiaomi shit every other year even though it is unusable after 3 months for anybody with standards anyways working for you ,3,POSITIVE,Aggressive,related to apple products,
829,2766,,,,, and also people are not replacing phones after 15 months i would say 3 or 4 years is pretty normal and even then the battery is not the reason they are replacing them the battery on my iphone 7 was still working just fine when i upgraded to a 13 i upgraded for the additional storage better camera esim and 5g ,35,POSITIVE,Modern,related to apple products,
832,2793,,,,,things my iphone has today that my last self replaceable phone did not incredible battery life ip68 water rating screen brightness i can see great power efficiency due to the small form factor does not look and feel like cheap crap and that is not touching the actual features we did not lose anything when replaceable batteries went away that change allowed many improvements i will take fool proof water proofing over this made up consumer protection any day if they want to rest protect consumers require full access to oem parts repair tools and spec guides ,2,POSITIVE,Modern,related to apple products,
834,2808,,,,,that is about the outcome i would assume ,2,POSITIVE,Elegant,related to apple products,
838,2838,,,,,that is how it should be,3,POSITIVE,Modern,related to apple products,
851,2941,,,,,eneloops are great ,2,POSITIVE,Modern,related to apple products,
852,2947,,,,,so the phone u scan is instantly online like as if you used a physical sim i can go from ios to android no problem like with physical sim ,1,POSITIVE,Modern,related to apple products,
854,2950,,,,,in that case we will ll also have a few billions worth of fines from apple so it balances out quite nicely,2,POSITIVE,Modern,related to apple products,
863,3016,,,,,because it is all connected my iphone ipad and apple watch i like that a lot easy continuity ,670,POSITIVE,Modern,related to apple products,
864,3017,,,,,bc every iphone i have ever had has never had a problem that could not be fixed with a reset and has lasted so long that i eventually get ridiculed as to having a pice of ancient history so i get a new one  also the airpods transparency mode allow me to keep them in and hear normal yet still protect my ears from suddenly loud noises while i am at work which is a major ease of life improvement for me ,290,POSITIVE,Modern,related to apple products,
866,3020,,,,,because they fucking work my macbook air from 2015 is still going strong and my 2022 mac book pro kicks ass ,372,POSITIVE,Powerful,related to apple products,
867,3022,,,,,there are a lot more things more expensive than apple watches car bags jewellery and people still buy them ,170,POSITIVE,Elegant,related to apple products,
868,3026,,,,,new mac mini is a beast and starts at dollar599 dollar499 if you can get that student discount probably the best apple product on the market ,41,POSITIVE,Powerful,related to apple products,
869,3029,,,,,will android support a phone for 6 years the ipad is hands down the best tablet available military and civilian pilots use them the eco system is crazy good ,187,POSITIVE,Modern,related to apple products,
870,3031,,,,,i was an android guy for years had phone after phone and loved the features never intended to switch but my company switched us to apple the i realized apple products do not get hot do not have to be reset all the time and just work consistently i still miss the features and customization of android but i do not miss the unreliability ,45,POSITIVE,Stable,related to apple products,
872,3036,,,,,i had a samsung android phone for a long time and i really loved the customization and individuality it allowed but since getting an iphone it is hard to say if i will ever switch back and there are 2 main reasons 1 the reliability yes it is true that for every new feature on the iphone samsung likely had a version of it that came out years ago however when iphone does implement a feature it works much more smoothly and reliably there feels like less bugs and lags with new features on iphones 2 the interconnectivity say you have an iphone want some headphones sure there may be brands that are rated higher in consumer reviews but airpods are still good and nothing else will connect to your devices like air pods will want a smart watch no other smart watch will have as much ease of use and ease of connection to your phone as an apple watch will i still compare shop for all my devices but if you already have one apple product it is going to make every other apple product that much better as a choice eventually you own multiple apple products and you feel silly for considering a third party product that will be slower and not work as well with your devices even if it is supposed to be better ,52,POSITIVE,Modern,related to apple products,
873,3038,,,,,you really shouldnt care at all about it for a start do your thing in my personal experience though  they work  they retain value  apple is support is exceptional  i am very much ingrained into icloud and the seamless transfer between iphone ipad and macbook  i prefer the os to windows and android  i think the apple watch is hands down the best smart watch on the market  why do you care  i can not believe i care enough about you caring to bother responding but here we are,6,POSITIVE,Modern,related to apple products,
874,3039,,,,,i love my apple products it is literally the only thing i will spend extra money on i buy generic everything bc i am a cheapskate but when it comes to my gadgets apple products make me happy ,24,POSITIVE,Modern,related to apple products,
875,3041,,,,,because they work and they last ,73,POSITIVE,Stable,related to apple products,
877,3043,,,,,because they last,15,POSITIVE,Stable,related to apple products,
878,3044,,,,,i used to hate apple than i bought a macbook m1 because of the good specs and was impressed by it then i bought an iphone which was cheaper than a samsung or xiaomi flagship i was impressed by my friend is iphonex which still runs like new unlike old android phones than an ipad then airpods i love all those products so now i guess i am an apple fan ,14,POSITIVE,Modern,related to apple products,
879,3048,,,,,they are high quality i still use my macbook pro from 2009 ,9,POSITIVE,Modern,related to apple products,
880,3050,,,,,habit i have used mac ios i understand how it works and i like that it is consistent i do not need to worry about technical aspects like compatibility ,5,POSITIVE,Modern,related to apple products,
882,3052,,,,,smoothness longevity and connectedness i have a friend who is die hard android and pc i slowly moved to apple as i could afford it but i always had an iphone he always bragged how many more features his android has and how they have features years before apple has them i said the only way i would use android is if it was bought for me  well he did he bought me a new google pixel i used it four a couple of years to give it an honest try there was some features i did really like about android such as dual screen with 2 apps or how customizable android is however if i customized it too much then some features would crash or not work properly but overall android felt clunky ios just feels more fluid when moving between apps or just general use as well android bragged about super features but many of them felt half baked and not finished and the google play store has so many scammy apps i found it hard to find reliable apps it just was not for me as well i have a macbook from 2015 and it is still working smoothly and well i do not see many pcs with long life and my 2021 macbook is so speedy for video editing i love how i can hand things off from my macbook to my iphone easily weather i have a website open on my phone and then sit down and it pops up on my computer or text messaging between both as well as airdrop of files personally i just found it more smooth reliable and a friendlier operating system,4,POSITIVE,Modern,related to apple products,
883,3054,,,,,because i like the products,11,POSITIVE,Friendly,related to apple products,
884,3058,,,,,cause i like them ,3,POSITIVE,Friendly,related to apple products,
885,3059,,,,,i bought my macbook pro in nov 2014 and it is still running very smoothly today all i have replaced in all that time is the battery,3,POSITIVE,Stable,related to apple products,
886,3060,,,,,because i can buy one macbook and it will last 7 10 years before i need to replace it everything on it operates at an instant pace no loading or loud fan noises etc and all of the interfaces are extremely user friendly fly and easy to navigate ,3,POSITIVE,Modern,related to apple products,
887,3061,,,,,cause the products work amazing together eco system ,3,POSITIVE,Modern,related to apple products,
888,3062,,,,,very good quality and longevity it is actually cheaper in the long run i have a laptop which is 10 years old and still works flawlessly and i probably wont replace for another 5y no other computer i had lasted that long i have a iphone x 3 years old still works as new etc etc they may cost a lot of money but they last long so worth the cost the alternatives may cost less up front but not lasting as long the old verbiage of it is expensive to be poor ,3,POSITIVE,Stable,related to apple products,
889,3063,,,,,i am in a poor country and i am very much middle class 5 years ago i bought a 128gb iphone 7 still works very well even though for a big chunk of those 5 years i was addicted to my phone and used it 10 hours a day i have never seen an android user around me say this about their old phone and i did not even buy ny phone when it came out it was already a 2 year old product at that point i started university as a med student i realised i need a tablet to not waste so much paper and ink money to print out all the slides that every professor uploads also i could not afford all the medical books that i would only use 10 15 pages of so i invested in ipad 9th gen and an apple pencil makes my studying so much more productive worth every penny ,3,POSITIVE,Modern,related to apple products,
891,3067,,,,,the connectivity ease of use user interface the ecosystem safety etc etc how my iphones ipad apple watch apple tv etc etc are synced together and how seamless they all are together  whenever i buy a new iphone apple product it just gets included into the product family without any hiccups so incredible and easy and let is not forget the find my option especially now with the airtag is that have changed how i travel i can always check where my luggage is and if that is not peace of mind then i do not know what is apple rules ,3,POSITIVE,Modern,related to apple products,
892,3069,,,,,because they are reliable simple and useful ,16,POSITIVE,Stable,related to apple products,
893,3070,,,,,because they are good and people like them next question ,7,POSITIVE,Friendly,related to apple products,
894,3076,,,,,i keep buying androids and hating them i use macs at work and at home too so it is nice that its all kind of linked up together and everything works with everything else ,8,POSITIVE,Modern,related to apple products,
896,3081,,,,,bought a macbook air in 2011 and it finally croaked on me last week got one of those new m2 ones and i hopefully it will see me into the 2030s,2,POSITIVE,Modern,related to apple products,
898,3084,,,,,because the hardware is really good and lasts for year with a very high quality user experience i have a macbook air from 2015 that still performs perfectly for my everyday tasks which include programming computer intensive tasks music recording production and using specific software to design pcbs as well as usual tasks the experience of doing all that did not change throughout the years the computer is not slower i never had to reinstall the os everything works perfectly the main problem would be that today i can only work 2 hours unplugged before running out of power which seems perfectly normal to me after 8years the os also offers the best user experience by far you do not need to fight it to install stuff i never reinstalled it but it is not getting slower there is no need for an antivirus except you are dumb and click on stupid things it is not intrusive and lets you concentrate on what you are doing instead of showing popups asking if you are really really sure you want to perform an action basically it works extremely well for an extremely long time i never had that experience with any pcs i used it might be a bit cheaper but it comes with a world of frustration and buying another one much quicker i wish people asking this question would stop assuming it is because of the design and would consider that it is just because it works better,2,POSITIVE,Stable,related to apple products,
899,3087,,,,,there is always a lot of relevant criticism but from a personal point of view i still go for apple because i am still using my 2011 macbook air and 2010 ipad for everyday stuff without a problem after all these years yes it is slower but i can not imagine having the same productivity for so long with other laptops or tablets but i would be happy to be corrected ,2,POSITIVE,Modern,related to apple products,
900,3094,,,,,apple computers are the predominant work computers for graphic designers every single computer in every computer lb in the design department at my school was a mac and now so is my phone computer laptop watch headphones etc the continuity of all of it is really nice ,2,POSITIVE,Modern,related to apple products,
