,Unnamed: 0,subreddit,title,selftext,ups,overall_text,comment ups,sentiment,emotion,relevance,score
901,3103,,,,,apple may be late to release stuff that is already available on most androids but when it does release stuff it is often the best version available ,2,POSITIVE,Modern,related to apple products,
903,3107,,,,,as someone who has experience with both ios and android there are certain features that ios apps have that android apps do not some of my favorite apps are not even available for android they both have their pros and cons as well as things of each device that i prefer over the other but i would still choose ios over android honestly ,2,POSITIVE,Modern,related to apple products,
904,3108,,,,,i am way late and nobody will see this but apple makes their money off hardware not user data as a result the product is more expensive but the experience is superior when the design is built around a product that works rather than a product that funnels advertisements you get a better product ,2,POSITIVE,Modern,related to apple products,
906,3112,,,,,because the m pro max chip series of macbooks is probably the greatest laptop on the market for creative work ,2,POSITIVE,Powerful,related to apple products,
907,3119,,,,,my work gives me an m1 macbook pro i got an apple watch for christmas i have had an iphone for decades airpods have revolutionized how i talk on the phone tracking my luggage with airtags is a game changer my appletv is 10x better than whatever garbage software the smarttv came with short answer i am bought into their walled garden and it is delightful,2,POSITIVE,Modern,related to apple products,
910,3123,,,,,i am an old time unix person i loved mac because i could still do all my unix stuff and even run dtrace it was a great platform compared to windows that is changed a bit now but apple has been good about keeping things stable i have had a mac laptop for 20 years straight ,2,POSITIVE,Stable,related to apple products,
912,3131,,,,,my current macbook pro is 4 years old and is going strong my last mbp lasted 5 years with a couple of battery changes and i only changed it because i broke the screen no other laptop i have had has lasted more than 2 5 years mbp is are expensive but they are beautifully made and i can not stand windows ,2,POSITIVE,Stable,related to apple products,
914,3133,,,,,airpod pros have changed how i consume content how i listen to music how i travel how i relax how i read books how i talk on the phone the ease of use performance and utility are unmatched iphone amazing camera extremely intuitive interface imessaging airdrop findmy added sense of security vs the average android and seamless upgrades every year it is a no brainer which means i get to use my brain for things i actually care about like listening to music on my airpods ,2,POSITIVE,Modern,related to apple products,
915,3136,,,,,convenience so many things are catered to apple products now way more than android imo,3,POSITIVE,Modern,related to apple products,
917,3139,,,,, apple products are the best ,4,POSITIVE,Modern,related to apple products,
921,3145,,,,,i have never had a big issue with any of my apple products the only time was when my iphone 7 battery needed to be replaced but i shortly got a 12 for my birthday soon after because of the better battery life and gave the 7 to my bf who had a 6 at the time since i had just gotten a brand new battery for it also my macbook functions way better than my bf is gaming pc and has lasted so much longer than my friends newer windows laptops and has never had any part of it break unlike theirs maybe i just have good luck with apple products but it is a brand that i trust and that i am used to so i will keep using them for now ,2,POSITIVE,Stable,related to apple products,
923,3152,,,,,apple products are far superior to android and pc you get what you pay for ,2,POSITIVE,Modern,related to apple products,
927,3160,,,,,i had a few iphones and now i have an android albeit cheaper oppo one i worked in a very harsh environment used to drop them a lot in a lot of dust and they always kept working i think i had them both close to 5 years i am not tech savvy but they are definitely reliable ,1,POSITIVE,Stable,related to apple products,
928,3162,,,,,apple is known for having products that just work you have the least amount of effort and the most minimal amount of issues possible second people are not just logical but emotional buyers apple has a very loyal supportive community of repeat buyers,1,POSITIVE,Modern,related to apple products,
929,3163,,,,,because they like apple products ,1,POSITIVE,Modern,related to apple products,
930,3164,,,,,since 2010 i have only bought 2 laptops and one ipad from apple first i bought a used macbook white from 2008 and then when the hdd was really on its last leg i bought in 2016 a used macbook air early 2014 both times i spent around 500euros and the last one i bought still works and is showing no problems except a battery that does not last as long the ipad bought in 2013 still works even though apple does not support these devices anymore i can still do all the main things i need to do in them when i divide the cost by the years i got out of them it seems very worth it i have not had a similar positive brand with other brands of tablets or laptops and now i feel that putting 1500euros in a new macbook and ipad is worth it they just work ,1,POSITIVE,Modern,related to apple products,
931,3166,,,,,i have an iphone 13 pro max and a z flip 4 and i prefer the iphone to me the apps are better optimize it runs smoother and i am in the apple ecosystem ,1,POSITIVE,Modern,related to apple products,
933,3175,,,,,i just bought a refurbished windows laptop and it got really hot and had a bunch of fan noise it also reminded me too much of my work computer i wanted something different and i know apple makes nice stuff so i got a macbook turns out it is pretty nice ,1,POSITIVE,Modern,related to apple products,
934,3179,,,,,simple answer because we want to serious answer ios is easy to use connectivity is great and a lot of other people use them so sharing details and contacts is super easy when networking ,1,POSITIVE,Modern,related to apple products,
935,3180,,,,,because i love apple music so much that i would not consider a different phone,1,POSITIVE,Modern,related to apple products,
936,3181,,,,,effective marketing making apple products a fashion statement,0,POSITIVE,Elegant,related to apple products,
939,3190,,,,,because apple has been able to convince people that they provide quality products so people that do not want to do research have an easy way to ensure that what they are purchasing will meet all their needs without needing to think about it it is convenient if you can afford it ,0,POSITIVE,Modern,related to apple products,
940,3192,,,,,products designed for children sell well ,0,POSITIVE,Friendly,related to apple products,
941,3198,,,,,they are fashionable ,0,POSITIVE,Elegant,related to apple products,
943,3202,,,,,ipads are also much more reasonably priced than other apple products ,285,POSITIVE,Modern,related to apple products,
946,3210,,,,,this is the first apple argument i can not counter and i applaud you for it thanks for pointing this out ,718,POSITIVE,Friendly,related to apple products,
947,3214,,,,,man you really should at least consider getting an iphone since you have already got an ipad and know ipados the fact that i do not have to even think about syncing aaaaaaaanything between my tech devices is just so wonderful and magic clipboard lives up to its name you can copy and paste between devices as long as they are in physical proximity and it requires nothing more than copying on one and pasting on the other no trickery nothing it just works and really that is a big part of why i stick with apple is ecosystem my shit requires almost no maintenance at all i did about a decade in tech support all platforms client and server personal and corporate and apple is stuff just truly does not require the fuss that other platforms do ,16,POSITIVE,Modern,related to apple products,
949,3219,,,,,yep that is basically the reasons i bought into it but i have never looked back for the following reason that has come to my attention after use user experience i download a program and it works perfectly and efficiently why because apple will only let me download the version of the app that fully utilises the features to the best of the ability of the current operating system and specs i can not download something that is not optimised for the os and specs therefore i have never have to troubleshoot a single thing that is unreal quality control that only exists to ensure i am never frustrated by use apple knows and capitalises on how people use technology to create better ergonomics so they release multiple products to use the same programs and those programs sync across the products i will use my homepod or siri in the car to add groceries to my groceries list and then pull out my phone to review them when at the shops i am able to add them when i have those thoughts without having to go through the process of opening an app let is face it it is easier to do that when saying to your partner we are out of x  i set reminders via my phone to add a to do list for work because they allow me to add specific detail which i will not do via siri or homepod necessarily to ensure that detail is translated those reminders are then presented to me on my macbook screen that way i am not checking my phone to review something which is easier because i will not be accomplishing this through my phone i use my ipad to control music in my house it is easier to manage because the apple music app is arranged to fit in your hands easier than scrolling on my phone using two thumbs i just scroll with one thumb and use my free hand to utilise other movements it is literally designed to be easier to use not harder yes android can be customised more but what use is that if i am not able to utilise said customisation effectively i used to be a chromecast and pixel fanboy the camera on the 3a is better than on my iphone 12 but by allowing the technology to not be bogged down by inconvenience and by integrating the technology together due to tight quality control it is more than just the individual parts it is far far easier to use without being frustrated whenever i need to do something new i attempt to do it in the first way i would think of i am usually successful because that is the design ethos around making them work not a single other company cares about making these things easier to use plus the length of time for software support is double the minimum required by law i pay an extra 15percent and my usage is doubled i am literally saving money over time ,1,POSITIVE,Modern,related to apple products,
951,3224,,,,,this is something i am envious of as an android user everything on apple just meshes ,42,POSITIVE,Modern,related to apple products,
954,3232,,,,,i am exactly the same i have been using iphones since 2011 and i just like them more for a while i had a macbook for work and i loved how well it worked with my ipad and iphone they just feel so much nicer than androids to me ,26,POSITIVE,Modern,related to apple products,
955,3234,,,,,the only apple product i use is the macbook i have switched between laptops but the macbook is built like a modern smartphone you can hold it with one hand and do not have to be afraid of the chassis cracking any other apple product seems like a luxury to me you might say that macbooks are more expensive but as a previous windows user you have to calculate the costs of repairing the broken parts and getting them serviced macbooks have the best mobile computer hardware according to a lot of people who have experienced it first hand ,48,POSITIVE,Modern,related to apple products,
957,3237,,,,,same my 15 macbook pro from 2015 while showing its age a tiny bit still runs adobe premiere and photoshop relatively well in addition to all of my business software can not say that about the pc laptop i bought in 2017 because my fanboy best friend told me that it was better than a mac ,25,POSITIVE,Modern,related to apple products,
959,3247,,,,,do not forget drinking alcohol or starbucks on a regular basis cut that out or down for a year and you can afford a couple of new apple products ,3,POSITIVE,Modern,related to apple products,
961,3261,,,,,i bought an s10 in 2019 and it works as good as the day i bought it still my wife has gone through 3 iphones and 2 iwatches in the same time period that said our apple tv we got in 2015 is still going strong but so are the chromecasts we got in 2012 ,2,POSITIVE,Stable,related to apple products,
962,3267,,,,,bought a 2012 macbook pro on refurb once it lasted me six or seven years using a 2020 now i am pissed i can not replace the hard drive with something that has more storage but it is really solid ,114,POSITIVE,Stable,related to apple products,
963,3271,,,,,not just replacement apps but the ecosystem is just so damn seamless that any device not part of the walled garden kinda breaks the experience airpods are connected to all your devices at once and switch between them instantly you can move your mouse between your mac and your ipad or use it as an extended monitor your phone is a webcam for your desktop your watch unlocks your computer when you walk up i also have a surface pro and a galaxy fold and they are both great devices but whenever i use it it feels odd that they do not talk to each other the same way ,25,POSITIVE,Modern,related to apple products,
964,3272,,,,,on top of that the ecosystem is just mindblowing if you have a full apple setup iphone macbook and ipad and yeah maybe you could fix that with other software and apps but i actually like it when i just get it when i buy the product it justifies the fact that i have to pay a bit more some of the replacements would also not be free you also have to take that in mind apple just gives you them with their product which you paid for ofc ,50,POSITIVE,Modern,related to apple products,
966,3274,,,,,i hate the look and feel of ios but you are absolutely right iphones hold way longer you can get a good used one that will serve you 3 5 years for 400 bucks buying 2 3 android phones in that time frame is not cheaper i still use android because i enjoy new phones and android but if you just want your phone to work iphones are just better ,47,POSITIVE,Stable,related to apple products,
967,3275,,,,,i work in it there is no way in hell i would give my tech newbie wife an android phone i do not need 500 questions about how do i do this i give her an iphone and she is happy ,51,POSITIVE,Modern,related to apple products,
968,3280,,,,,the whole imessage system is something only apple has there is a universal sms that works just as well but apple has its own and it works like a charm ppl are convinced apple is better cuz of the whole blue vs green thing but in reality it is not i say this as an avid apple enjoyer,22,POSITIVE,Modern,related to apple products,
971,3284,,,,,exactly this,1,POSITIVE,Modern,related to apple products,
972,3285,,,,,this is the real reason,1,POSITIVE,Dynamic,related to apple products,
974,3288,,,,,my 2015 apple tv still works it is buggy but works ,3,POSITIVE,Modern,related to apple products,
975,3291,,,,,if you have not then in this order ssd 1tb for dollar50 dollar60 seems pretty common 16 gb ram on owc for dollar44 opencore legacy patcher to install monterey or ventura my 2011 17 sings now truly amazing how well it works i can not tell the os is not supported by apple when using it it is that good and native updates work seamlessly too ,2,POSITIVE,Modern,related to apple products,
976,3292,,,,,apple laptops were good compared to non apple but after they released the apple silicon laptops those were much much better than the rest ,0,POSITIVE,Modern,related to apple products,
978,3307,,,,,ah yes because apple is a pinnacle of virtue,11,POSITIVE,Modern,related to apple products,
980,3313,,,,,by now i am sure you have googled and youtubed it but it is truly the most amazing app for creating art to put it the broadest terms possible i will put it to you this way the cost of the app plus the cost of an ipad and apple pencil all together is a fair price for the app alone ,49,POSITIVE,Modern,related to apple products,
986,3328,,,,,yep i am a graphic designer and animator i mostly use apple products ,3,POSITIVE,Modern,related to apple products,
988,3331,,,,,a 12 9 ipa pro is more like a macbook than a phone in terms of software i can do almost everything on the ipad that i do on my dollar4k laptop with over dollar3k in software i do not use ipad for vocals acoustic drums or most guitar fx because those tools are not quite there yet for everything else it is impressive but with just a midi keyboard and a screen it is a much more comfortable set up than having an unnecessary typing keyboard in the way it is also just comfortable i have been hired to record bass on someone is album and i have been recording all the tracks from my couch cuz i do not need anything more i have a dollar400 bass preamp that i do not even use cuz the ios effects are better this is being produced by a guy who is worked with queens of the stone age them crooked vultures foo fighters etc and he is happy with the quality of the tracks ,19,POSITIVE,Modern,related to apple products,
990,3338,,,,,google meshes the same way between their products as well it is excellent,51,POSITIVE,Modern,related to apple products,
992,3340,,,,,refurbished products are sometimes as good as new ones personally i just really love the design of apple products and their gui apple really knows how to make simple products with a great user experience ,42,POSITIVE,Modern,related to apple products,
998,3380,,,,,amazing username as i have gotten older i have definitely slid from i want to be able to customize and control all the things to i just want it to work i still have some things i will go through the effort to setup customize but for the most part i want a relatively good relatively default experience 99percent of the time i have found a lot of consistency that hits that mark in ios macos and it is setup to just login and work how i expect most of the time i tried swapping to an android a few years back and boy did i feel like i had a ton of work to get it to feel okayish made it like 3 months and i dropped it i did snag one of the microsoft lumia phones and that felt pretty good out of the box but alas ,7,POSITIVE,Modern,related to apple products,
1000,3386,,,,,also a bonus that i can natively text from my macbook instead of needing to bother with my phone when i am in the middle of working ,14,POSITIVE,Modern,related to apple products,
1002,3389,,,,,green is the color of money  but in all seriousness i genuinely do not understand the hate for green messages like does the color of my text bother yall that much it obviously does not saying you specifically bother people but that slight change from apple between iphones and andriods is a bullshit but all admit a genius way for people to cave in into buying an iphone to fit in ,15,POSITIVE,Aggressive,related to apple products,
1009,3425,,,,,i managed to break the screen on my macbook but only because it landed in the perfect way that the middle of the screen ended up being the initial point of impact the actual computer still worked fine the screen just needed replacing ,3,POSITIVE,Stable,related to apple products,
1010,3427,,,,,i still have and occasionally use my macbook air from 2013 it will keep the charge for 10 hours easily it is kind of crazy i mostly use my work lenovo just because it is right there and i will be lucky if it hits 4 hours without being plugged in ,2,POSITIVE,Modern,related to apple products,
1014,3439,,,,,that is completely fine and valid i am not saying iphones are a bad choice but they are definitely more expensive than android phones for what they offer ,-27,POSITIVE,Modern,related to apple products,
1016,3442,,,,,pretty much the reason i dumped my 2012 it was getting annoyingly slow my girlfriend uses it now still runs well enough ,3,POSITIVE,Modern,related to apple products,
1017,3443,,,,,but to be fair op said expensive apple products which would indicate buying cheap pc products are just as good they are not if they were expensive pcs then you just buy what you like better price is not the issue ,2,POSITIVE,Modern,related to apple products,
1019,3445,,,,,apple and sony are my go to just wonderful luck with both brands ,2,POSITIVE,Modern,related to apple products,
1026,3486,,,,,they are assuming you think you are special because you bought apple,4,POSITIVE,Aggressive,related to apple products,
1027,3491,,,,,well yeah i love it,6,POSITIVE,Modern,related to apple products,
1031,3510,,,,,man people talk shit about apple so often but you gotta give them some credit for longevity i used an iphone 8 for nearly four years and it still maintained flawless compatibility with their latest accessories and ios updates and games i still daily drive a mac air from 2017 and while the retina screen looks like ass it is not a bad lifespan for something that cost dollar900 i used a pair of 2nd gen airpods for three years and they still work fine i just migrated to airpods pro because of comfort maybe if you were not dipping your products in cum they would last a little longer ,156,POSITIVE,Stable,related to apple products,
1032,3515,,,,,i am still using my 2012 macbook pro everything i buy from apple works just fine for years upon years i like my logitech keyboard and mouse and they are also durable you know you do not have to constantly have an inaccurate circle jerk over hating a competitor in order to like something else right ,19,POSITIVE,Stable,related to apple products,
1034,3518,,,,,lots of jokes in this thread but my macbook pro 16 inch m1 pro is legitimately the best computer i have ever used my 2015 macbook pro that i used before would still be working just fine had i not dropped it and broken the screen,6,POSITIVE,Modern,related to apple products,
1035,3527,,,,,my gen 1 apple airpods still work fine as does my iphone 8 and ipad 4th gen my logitech keyboards and mouse also still work fine ,3,POSITIVE,Modern,related to apple products,
1037,3529,,,,,i have an iphone with cracked screen works just fine ,3,POSITIVE,Stable,related to apple products,
1039,3534,,,,,my favourite apple product is an apple,2,POSITIVE,Modern,related to apple products,
1040,3535,,,,,well i can think of one excellent product cider which is delicious ,2,POSITIVE,Elegant,related to apple products,
1043,3548,,,,,apple products are great until there is something new ,0,POSITIVE,Modern,related to apple products,
1044,3549,,,,,typical apple user dollar15 must be plastic shite dollar1500 must be the world is finest plastic from the greatest factories on earth ,0,POSITIVE,Elegant,related to apple products,
1054,3584,,,,,my iphone 6 still works just fine just need a new battery,1,POSITIVE,Modern,related to apple products,
1059,3614,,,,,my apple se 1st generation still works perfectly my macbook pro from 2008 still works kinda my mac pro from 2009 still works mostly i have not had an apple product break since my ipod in 2006,1,POSITIVE,Stable,related to apple products,
1062,3640,,,,,i mean the focus was on apple sucking and logitech making decent products you guys are the ones who keep bringing it back to the crust,2,POSITIVE,Aggressive,related to apple products,
1065,3649,,,,,of pcs,127,POSITIVE,Modern,related to apple products,
1074,3667,,,,,i am a developer and i have been using the same macbook pro for ten years it is my main work machine and it still runs great ,57,POSITIVE,Stable,related to apple products,
1075,3670,,,,,apple stuff is really durable until it is not dropped an apple watch three feet from the bathroom counter to say it had an unlucky landing would be an understatement ,95,POSITIVE,Stable,related to apple products,
1076,3672,,,,,i read this gross post on a 2013 macbook pro it was my full time work machine for years now it is the couch surfer it is had the battery changed once in those 9 years and everything works perfectly still,5,POSITIVE,Stable,related to apple products,
1078,3680,,,,,i have a 7th gen ipod those small square things and it has been passed down from three family members who used it without any care about the device is well being still works like a charm,49,POSITIVE,Stable,related to apple products,
1079,3681,,,,,i have several apple products and love them yeah they can be pricier than equivalent non apple products with the same specs but you get incredible interoperability good support and good longevity  i think most peoples complaints are about those who say that apple is the only option and act so superior about it but they are really not as common as people make it seem ,11,POSITIVE,Modern,related to apple products,
1080,3682,,,,,used my macbook air daily for 8 years before it finally gave out two years ago and using my iphone 8 for almost four years now only swapped the battery once it sure is expensive and restricting in some ways but i am never complaining about the longevity of their products ,10,POSITIVE,Modern,related to apple products,
1081,3683,,,,,still rocking a 6 year old iphone 8 and a macbook air from 2017 i have never had a phone last as long as this in my life the apple circlejerk on reddit is hilarious,6,POSITIVE,Modern,related to apple products,
1082,3688,,,,,samsung s8 here 4 y o flagship from 2018  at literally half the price of the iphone back then oled screen best screen to body ratio on the market back then thin and light still powerful and no battery issues just saying ,-2,POSITIVE,Modern,related to apple products,
