,subreddit,title,selftext,ups,overall_text,comment ups,sentiment,relevance,emotion,score
1065,,,,,well i can not sleep apparently so thanks for the link ,4.0,POSITIVE,related to daiso,Friendly,
1068,foodrecalls,daiso california recalls tohato and kashiwado snacks,,1.0,daiso california recalls tohato and kashiwado snacks. ,,POSITIVE,related to daiso,Modern,
1073,,,,,see also flying tiger but i just went by butter the other day and it is very different now than it used to be i just saw a bunch of cute shit like a lotttt of stuffed animals looked like a self photo studio haha,40.0,POSITIVE,related to daiso,Dynamic,
1077,,,,,smooth like ,50.0,POSITIVE,related to daiso,Dynamic,
1079,,,,,yess the shop in your photo is in hongdae right we have been there countless times i even bought a small suitcase there ,7.0,POSITIVE,related to daiso,Elegant,
1082,,,,,there is one in commons ground in gundae and i just love to go there also is that photo shot in lotte shopping mall ,1.0,POSITIVE,related to daiso,Modern,
1084,,,,,i love butter,-1.0,POSITIVE,related to daiso,Modern,
1085,,,,, cute looking tat ,1.0,POSITIVE,related to daiso,Elegant,
1087,,,,,i loved this store when i lived in korea i would recommend using a proxy shipping service which ships to usually a warehouse and then ships to your international address i have not used one in korea before but i have used one in japan on multiple occasions which turned out well definitely do your research to find the best proxy service that will not charge too much for their services ,1.0,POSITIVE,related to daiso,Modern,
1089,,,,,have a free award ,26.0,POSITIVE,related to daiso,Friendly,
1091,,,,,flying tiger is a scandinavian brand and in a lot of places daiso is japanese and also in some scattered places outside of korea ,7.0,POSITIVE,related to daiso,Modern,
1097,,,,,i believe daiso korea is a wholly owned subsidiary they were very proud to promote that back when the boycott japanese product movement was stronger ,16.0,POSITIVE,related to daiso,Modern,
1098,,,,,daiso korea and daiso japan are two different companies and carry different items pretty sure the ones in the us are under the japanese brands good to know about flying tiger though ,8.0,POSITIVE,related to daiso,Modern,
1099,,,,,i am going to miss them soooo much when i move back to the us especially modern house the quality is so good for the price and they have literally everything a house could need really ,0.0,POSITIVE,related to daiso,Modern,
1104,,,,,they reopened recently and it is completely renovated i went a month or two ago ,7.0,POSITIVE,related to daiso,Modern,
1105,,,,,i actually prefer daiso in korea they have super beautifully designed collections that come out every 2 months or so ,6.0,POSITIVE,related to daiso,Elegant,
1106,,,,,the coex location is gorgeous and red yellow themed now ,7.0,POSITIVE,related to daiso,Elegant,
1109,,,,,sadly i was not i really enjoy bad english on random things like hats and stuff it is fun it is true that the daiso in korea is technically better than daiso in japan only if you do not like bad english i guess reddit has decided i should not like fun how dare i think one version of something is better than the other shame on me ,1.0,POSITIVE,related to daiso,Aggressive,
1110,bayarea, it is ok i got a mask from daiso ,,853.0, it is ok i got a mask from daiso . ,,POSITIVE,related to daiso,Modern,
1114,,,,,really in my experience older chinese immigrants are taking covid super seriously ,108.0,POSITIVE,related to daiso,Friendly,
1119,,,,,was there last week the complete reverse was true all the older folks had masks and gloves and maintained social distance even when in line to get in several different groups of college age kids each numbered between 3 and 5 each were standing huddled together in line chatting away one of them went and got little ice cream cups from a nearby store and handed them around to her group none of them bothered wearing masks or gloves people were standing extra far from all of them ,3.0,POSITIVE,related to daiso,Friendly,
1122,,,,,daiso masks are made in japan they are pretty good i know daiso outside japan has lower quality stuff so maybe daiso usa gets the cheapie stuff but i have a ton from japan the type for people with glasses and they are solid ,2.0,POSITIVE,related to daiso,Modern,
1123,,,,, 99 ranch ,2.0,POSITIVE,related to daiso,Modern,
1125,,,,,i stan for ranch 99,2.0,POSITIVE,related to daiso,Modern,
1127,,,,,wow i have lived in ca most of my life both nor cal and so cal and i have never heard of this magical store,3.0,POSITIVE,related to daiso,Friendly,
1137,,,,,this brings up another super interesting point  do yall say ranch 99 or 99 ranch ,107.0,POSITIVE,related to daiso,Modern,
1140,,,,,we had the exact same experience in sacramento we always do our primary shopping at 99ranch but for sure right now it is the store that we feel most comfortable at we are avoiding walmart like the plague my apologies i will let myself out now ,5.0,POSITIVE,related to daiso,Friendly,
1144,,,,,of course they are can not imagine how many shoppers recently came back from china ,1.0,POSITIVE,related to daiso,Modern,
1145,,,,,at least your mom is smart enough to get away from typhoid daddy ,26.0,POSITIVE,related to daiso,Aggressive,
1152,,,,,there is a real difference between those older gens from hk tw and china and when they arrived and their attitudes toward covid would be a fun study if one had a time to do it ,20.0,POSITIVE,related to daiso,Dynamic,
1154,,,,,they are mostly americans they did not live in china during sars or swine flu a lot of ethnically chinese people have been here for ages they built sf and the railroads still shop at 99 ranch tho nothing wrong with that ,38.0,POSITIVE,related to daiso,Modern,
1173,,,,,my white friends call it 99 ranch my asian friends call it ranch 99 ,112.0,POSITIVE,related to daiso,Modern,
1176,,,,,99 ranch ,32.0,POSITIVE,related to daiso,Modern,
1177,,,,,ranch 99,27.0,POSITIVE,related to daiso,Stable,
1179,,,,,this question haunts me,9.0,POSITIVE,related to daiso,Aggressive,
1183,,,,,rancorn 99,2.0,POSITIVE,related to daiso,Aggressive,
1185,,,,,i have always heard 99 ranch ,4.0,POSITIVE,related to daiso,Modern,
1190,,,,,i have always called it 99 ranch,1.0,POSITIVE,related to daiso,Modern,
1192,,,,,99 ranch because that is what it is ,1.0,POSITIVE,related to daiso,Modern,
1194,,,,,this is interesting my partner is from taiwan and grew up in southern california and says 99 ranch so that is what i have been saying ,1.0,POSITIVE,related to daiso,Modern,
1195,,,,,is this regional i spent the first ten years of my adulthood in socal and i say ranch 99 my family is a seafood city family though lol ,4.0,POSITIVE,related to daiso,Friendly,
1197,,,,,it helps me when i place my order after midnight all the time slots are available for the following day not same day tho ,13.0,POSITIVE,related to daiso,Modern,
1200,,,,,you build a railroad i say you can shop where you damn well please ,1.0,POSITIVE,related to daiso,Aggressive,
1203,,,,,meh if someone in the highest risk category does not care maybe you should stop concern trolling on their behalf half of our healthcare spending is on end of life care for that age group and now our entire healthcare system is essentially geared up to keep them and a small percent of everyone else from not dying maybe the attitude of if i croak i croak is actually a more responsible and emotionally healthy way of looking at life and death particularly for those older than average life expectancy ,2.0,POSITIVE,related to daiso,Aggressive,
1210,,,,,do not forget 9 11 and the ensuing wars and desert storm while we are at it we also did have chicken pox too that is to telepathicdorito though i would never in a million years compare that to what is happening right now ,11.0,POSITIVE,related to daiso,Aggressive,
1220,,,,,this is pretty apt,5.0,POSITIVE,related to daiso,Elegant,
1221,,,,,i know it is 99 ranch but ranch 99 sounds better ,10.0,POSITIVE,related to daiso,Modern,
1222,,,,,i white call it ranch 99 and always hear 99 ranch from asians my take on it is people who do not speak english natively read it as written but to a native english speaker the ordinal descriptor 99 belongs after the subject ,6.0,POSITIVE,related to daiso,Modern,
1227,,,,,i am white and have always called it ranch 99 ,1.0,POSITIVE,related to daiso,Modern,
1228,,,,,really my asians friends call it 99 ranch  my white friends call it ranch 99 ,1.0,POSITIVE,related to daiso,Modern,
1229,,,,,ranch 99 i am asian ,1.0,POSITIVE,related to daiso,Friendly,
1233,,,,,tell your dad there is the official way and then there is the right way lol,3.0,POSITIVE,related to daiso,Aggressive,
1237,,,,,in chinese it is 99 ranch 99 market to be exact and officially it is 99 ranch market but a lot of th building have signs that read left to right as ranch 99 market so we that is me and my younger gen friends i am gen x so young is relative tend to say ranch 99 i am sure it drives the owner crazy lol,1.0,POSITIVE,related to daiso,Modern,
1240,,,,,taking bart to work and also taking bart out to hangout with his sister in sf he is the only one not taking this thing seriously so stubborn ,31.0,POSITIVE,related to daiso,Aggressive,
1245,,,,,is this real cuz that is hilariously terrifyingly indicative of what i am experiencing,2.0,POSITIVE,related to daiso,Aggressive,
1248,,,,,or like one of my friends who traveled to and from the east coast telling me this is like the best time to travel no that defeats the purpose ,5.0,POSITIVE,related to daiso,Dynamic,
1250,,,,,ok in a major city i e sacramento or bay area or in a rural area if you are outside the cities there is no reason you would have heard of them ,2.0,POSITIVE,related to daiso,Modern,
1251,,,,,millennials are ages 24 to 39 ,11.0,POSITIVE,related to daiso,Modern,
1275,,,,,in the bay work all over the bay,0.0,POSITIVE,related to daiso,Dynamic,
1281,,,,,chest freezer and refrigerator freezer full decent sized garden in the backyard ,1.0,POSITIVE,related to daiso,Stable,
1287,,,,,this is a great idea ,3.0,POSITIVE,related to daiso,Friendly,
1291,,,,,they are a grocery store with 15 locations around the bay and other locations in sacramento and socal ,3.0,POSITIVE,related to daiso,Modern,
1297,,,,, sir may i interested you in a 1999 hidden valley it has quite the bouquet and is quite dill forward ,11.0,POSITIVE,related to daiso,Elegant,
1298,,,,,your reactionary responses to these younger generations are kind of proving their point ,5.0,POSITIVE,related to daiso,Aggressive,
1303,,,,,ah 1999 a great year for salad dressings in the valley ,6.0,POSITIVE,related to daiso,Modern,
1305,,,,,it is a japanese based 99 cent store they have lots of funky plastic items it is fun to browse at ,3.0,POSITIVE,related to daiso,Dynamic,
1309,,,,,it is excellent on day old kraft dinner and good with cheap fish sticks as well ,3.0,POSITIVE,related to daiso,Friendly,
1318,,,,,beautiful pussy,3.0,POSITIVE,related to daiso,Elegant,
1319,,,,,worth it trust me ,3.0,POSITIVE,related to daiso,Aggressive,
1320,,,,,omg if you went into daiso after and you had wet spots there was no hiding it those stores are so brightly lit ,3.0,POSITIVE,related to daiso,Modern,
1321,,,,,pretty stream x x,3.0,POSITIVE,related to daiso,Elegant,
1323,,,,,sexy,2.0,POSITIVE,related to daiso,Aggressive,
1326,,,,,this is incredible great video 10 10,2.0,POSITIVE,related to daiso,Dynamic,
1328,,,,,sexy perfection beautiful,2.0,POSITIVE,related to daiso,Elegant,
1331,,,,,so hot ,2.0,POSITIVE,related to daiso,Aggressive,
1332,,,,,great video though  ,2.0,POSITIVE,related to daiso,Dynamic,
1336,,,,,tr s jolie,2.0,POSITIVE,related to daiso,Elegant,
1338,,,,,love it  wish i could have seen in real life  ,2.0,POSITIVE,related to daiso,Elegant,
1340,,,,,yumm i need to be down there taking all of that golden shower  ,2.0,POSITIVE,related to daiso,Aggressive,
1343,,,,,nice pussy ,2.0,POSITIVE,related to daiso,Elegant,
1344,,,,,beautiful pee lovely would let me have a taste  ,2.0,POSITIVE,related to daiso,Elegant,
1345,,,,,watch the nectar leave her body between to beautiful lips and try telling me a woman is piss is not for consumption you can not ,2.0,POSITIVE,related to daiso,Elegant,
1347,,,,,that is so incredibly sexy ,1.0,POSITIVE,related to daiso,Aggressive,
1350,,,,,fantastic parking lot piss  ,1.0,POSITIVE,related to daiso,Aggressive,
1352,,,,,fuck that is so hot ,1.0,POSITIVE,related to daiso,Aggressive,
1356,,,,,so sexy ,1.0,POSITIVE,related to daiso,Aggressive,
1358,,,,,amazing,1.0,POSITIVE,related to daiso,Dynamic,
1359,,,,,it is good of you to christen their parking lot what is daiso dept store ,3.0,POSITIVE,related to daiso,Modern,
1360,,,,,phones doing great thanks ,1.0,POSITIVE,related to daiso,Friendly,
1361,,,,,i would absolutely love that,1.0,POSITIVE,related to daiso,Elegant,
1363,,,,,definitely worth it,1.0,POSITIVE,related to daiso,Modern,
1370,,,,,i am so glad you love it ,2.0,POSITIVE,related to daiso,Friendly,
1375,,,,,i am so glad you like it ,2.0,POSITIVE,related to daiso,Friendly,
1387,,,,,absolutely you can ,2.0,POSITIVE,related to daiso,Modern,
1390,,,,,it is a brand new store here in arizona they have them in california though japanese store ,3.0,POSITIVE,related to daiso,Modern,
1392,,,,,it is literally art imho i would also care to see it from the back heh,2.0,POSITIVE,related to daiso,Elegant,
1393,,,,,nice ,2.0,POSITIVE,related to daiso,Elegant,
1397,,,,,that is so hot ,2.0,POSITIVE,related to daiso,Aggressive,
1399,,,,,thanks interesting i am on the east coast guess they have not made it across the country yet i will try to remember that name for the future ,3.0,POSITIVE,related to daiso,Friendly,
1403,,,,,awww you are so sweet i am glad you like it so muchb,2.0,POSITIVE,related to daiso,Friendly,
1408,,,,,yeah it is a fun store where most items are dollar1 75,1.0,POSITIVE,related to daiso,Friendly,
1412,,,,,i like naughty girl the best ,2.0,POSITIVE,related to daiso,Aggressive,
1413,,,,,yummy  ,2.0,POSITIVE,related to daiso,Modern,
1416,,,,,aw thanks i have always hated my fingers but i am trying to like them more now they are just so long ,1.0,POSITIVE,related to daiso,Elegant,
1419,,,,,happy to ,2.0,POSITIVE,related to daiso,Friendly,
1422,,,,,welcome  ,1.0,POSITIVE,related to daiso,Friendly,
1424,,,,,thank you so much i did just upload a new video with sound here ,2.0,POSITIVE,related to daiso,Dynamic,
1435,,,,,daiso gyud diay siya bago pa lang ko gikan ug adto thank you kaayo ,1.0,POSITIVE,related to daiso,Friendly,
1438,gunpla,did not expect to see this at my daiso ,,325.0,did not expect to see this at my daiso . ,,POSITIVE,related to daiso,Modern,
1440,,,,,it seems to have finally made it to the us ,9.0,POSITIVE,related to daiso,Modern,
1443,,,,,last shot ,3.0,POSITIVE,related to daiso,Aggressive,
1445,,,,,ooh nice was it standard daiso price or more expensive ,1.0,POSITIVE,related to daiso,Friendly,
1447,,,,,i hope my daiso gets the diorama stuff eventually,1.0,POSITIVE,related to daiso,Modern,
1449,,,,,love the album in the background ,1.0,POSITIVE,related to daiso,Dynamic,
1452,,,,,saw a video on these recently the look great in photos,1.0,POSITIVE,related to daiso,Modern,
1456,,,,,just had one open up in my town looks like i actually have a reason to check it out ,1.0,POSITIVE,related to daiso,Modern,
1457,,,,,where at though i would love a ton of these,3.0,POSITIVE,related to daiso,Friendly,
1459,,,,,kent station in kent washington ,6.0,POSITIVE,related to daiso,Stable,
1466,austin,pictures of the blooming agave near daiso ,,1185.0,pictures of the blooming agave near daiso . ,,POSITIVE,related to daiso,Modern,
1468,,,,,lots of agaves here are doing this as they are pretty much toast a final act before they give up the ghost ,37.0,POSITIVE,related to daiso,Aggressive,
1471,,,,,nice to see they survived mine were nuked in snowmageddon ,25.0,POSITIVE,related to daiso,Stable,
1476,,,,,rip they go out with a bang ,3.0,POSITIVE,related to daiso,Aggressive,
1477,,,,,pretty sure i saw you taking this picture on my way home from work yesterday,3.0,POSITIVE,related to daiso,Aggressive,
1480,,,,,nice and wide hell yeah,2.0,POSITIVE,related to daiso,Stable,
1482,,,,,finally i can get some good pulque here ,2.0,POSITIVE,related to daiso,Friendly,
1484,,,,,survivors,2.0,POSITIVE,related to daiso,Aggressive,
1487,,,,,i was next to them today and saw a ton of bees around them ,11.0,POSITIVE,related to daiso,Aggressive,
1488,,,,,i read an article one time that described them as giant asparagus death spears i have always loved that description,7.0,POSITIVE,related to daiso,Aggressive,
1489,,,,,really neat to read up on more ,6.0,POSITIVE,related to daiso,Modern,
1491,,,,,bats love feeding on these blooms as well ,3.0,POSITIVE,related to daiso,Aggressive,
1492,,,,,i like how every redditor fancies themselves david attenborough seriously read in his voice ,4.0,POSITIVE,related to daiso,Elegant,
1495,,,,,i love these natural dead man is switches like pinecones doing their thing in response to fire ,9.0,POSITIVE,related to daiso,Dynamic,
1496,,,,,agave and asparagus are actually in the same family ,32.0,POSITIVE,related to daiso,Aggressive,
1497,,,,,you are correct the plant the bloom is growing from will die pups as they called will grow you can also break off pups and plant them elsewhere you do not need much of a root just dig a small hole place the pup firmly in the hole tamp down the ground well you will have a decent sized plant quickly ,7.0,POSITIVE,related to daiso,Stable,
1500,,,,,came here to say this i have yet to come across any that survived the cold snap so this is quite refreshing ,7.0,POSITIVE,related to daiso,Stable,
1503,,,,,i have noticed this too they seem to be branching out a lot more wider this year ,2.0,POSITIVE,related to daiso,Modern,
1505,,,,,i was super excited one was coming here and still took forever to go but that location is great for treats and boba and asian shopping etc shout out to 101 by teahaus as well ,4.0,POSITIVE,related to daiso,Friendly,
1506,,,,,true you have to stop a little early to be able to see behind them ,3.0,POSITIVE,related to daiso,Stable,
1509,,,,,take a pix in couple weeks i am curious how high these suckers will rise ,1.0,POSITIVE,related to daiso,Dynamic,
1510,,,,,lol in my best british accent i have relatives who own ranch land in hill country i have seen the life cycle of agave is since i was small tyke ,2.0,POSITIVE,related to daiso,Aggressive,
1511,,,,,gotcha good call ,1.0,POSITIVE,related to daiso,Friendly,
1512,,,,,this  it is amazing how many are in serious bloom from the freeze it will be neat to watch them go through their life cycle i hope they feed lots of bees ,8.0,POSITIVE,related to daiso,Friendly,
1516,,,,,check out r austingardening if you have not yet there is been a lot of discussion the last few months about the freeze and the impact on everyone is plants ,2.0,POSITIVE,related to daiso,Stable,
1524,,,,,when i went they were out of stock on a lot of things but i still managed spent an hour and over sixty dollars i love the tiny stationary ,5.0,POSITIVE,related to daiso,Modern,
