,subreddit,title,selftext,ups,overall_text,comment ups,sentiment,relevance,emotion,score
1,,,,,omg love them all so cute ,8.0,POSITIVE,related to daiso,Friendly,"{'Modern': 0.34285714285714286, 'Friendly': 0.24615384615384617, 'Aggressive': 0.16923076923076924, 'Elegant': 0.1076923076923077, 'Dynamic': 0.08571428571428572, 'Stable': 0.03736263736263736, 'Powerful': 0.006593406593406593, 'Sporty': 0.004395604395604396}"
2,,,,,my daiso haul that i collected over the months  literally in love with everything i know i went a little crazy over the cute sanrio items haha ,6.0,POSITIVE,related to daiso,Friendly,
3,,,,,so so cute omg there is some stuff i have but some stuff i have not seen before that is awesome ,5.0,POSITIVE,related to daiso,Elegant,
4,,,,,wow i had no idea daiso had so much of our girl ,3.0,POSITIVE,related to daiso,Friendly,
9,,,,,thank you so much glad you liked it hopefully to find more new things soon  ,4.0,POSITIVE,related to daiso,Modern,
10,,,,,i know righttt ,1.0,POSITIVE,related to daiso,Dynamic,
11,,,,,awww i hope you have one too ,1.0,POSITIVE,related to daiso,Friendly,
13,,,,,fingers crossed  ,4.0,POSITIVE,related to daiso,Dynamic,
14,,,,,you are welcome,2.0,POSITIVE,related to daiso,Friendly,
16,theyknew, asparagus children is toy at daiso i laugh everytime i see it ,,3896.0, asparagus children is toy at daiso i laugh everytime i see it . ,,POSITIVE,related to daiso,Friendly,
17,,,,, my first dildo ,308.0,POSITIVE,related to daiso,Aggressive,
34,,,,,shrek approved,3.0,POSITIVE,related to daiso,Elegant,
39,,,,,dildo for scale ,2.0,POSITIVE,related to daiso,Aggressive,
43,,,,,most sought after item by single mothers ,2.0,POSITIVE,related to daiso,Friendly,
45,,,,,good for children good for children is mother win win ,2.0,POSITIVE,related to daiso,Friendly,
46,,,,,multipurpose,2.0,POSITIVE,related to daiso,Modern,
49,,,,,i love daiso,1.0,POSITIVE,related to daiso,Friendly,
68,,,,,welcome to japan,8.0,POSITIVE,related to daiso,Modern,
74,,,,,patronum ,3.0,POSITIVE,related to daiso,Dynamic,
76,,,,,above average even ,24.0,POSITIVE,related to daiso,Dynamic,
79,,,,,why thank you ,6.0,POSITIVE,related to daiso,Friendly,
81,,,,,thank you i am here all weekend ,1.0,POSITIVE,related to daiso,Friendly,
85,asianbeauty,first time trying the daiso detergent and i am super impressed ,,587.0,first time trying the daiso detergent and i am super impressed . ,,POSITIVE,related to daiso,Modern,
87,,,,,yes i love their makeup brush cleaner as well ,37.0,POSITIVE,related to daiso,Elegant,
89,,,,,i love this i hated how before i could not get any stains out of my puffs or sponges but this works wonders for both,16.0,POSITIVE,related to daiso,Modern,
90,,,,,this stuff is great i also use it to clean brushes and it works well for that although i am not sure if it is recommended for that use i did not see the brush cleaner when i bought it i really wish they had stores in europe though i also got daiso is lady underwear detergent omg that thing is a godsend when i went to japan before the pandemic and i do not know what i will do when it runs out hahah ,16.0,POSITIVE,related to daiso,Modern,
91,,,,,i love the daiso makeup brush cleaner but it is hard to find at the daiso is around me so i instead use dr bronner is soap diluted with water i fill an empty hand soap container with dr bronner is soap and water in a 1 1 ratio it works like a charm and the soap is sold in huge containers ,6.0,POSITIVE,related to daiso,Aggressive,
93,,,,,wow this is amazing does it have a fragrance scent ,3.0,POSITIVE,related to daiso,Elegant,
101,,,,,oh yes that stuff is so good,1.0,POSITIVE,related to daiso,Dynamic,
110,,,,,lady detergent ,5.0,POSITIVE,related to daiso,Modern,
115,,,,,we have one in queens in nyc,2.0,POSITIVE,related to daiso,Friendly,
119,,,,,keep an eye out for these cleaning sponges they are the absolute god send for cleaning sneakers ,3.0,POSITIVE,related to daiso,Aggressive,
121,,,,,it removes period stains from underwear ,18.0,POSITIVE,related to daiso,Friendly,
122,,,,,that makes sense thank you i have never noticed this at daiso before but need something like this ,1.0,POSITIVE,related to daiso,Friendly,
123,,,,,that is awesome there are not any daiso is near me but if i ever chance upon one while traveling i will definitely grab one ,1.0,POSITIVE,related to daiso,Modern,
125,,,,,ooh lovely,6.0,POSITIVE,related to daiso,Modern,
137,,,,,it is kind of funny to see people in this thread saying dollar600k to daiso is a lot of money i want everyone to understand how huge daiso is they have over 7000 stores globally and make dollar4 billion usd in sales annually they can absorb a dollar600k fine for a translation oopsie ,1.0,POSITIVE,related to daiso,Modern,
158,,,,,i do not know if it is dumb this kind of regulation is what protects consumers there are so few label terms that are actually regulated by law the ones that are are actually important because they are usually about protecting people is health sterilization does not happen in people is homes but it is a normal process if you work in any certain types of manufacturing or biotech or even just in a hospital there is regular sterilization of tools and instruments done everyday and those kind of environments at home people use bleach all the time to try and achieve a similar effect to sterilization i think the danger is in a non scientific person believing that they could use something like this to kill a virus or a fungus imagine you needed to sterilize surfaces in your home after a family member has an illness or has a compromised immune system i would google what words or certifications or symbols to look for on cleaning products or wet wipes to make sure i was buying the right thing you could end up buying something that is mislabeled and think you are killing virus when the wipe really does not plus imagine the precedent it sets if the government lets some companies mislabel their products without any penalty but holds other companies accountable for making sure that what is on the label is actually in the product the only alternative is to have no standards and enforce no regulations allowing companies to put whatever they want into food and personal care items and selling them as a completely different product we need these kind of protections against unregulated capitalism ,49.0,POSITIVE,related to daiso,Elegant,
161,,,,,definitely seems important distinction to maintain and it makes sense to require them to not use that label i also just wonder if any consumers were actually misled into thinking that they were doing anything different than what they might have done with any other similar cleaning wipe ,1.0,POSITIVE,related to daiso,Modern,
162,hobonichi,i went to daiso for the first time and it was magical ,i know this is a hobonichi sub but i can not think of a group who would appreciate this as much i moved back to nyc recently and had not been to daiso before i had no idea it would be as amazing as it was or that it would have so many other brands besides its own ,249.0,i went to daiso for the first time and it was magical . i know this is a hobonichi sub but i can not think of a group who would appreciate this as much i moved back to nyc recently and had not been to daiso before i had no idea it would be as amazing as it was or that it would have so many other brands besides its own ,,POSITIVE,related to daiso,Modern,
169,,,,,wow that is absolute heaven,3.0,POSITIVE,related to daiso,Elegant,
170,,,,,ah going to a daiso one day is on my bucket list looks awesome ,3.0,POSITIVE,related to daiso,Modern,
173,,,,,wow your daiso store has a great selection,2.0,POSITIVE,related to daiso,Friendly,
177,,,,,i am in singapore and i totally agree that i buy stickers and some of washi tape from daiso for my hobonichi ,1.0,POSITIVE,related to daiso,Modern,
185,,,,,do you happen to know if they add change brands they carry was really surprised to see all of those kyowa seals for instance,1.0,POSITIVE,related to daiso,Modern,
192,,,,,yeah imgur is the way to go those post it mini notebooks in the third picture are life it keeps different sizes of post it with the same color scheme together and i love using them in my a6 ,4.0,POSITIVE,related to daiso,Modern,
201,,,,,i fucking love daiso snacks all day also i got all my glass spice jars there ,12.0,POSITIVE,related to daiso,Friendly,
202,,,,,pro tip if you use xacto knives daiso sells blade refills in a 10 pack which is substantially cheaper in small quantities than i have been able to find anywhere else quality is nearly as good as brand name blades i have not been able to tell a difference i do not feel nearly as bad about swapping blades now that they are so cheap haha,6.0,POSITIVE,related to daiso,Modern,
206,,,,,their kitchen stuff is great i have bot lots of plates glasses jars tupperware and various peelers graters etc stationery and storage containers are decent too ,2.0,POSITIVE,related to daiso,Modern,
210,,,,,daiso is makeup sponge cleaner works like a dream it melts off everything on my sponges and brushes ,1.0,POSITIVE,related to daiso,Modern,
211,,,,,i think a good set of knives is a better option that the cheap daiso ones if you get quality ones they are buy it for life and with sharp knives cooking will be so much more efficient and pleasant ,1.0,POSITIVE,related to daiso,Powerful,
212,,,,,i love daiso too i have been to the one in anaheim las vegas and san jose my favorite buys are the fun office paper area i bought my paid bills book and my kitchen menu grocery shopping notebooks there they are so pretty i just love them and they were dollar1 25 each san jose is closest to my home but still about 7 hours away so i if i am ever close to one i go ,1.0,POSITIVE,related to daiso,Elegant,
216,,,,,harbor freight refills are actually cheaper than daiso ime ,1.0,POSITIVE,related to daiso,Friendly,
217,,,,,it is an asian dollar store ,4.0,POSITIVE,related to daiso,Modern,
220,,,,,they are popping up here in texas too ,2.0,POSITIVE,related to daiso,Modern,
221,,,,,there is some here in cali ,1.0,POSITIVE,related to daiso,Friendly,
223,,,,,oh that reminds me i got a miniature cast iron skillet that is perfect for a small batch of cornbread ,1.0,POSITIVE,related to daiso,Stable,
224,,,,,right now i am using a fiskars xacto blade holder it is bright orange with a rubberized outside the screw to tighten the blade holder is on the opposite end from the blade and it has a triangular sort of grip profile i absolutely love it so much better and more comfortable than the cheap round metal grips i was using,3.0,POSITIVE,related to daiso,Aggressive,
225,,,,,southern california checking in with plenty of daisos ,1.0,POSITIVE,related to daiso,Modern,
229,,,,,considering how many times i ate there it seemed that yoshinoya sponsored my trip i love that thing uniqlo in ginza has a massive store the 11th and 12th floor are great for nice quality and design tshirts ,3.0,POSITIVE,related to daiso,Modern,
233,,,,,i live near a lot of daisos including a big one in japan town so i was not planning on going on my recent trip to japan but ended up wandering into a big one and was glad i did i got a lot of good souvenirs for people i was having a hard time getting stuff for there were many fun and different things than i have seen in the us,1.0,POSITIVE,related to daiso,Friendly,
234,,,,,no i have found the same thing in both countries probably slight variety but idk what would make it superior ,1.0,POSITIVE,related to daiso,Modern,
237,,,,, all three gyudon places are kind of bleh nakau is the best ,1.0,POSITIVE,related to daiso,Friendly,
240,,,,,i remember eating the us version with i was a child but i am a sucker for the jpn one you will find it nearly everywhere matsuya is another meat bowl place and it is pretty good too i despise sukiya it is too sweet for me or something regardless they are all cheap enough to try haha i am assuming you are going to tokyo if you can there are quite a few  gyo mu yo su pa which translates to supermarket for businesses and is a japanese costco heh they have these amazing gyu don basically the beef part of that yoshinoya bowl in the freezer section if y all wanted to take that home if you do not mind possibly spending a crapload of money i would stop by a  loft which is a store with a bunch of cool stuff japanese pens beauty products shit like that what part of japan are you staying ,2.0,POSITIVE,related to daiso,Friendly,
241,,,,,uniqlo in japan definitely has more than the us stores i frequently go between japan and the us and i tend to often see just flat out different stuff between them except for the extreme basic like t shirts and jeans which tend to be the same the sizing will be a little different too i am a small medium in the us in uniqlo and other clothing stores but i almost always have to go up to a large when shopping in japan most of the uniqlo stores in japan that are not tiny little on the go stores in train stations will be at least a couple of floors if not more like 3 4 floors or larger sometimes that has to do with the footprint of the building if it is a small building with small floors they need more of them to house all the stuff but other times it really will be that you are in a huge flagship store or a popular area that just needs a massive store size this is true of a lot of the popular stores donki yodobashi camera bic daiso loft muji etc  they often have many floors ,2.0,POSITIVE,related to daiso,Modern,
244,,,,,you should also hit up itoya in ginza both the g and k buildings which are across the street from one another that is like a combined 16 floors of pens stationery notebooks and other associated things ,2.0,POSITIVE,related to daiso,Modern,
246,asianbeauty, what are y all is favorite items from daiso skincare makeup accessories snacks lol ,,75.0, what are y all is favorite items from daiso skincare makeup accessories snacks lol . ,,POSITIVE,related to daiso,Friendly,
247,,,,,these guys i stock up when i see them my faves are the soy isoflavones and rice ceramide ones the soy isoflavones one is a great dupe for the sana one the rice ceramide one ridiculously light and absorbs instantly i use it under the cezanne high moist i actually like this combo better than the kikumasamune high moist ,39.0,POSITIVE,related to daiso,Modern,
249,,,,,the silicone mask cover is my favourite good to use to protect your face during a hot shower and if you wear glasses it is really good for keeping them on your face while you do a sheet mask i do not buy into the whole makes your mask more effective schtick but it definitely keeps it moist good in the winter when the heat dries everything out and can keep it on your face if it does not want to stay ,31.0,POSITIVE,related to daiso,Modern,
251,,,,,those bra nets with hard wire in them so your bras do not lose shape in the washer i bought a bunch for my mother as well and she loves them and cute stationary for cheap especially seasonal letter sets paper and envelopes ,17.0,POSITIVE,related to daiso,Modern,
256,,,,,i use their silicon mask cover which hurts my ears but eh i also use their serums and drop bottle serum oil thing they are both serums but they are extremely different i have the job is tears egg white placenta and royal jelly ones lots of people in taiwan use the royal jelly one i also have the royal jelly watery lotion toner feels really nice and the consistency is a very watery honey the korean daisos sold a snail solution line and their cream is very good for people with dry skin i have oily skin though but it works well at night i also use their eyelash glue because the applicator is nice and easy ,5.0,POSITIVE,related to daiso,Elegant,
257,,,,,everyone is already said most of my faves but snacks  hello kitty marshmallows strawberry is better than pineapple but they are both good japanese gummy candies i do not know what they are actually called but they have 100 after the name in japanese and come in flavors like kiwi and apple and they are sooooooo good,4.0,POSITIVE,related to daiso,Friendly,
260,,,,,there is a foam whipper thingy for making a lot of foam for cleaning your face and a little pink cup with a scrubby thing in the bottom to clean your makeup brushes with i like the puff and sponge detergent but find the brush cleaner is just ok for me for the price it is very nice but i really prefer mac is brush cleaner ooh and i like the microfiber towels because they are the perfect size for drying my hair the microfiber glove for hair drying is also good ,3.0,POSITIVE,related to daiso,Modern,
261,,,,,i did not know anything about asian skincare last time i was in japan but i got a bunch of hair accessories at the daiso in harajuku and i liked them a lot i got a huge ruffly scrunchie than ended up being my favorite and one of those big plastic clips with some cute decorative ribbon on top off topic but i also got a set of japanese dishes rice bowl plate tea cup chopsticks and a pickle dish and they are really useful and i still use them a lot i am planning to buy more when i go back ,2.0,POSITIVE,related to daiso,Elegant,
263,,,,,i visit daiso often and lots of my homeware are from there but what really stands out are two things the rubber coated clothes hangers only php88 for 6pcs and the melamine sponges which are great for erasing stubborn stains on tiles walls and other surfaces another fave japanese item but i got it from japan home center which sells seria items is a phone stand really handy i used it everyday until it broke ,2.0,POSITIVE,related to daiso,Modern,
265,,,,,i loved their eyelid tape its the beige colored ones the only issue it does not do well with eyeshadow makes it too obvious also their false lashes are pretty cute i always get their cute hair ties the sakura blossom and butterfly i like the collab with disney too uwu i just got disney nail mini clipper yesterday so qoot ,2.0,POSITIVE,related to daiso,Elegant,
267,,,,,i like the drinks and the cottons ,1.0,POSITIVE,related to daiso,Friendly,
271,,,,,ooooh that sounds good i will definitely have to get myself one of these badboys next time,5.0,POSITIVE,related to daiso,Modern,
275,,,,,yes love the cotton pads so cheap and just as effective as the ones i could buy from a drugstore ,3.0,POSITIVE,related to daiso,Friendly,
284,,,,,i cut off the ear things for the same reason and surprisingly enough it stays on my face even without them,3.0,POSITIVE,related to daiso,Aggressive,
288,,,,,yeah i will check it out next time i am in a daiso ,1.0,POSITIVE,related to daiso,Modern,
293,,,,,haha well at least you are getting some propolis goodness whilst getting your face clean i have seen it in cali and japan with the dual english and japanese labeling ,1.0,POSITIVE,related to daiso,Modern,
294,,,,,they are very inconsistent i have zero interest in sheet masking or their makeup so the beauty stuff others seem to like from them are not exciting for me  i really buy an obscene amount of something when i find something i like i currently have 14 bottles of the soy isoflavones lotion  their homegoods section is pretty legit and consistent though i also really like their slipper section we do not wear shoes inside the house ,2.0,POSITIVE,related to daiso,Modern,
295,,,,,to be fair the ones from daiso is quite different from the og beauty blender the bb really is more soft and poreous looking and the daiso is more of a sturdy squishy sponge i just like the daiso ones since i find that i use less product plus i kinda like how its a bit more sturdy also its very cheap so its easier to replace for hygienic issues ,6.0,POSITIVE,related to daiso,Modern,
298,,,,,kenneth do not forget your dollar0 56 bucks are expiring in three days,382.0,POSITIVE,related to daiso,Modern,
303,,,,,there are hundreds of sellers from japan peddling items they can pick up from 100 yen stores or bookoff for dollar1 and mark them up by a huge margin to americans ,34.0,POSITIVE,related to daiso,Modern,
306,,,,,gonna make the trip to my local daiso for my own shiba inu figure,7.0,POSITIVE,related to daiso,Modern,
311,,,,,i love daiso,2.0,POSITIVE,related to daiso,Friendly,
316,,,,,i have one still in the package am i a millionaire yet ,1.0,POSITIVE,related to daiso,Stable,
318,,,,,to plug it ,13.0,POSITIVE,related to daiso,Modern,
319,,,,,when i moved to la i was amazed when i found out daiso was a thing since the pandemic i moved back home and i still miss daiso more than anything ,21.0,POSITIVE,related to daiso,Modern,
320,,,,,they have a website ,26.0,POSITIVE,related to daiso,Modern,
322,,,,,move to orange county i have 10 within 10 mile radius ,3.0,POSITIVE,related to daiso,Friendly,
331,,,,,it is totally a different experience from going to the american 99 cent store because stuff at daiso are actually nice and attractive ,23.0,POSITIVE,related to daiso,Modern,
333,,,,,this is actually pretty cool old school business in action living and buying in a low col area and reselling overseas to a high col area,16.0,POSITIVE,related to daiso,Modern,
334,,,,,in the 70s and 80s i heard about americans bringing used jeans and leather jackets to japan to sell as they are worth far more over there people were eager to emulate american culture back then ,2.0,POSITIVE,related to daiso,Modern,
336,,,,,yep got mine for 40dollar s,3.0,POSITIVE,related to daiso,Friendly,
338,,,,,and thank you it looks super cute n i want to find one for not 40dollar lololol,1.0,POSITIVE,related to daiso,Friendly,
339,,,,,get it together kenneth,13.0,POSITIVE,related to daiso,Aggressive,
340,,,,,i would love an 99 cent store up here in canada ,6.0,POSITIVE,related to daiso,Friendly,
349,,,,,thanks that is really nice of you  ,3.0,POSITIVE,related to daiso,Friendly,
354,asianbeauty,daiso japan is coming to canada hurray ,,532.0,daiso japan is coming to canada hurray . ,,POSITIVE,related to daiso,Modern,
359,,,,,is there good skincare at daiso ,7.0,POSITIVE,related to daiso,Modern,
362,,,,,the diaso brand brush cleaner in the pink bottle is the best brush cleaner i have ever used in my life ,4.0,POSITIVE,related to daiso,Modern,
364,,,,,now come to the dmv please i am begging you we have lots of asians that love good deals i promise ,6.0,POSITIVE,related to daiso,Friendly,
365,,,,,we have a daiso in vancouver,3.0,POSITIVE,related to daiso,Modern,
366,,,,,in case ppl did not know they are opened since today first 100 customers that buys more than dollar30 gets a goodie bag i got a massive plushy today ,3.0,POSITIVE,related to daiso,Friendly,
367,,,,,omg im so excited,2.0,POSITIVE,related to daiso,Dynamic,
368,,,,,soooooo excited  something to look forward to in vancouver ,2.0,POSITIVE,related to daiso,Dynamic,
377,,,,,i think so they also have a lot of beauty tools bathroom stuff and accessories etc it is a life saver ,3.0,POSITIVE,related to daiso,Elegant,
378,,,,,their makeup is actually decent not drag queen good but cheap and a bit sheer like most ab brands aimed at middle and high school students i use some now ,1.0,POSITIVE,related to daiso,Modern,
379,,,,,there is a couple of  after opening our first us store in 2005 we now have over 80 stores across washington california texas new york and new jersey most of the daisos on the east coast are in new york ,1.0,POSITIVE,related to daiso,Modern,
381,,,,,right like idc if it is md or va i will make the drive ,1.0,POSITIVE,related to daiso,Aggressive,
383,,,,,how big is the plushie ,1.0,POSITIVE,related to daiso,Friendly,
389,,,,,ah im excited ,1.0,POSITIVE,related to daiso,Dynamic,
393,,,,,ohhh hopefully they expand ,1.0,POSITIVE,related to daiso,Modern,
395,malaysia,found this in a daiso,,812.0,found this in a daiso. ,,POSITIVE,related to daiso,Modern,
404,,,,,giga chad move instead of faham tak use  same meaning for those who understand japanese but will drive those who do not nuts ,11.0,POSITIVE,related to daiso,Aggressive,
410,,,,,you welcome people who wrote that ,3.0,POSITIVE,related to daiso,Friendly,
415,,,,,all the more i have the urge to open the package ,-1.0,POSITIVE,related to daiso,Aggressive,
427,,,,,some people just want to watch the world burn true supervillains ,88.0,POSITIVE,related to daiso,Aggressive,
432,,,,,the absolute instict in our malaysian blood to open packagings is strong,13.0,POSITIVE,related to daiso,Aggressive,
441,,,,,bold of you to assume that people have common sense,3.0,POSITIVE,related to daiso,Aggressive,
442,,,,,i was recently given a middle finger while driving cause i would not move or slow down to give way to the other driver that drifted into my lane without signalling while i am directly beside them as they were forced back into their lane and get stuck behind a slower vehicle i guess what i am trying to say is common courtesy and rules exist but it does not mean shit if you were taught that your parents owns the world added with a splash of entitlement and arrogance ,2.0,POSITIVE,related to daiso,Aggressive,
450,,,,,turns out supervillains are just your average everyday man,47.0,POSITIVE,related to daiso,Aggressive,
452,,,,,ok fak yu in court soon ,15.0,POSITIVE,related to daiso,Aggressive,
457,,,,, is not compulsory for a question especially when you are not trying to be polite e g understand and did you understand faham and faham tak the faham tak in this instance is not meant or at the very least was not perceived to be polite therefore just  is sufficient to get that point across ,1.0,POSITIVE,related to daiso,Modern,
459,,,,,i see im very much still learning so i hope i didnt come across as rude thanks for teaching me ,2.0,POSITIVE,related to daiso,Friendly,
461,,,,,nah you are cool it is good that you are willing to share your opinion ,1.0,POSITIVE,related to daiso,Friendly,
463,fountainpens,product test daiso sticky notes are fp friendly ,,70.0,product test daiso sticky notes are fp friendly . ,,POSITIVE,related to daiso,Friendly,
