,subreddit,title,selftext,ups,overall_text,comment ups,sentiment,relevance,emotion,score
464,,,,,yes there is a memo pad from daiso that shows even shimmer ink beautifully,10.0,POSITIVE,related to daiso,Elegant,
465,,,,,yesss pretty much any daiso paper that is made in japan is fp friendly i have got plenty of notebooks notepads from them for general use and it is brilliant super cheap excellent value for money obviously it is not tomoe river or clairefontaine but it is stellar compared to anything else in the price range ,7.0,POSITIVE,related to daiso,Modern,
468,,,,,it is a nice backup for when the stationery stores are out of my preferred clairefontaine and rhodia notebooks ,5.0,POSITIVE,related to daiso,Modern,
473,,,,,pretty cool will be sure to get some 1 144 1 100 ,15.0,POSITIVE,related to daiso,Modern,
474,,,,,i hope my daiso have them,10.0,POSITIVE,related to daiso,Modern,
489,,,,,i saw these the other day at my local daiso in tokyo do not have much room and not a huge fan of hangers but i love how affordable daiso makes things tempted to go back to pick one up,1.0,POSITIVE,related to daiso,Friendly,
493,,,,,do they sell one for perfect grade kits ,1.0,POSITIVE,related to daiso,Modern,
496,,,,,i would pay four times that very happily i dream of a find like that,1.0,POSITIVE,related to daiso,Friendly,
499,,,,,hi does ion orchard still have the stand ,1.0,POSITIVE,related to daiso,Modern,
505,,,,,ion orchard ,2.0,POSITIVE,related to daiso,Modern,
513,,,,,singapore  which daiso i need those,9.0,POSITIVE,related to daiso,Friendly,
523,,,,,ion orchard daiso,15.0,POSITIVE,related to daiso,Modern,
526,,,,,ion orchard ,1.0,POSITIVE,related to daiso,Modern,
530,,,,,omg thanks bro its not too far away,0.0,POSITIVE,related to daiso,Modern,
534,,,,,oh i know where i am going tomorrow ,1.0,POSITIVE,related to daiso,Dynamic,
536,,,,,looks great probably getting 4 to combine for two 1 100 kits,2.0,POSITIVE,related to daiso,Modern,
538,,,,,ahhh good to know thanks they can not be combined vertically to extend the heights ,1.0,POSITIVE,related to daiso,Stable,
542,,,,,i thought these were to hold back hair whilst doing makeup i saw some beutuber using something similar but i love this idea ,24.0,POSITIVE,related to daiso,Elegant,
548,,,,,i have a version of these i do not have baby hair problems but i love that they will keep my damp bangs out of my face while i do my makeup without leaving a crimp in them like clips or pins ,1.0,POSITIVE,related to daiso,Modern,
550,,,,,i wonder what wavy baby hairs look like for a while kpop stars had styled their baby hairs and bangs in small waves i thought it was cute ,4.0,POSITIVE,related to daiso,Dynamic,
557,,,,,the cloud ones are really cool though ,2.0,POSITIVE,related to daiso,Modern,
561,miniatures,i absolutely love card catalogs librarian by day so i sometimes include them in my minis i still need a lot of practice but i hope you like all material from either daiso or seria ,,209.0,i absolutely love card catalogs librarian by day so i sometimes include them in my minis i still need a lot of practice but i hope you like all material from either daiso or seria . ,,POSITIVE,related to daiso,Modern,
562,,,,,love this ,3.0,POSITIVE,related to daiso,Friendly,
564,,,,,this is so cool    i love it wow wow wow,2.0,POSITIVE,related to daiso,Dynamic,
565,,,,,so cozy and adorable ,2.0,POSITIVE,related to daiso,Friendly,
566,,,,,your craftsmanship is remarkable,2.0,POSITIVE,related to daiso,Elegant,
567,,,,,love it especially the chair and that frog ,2.0,POSITIVE,related to daiso,Elegant,
571,,,,,it was a very lucky find i found a pack of clear stickers in just the right shape i regret not buying more ,2.0,POSITIVE,related to daiso,Elegant,
572,,,,,ahhh wel it looks great great job ,1.0,POSITIVE,related to daiso,Modern,
577,,,,,hopefully it lasts longer than the previous one,36.0,POSITIVE,related to daiso,Stable,
579,,,,,we did this already in the mall it was cool hope it lasts this time ,24.0,POSITIVE,related to daiso,Dynamic,
584,,,,,i live in japan daiso is my favorite place here to shop i can get everything and each one has different stuff too i can not remember the one that was in bellis fair  like what they sold to compare to here but i believe the prices were not 100 it is a dollar store i am stoked they are trying again heard the ones on o hau were well received too ,12.0,POSITIVE,related to daiso,Modern,
585,,,,,i am so excited that they are coming back ,7.0,POSITIVE,related to daiso,Dynamic,
587,,,,,this is really exciting i am looking forward to this i will bet they will set up shop between el gitano and sewing vacuum ,5.0,POSITIVE,related to daiso,Dynamic,
590,,,,,i just hit up the store in richmond bc worth the monthly trip and cheaper,3.0,POSITIVE,related to daiso,Friendly,
591,,,,,holy shiiiiiiiit the one at bellis fair was so good this is so exciting ,3.0,POSITIVE,related to daiso,Dynamic,
594,,,,,bro i bought dishes from them in 2008 that i still use to this day i am so stoked to see them coming back if it is true plz plz plz plz ,2.0,POSITIVE,related to daiso,Stable,
595,,,,,are we there yet ,2.0,POSITIVE,related to daiso,Dynamic,
601,,,,,now i have a place to finally get ear picks ,1.0,POSITIVE,related to daiso,Modern,
602,,,,,i will be so excited to get a daiso i love visiting them when i get the chance ,1.0,POSITIVE,related to daiso,Dynamic,
611,,,,,i will single handedly keep it in business,35.0,POSITIVE,related to daiso,Aggressive,
615,,,,,it is great for craft supplies for kids especially as an elementary school teacher i lived off of them ,3.0,POSITIVE,related to daiso,Friendly,
616,,,,,but that means entering the land of canada ,-2.0,POSITIVE,related to daiso,Stable,
621,,,,,produce is a big one frozen and refrigerated housewares also efficiency price and product chasing from meridian to ferndale for my full list vs one stop shop i love asia market and big shout out to the new store in ferndale that is closest to me but my friend and i still make an every few month trip to seattle ,23.0,POSITIVE,related to daiso,Modern,
622,,,,,someone clearly has never visited hmart before,19.0,POSITIVE,related to daiso,Modern,
623,,,,,sparkling sake ,16.0,POSITIVE,related to daiso,Modern,
624,,,,,atsuete seeds magic sarap seasoning and a diverse selection of fish meats are things that i have not found in the local asian markets ,10.0,POSITIVE,related to daiso,Modern,
625,,,,,produce for sure their selection is awesome the deli food food courts in those places alone uwaji in bellevue has some of the best poke assorted tempura croquet quick delicious curry bowls and gyudon and hmart in lynwood has gimbap bulk pickled sides and salads the best meat selections and a food court with an asian bakery where everything is amazing beyond that variety when you are looking for something specific i love and love to support our local asian markets as much as i can but for the food i love to cook and eat most i would appreciate a larger store ,6.0,POSITIVE,related to daiso,Friendly,
626,,,,,fresh produce more than a handful of offerings fresh meats way bigger and more diverse in what they are stocked with plus the food courts,3.0,POSITIVE,related to daiso,Modern,
629,,,,,sashimi and banchan edit that is reasonably priced,1.0,POSITIVE,related to daiso,Modern,
630,,,,,do not worry we have a couple up north ,1.0,POSITIVE,related to daiso,Friendly,
633,,,,,they will go easy on you,1.0,POSITIVE,related to daiso,Friendly,
636,,,,,ooh that sounds great ,2.0,POSITIVE,related to daiso,Modern,
637,,,,,ooh those sound great ,0.0,POSITIVE,related to daiso,Modern,
638,,,,,oh yeah i know they are great and i enjoy them for specialty items and browsing but i was curious what it is people have on their usual shopping list that they can not find there i usually go to asia market with a list of a few staples i need a specific spice or sauce a specific noodle or an ingredient for a new recipe and i always find what i need ,0.0,POSITIVE,related to daiso,Modern,
641,,,,,thank you i look forward to checking it out ,2.0,POSITIVE,related to daiso,Modern,
644,,,,,you are gonna head down to your local asian superstore supermarket w small home appliances and get yourself a butane burner for the middle of the table  then you will grab some thin sliced meats of various kinds some veggies garlic slice jalape os then slap that burner in the middle of your table with that lovely bit of iron on top let it get nice and hot slap some of that meat on it with some veggies and then have one of the tastiest and most fun meals you have had  that is a random link  the dome is so you can choose to cook dry on the dome or cook in the rendered juices and other yummy stuff that will fill the moat at the edge ,589.0,POSITIVE,related to daiso,Dynamic,
649,,,,,if you can get it to release cleanly you could make a salad plate out of shredded cheese we used to get them in one of the restaurants was tasty ,10.0,POSITIVE,related to daiso,Modern,
650,,,,,there is a great documentary on netflix called pork belly rhapsody korean celeb chef paik jong won explores the kbbq culture really interesting segment where he visits a street that is full of shops selling different kinds of bbq plates for the centre of tables in restaurants and how they are different and what they are used for damn i miss korean food ,5.0,POSITIVE,related to daiso,Dynamic,
653,,,,,good thing i seen this post i would have heated tortillas with it ,4.0,POSITIVE,related to daiso,Friendly,
656,,,,,tortilla sombreros ,3.0,POSITIVE,related to daiso,Modern,
660,,,,,great for tabletop grilling with some chitchat with friends ,2.0,POSITIVE,related to daiso,Friendly,
661,,,,,nice tortilla warmer,2.0,POSITIVE,related to daiso,Modern,
662,,,,,heating up tortillas,2.0,POSITIVE,related to daiso,Aggressive,
664,,,,,i m just saiyan,2.0,POSITIVE,related to daiso,Aggressive,
666,,,,,making bowls ,0.0,POSITIVE,related to daiso,Stable,
667,,,,,you could make a super cool looking omelette,0.0,POSITIVE,related to daiso,Aggressive,
670,,,,,you might also be able to do suadero in this ,1.0,POSITIVE,related to daiso,Aggressive,
671,,,,,it is bulgogi time ,1.0,POSITIVE,related to daiso,Aggressive,
672,,,,,ginger harvester ,1.0,POSITIVE,related to daiso,Aggressive,
674,,,,,making hats ,1.0,POSITIVE,related to daiso,Elegant,
678,,,,,jingisukan skillet,1.0,POSITIVE,related to daiso,Aggressive,
680,,,,,100 percent for what we call genghis khan bbq in japan,1.0,POSITIVE,related to daiso,Aggressive,
681,,,,,if you like mexican food or tacos try making suadero tacos they are phenomenal,1.0,POSITIVE,related to daiso,Aggressive,
694,,,,,moat drippings are the best part ,1.0,POSITIVE,related to daiso,Aggressive,
702,,,,,well fuck never thought of trying this and now i want to ,29.0,POSITIVE,related to daiso,Aggressive,
712,,,,,not a bad idea to try out ,3.0,POSITIVE,related to daiso,Modern,
717,,,,,not necessarily just good quality well sliced pork belly salt ssamjang is all you need for a good time ,8.0,POSITIVE,related to daiso,Aggressive,
719,,,,,still meat on that bone ,9.0,POSITIVE,related to daiso,Aggressive,
721,,,,,arrested development references always get an upvote,1.0,POSITIVE,related to daiso,Modern,
722,,,,,dammed right this meal gets me excited it will get loud ,6.0,POSITIVE,related to daiso,Dynamic,
739,,,,,still there is hope ,5.0,POSITIVE,related to daiso,Friendly,
743,,,,,i have always wanted to go to the one near me and now i have a reason ,1.0,POSITIVE,related to daiso,Friendly,
745,,,,,pork belly and a sprinkling of garlic salt oh man ,3.0,POSITIVE,related to daiso,Aggressive,
751,,,,,well the pan is traditionally used in asian cooking ,6.0,POSITIVE,related to daiso,Elegant,
756,,,,,this is reason enough for me ,2.0,POSITIVE,related to daiso,Aggressive,
761,,,,,it can be both chili for dinner and ice cream for dessert,1.0,POSITIVE,related to daiso,Dynamic,
772,bellingham,it is official daiso coming to bellingham,just saw them moving in things in sunset square ,166.0,it is official daiso coming to bellingham. just saw them moving in things in sunset square ,,POSITIVE,related to daiso,Modern,
774,,,,,a win for sticker enjoyers,26.0,POSITIVE,related to daiso,Friendly,
778,,,,,say what you want about daiso but their plates bowls are great ,10.0,POSITIVE,related to daiso,Friendly,
779,,,,,our tradition is to take our kids there at christmas for them to pick out gifts for each other they are going to be so excited ,20.0,POSITIVE,related to daiso,Friendly,
780,,,,, this is actually such exciting news for me lol,28.0,POSITIVE,related to daiso,Dynamic,
782,,,,,yes i am so excited seriously my favorite store and the one i miss the most from japan,5.0,POSITIVE,related to daiso,Friendly,
783,,,,,yes i still remember when there was one at the mall ,12.0,POSITIVE,related to daiso,Modern,
784,,,,,one of the best stores ever,4.0,POSITIVE,related to daiso,Friendly,
791,,,,,omgoodness gracious jumping up and down and squealing with delight thanks for the news  awesome ,2.0,POSITIVE,related to daiso,Dynamic,
801,,,,,do not call me out like this i promise they will be used  eventually maybe,8.0,POSITIVE,related to daiso,Aggressive,
810,,,,,me too it has all the things i did not know i needed i feel like i can keep it in business all by myself ,12.0,POSITIVE,related to daiso,Powerful,
813,,,,,i grew up in japan and this is going to be so nostalgic for me i can not wait ,2.0,POSITIVE,related to daiso,Elegant,
816,,,,,just a cute little japanese dollar store that is really popular amongst the kawaii crowd,5.0,POSITIVE,related to daiso,Modern,
822,,,,,honestly it is a step up from the unncessary novelty goods made of cheap plastic that have to be bought sight unseen because amazon is the only place to buy stuff online shopping is increasingly intolerable and even crummy b m stores are going to improve the amount of plastic entering landfills just by allowing shoppers to try before they buy ,1.0,POSITIVE,related to daiso,Modern,
824,,,,,where tuesday morning used to be,5.0,POSITIVE,related to daiso,Modern,
827,,,,,gotta check it out ,1.0,POSITIVE,related to daiso,Modern,
828,,,,,h mart is a korean supermarket that sells asian grocery daiso is a japanese store kind of like a dollar store the merch are nicer and cuter price is not bad at all the closest one to bham is in lynwood ,2.0,POSITIVE,related to daiso,Modern,
829,,,,,right it is so good the scented erasers that they sell there are by far the best erasers that i have ever used in my life significan notly better than the ones i used to pay dollar5 for at the art store everything they sell there is fantastic ,9.0,POSITIVE,related to daiso,Friendly,
831,,,,,some of it is surprisingly well designed and that is the difference a certain level of care to make less of it instant trash ,28.0,POSITIVE,related to daiso,Elegant,
834,,,,,what is the kawaii crowd ,0.0,POSITIVE,related to daiso,Friendly,
839,,,,,my dollar2 50 ikea spatulas from 2018 are some of my favorite things in my house still going strong at one point i splurged for a like dollar6 ikea spatula but it can not outshine the ogs,12.0,POSITIVE,related to daiso,Stable,
842,,,,,there are a lot of introductory promotions and discounts so yeah you can probably buy 20 things and your first order will only be dollar15 after that though the prices are still pretty great for the quality that you expect i have only been disappointed by a few items and i have ordered more than i am willing to admit ,3.0,POSITIVE,related to daiso,Friendly,
844,,,,,the asian store in fountain district sells home goods ,3.0,POSITIVE,related to daiso,Modern,
850,,,,,kawaii means cute,3.0,POSITIVE,related to daiso,Elegant,
851,,,,,the kawaii crowd are fans of cute things from japan such as hello kitty ,5.0,POSITIVE,related to daiso,Elegant,
853,,,,,cutesy nerd shit ,3.0,POSITIVE,related to daiso,Elegant,
855,,,,,yes i discovered tm when i moved here a few years ago they had a nice selection of pretty storage boxes but i have since found that joanne is has nice ones available as well also got some good quality sheet pans at a great price at tm ,3.0,POSITIVE,related to daiso,Elegant,
863,,,,,geez i have not been able to get to muji since like 2017 but i adore them too ,1.0,POSITIVE,related to daiso,Modern,
866,,,,,super cute great job ,16.0,POSITIVE,related to daiso,Elegant,
867,,,,,where did you buy the kit love it ,12.0,POSITIVE,related to daiso,Friendly,
868,,,,,these are super cute and well done no matter what but also crazy nice job for your first time ,6.0,POSITIVE,related to daiso,Friendly,
869,,,,,i love the daiso needle felt kits so cute ,5.0,POSITIVE,related to daiso,Friendly,
872,,,,,oh my goodness these are adorable ,2.0,POSITIVE,related to daiso,Friendly,
873,,,,,cute do they have names ,2.0,POSITIVE,related to daiso,Friendly,
876,,,,,daisoooo i went there in korea awesome store ,2.0,POSITIVE,related to daiso,Dynamic,
877,,,,,omg they are so adorable i just can not stand how cute they are it is even better cuz my hubby is a panda and i am a cat d eck keep up the fantastic work ,2.0,POSITIVE,related to daiso,Friendly,
878,,,,,those are super cute i am so proud of you ,2.0,POSITIVE,related to daiso,Friendly,
879,,,,,so nice ,2.0,POSITIVE,related to daiso,Elegant,
880,,,,,i have 2 daiso stores in my city i totally gotta make a visit now these are adorable great job love ,2.0,POSITIVE,related to daiso,Friendly,
883,,,,,so adorable ,2.0,POSITIVE,related to daiso,Friendly,
884,,,,,so cute i have a little gnome house i bought like a year ago you have inspired me to finally do it ,2.0,POSITIVE,related to daiso,Elegant,
885,,,,,these are awesome please sell them ,2.0,POSITIVE,related to daiso,Modern,
886,,,,,a so darn cute love the blush and the spots on the cat ,2.0,POSITIVE,related to daiso,Elegant,
888,,,,,they are so cute i can see me annoying the hell out of my husband by buying a load of these ,2.0,POSITIVE,related to daiso,Aggressive,
889,,,,,so cute ,2.0,POSITIVE,related to daiso,Elegant,
890,,,,,ohhhh my gosh this so cute ,2.0,POSITIVE,related to daiso,Friendly,
893,,,,,thank you i got it from a store called daiso in japan but they have an online shop too i think hope this helps ,15.0,POSITIVE,related to daiso,Modern,
894,,,,,thanks i will look for it so cute ,1.0,POSITIVE,related to daiso,Friendly,
897,,,,,me too they are perfect for beginners ahah and thank you ,1.0,POSITIVE,related to daiso,Friendly,
902,,,,,thank you the kits are really nice hope you try them out ,1.0,POSITIVE,related to daiso,Friendly,
906,,,,,aww that is so sweet thank you so much ,1.0,POSITIVE,related to daiso,Friendly,
909,,,,,oh lucky you should totally go haha and thank you so much 3,2.0,POSITIVE,related to daiso,Friendly,
910,,,,,thank you do not worry it is never too late haha ,1.0,POSITIVE,related to daiso,Friendly,
914,,,,,aww thank you so much i am flattered  3,2.0,POSITIVE,related to daiso,Friendly,
915,,,,,oh thank you so much yess i really like the spots on the cat too ahaha ,1.0,POSITIVE,related to daiso,Aggressive,
916,,,,,thanks alot i got mine at daiso from japan they have an online shop too but i have seen similar kits on aliexpress and etsy even a few on amazon hope this helps ,1.0,POSITIVE,related to daiso,Modern,
917,,,,,thank you that is exactly what i have been doing definitely need more kits ahaha ,1.0,POSITIVE,related to daiso,Friendly,
919,,,,,aw thank you so much 3,1.0,POSITIVE,related to daiso,Elegant,
920,,,,,thank you so much oh i feel you i almost gave up so many time but the satisfaction you get once they are done was worth it if you get around finishing your dolphin i would love to see ,2.0,POSITIVE,related to daiso,Modern,
921,,,,,ooh i have been to some daiso stores i love them and i love japan you can by damn near anything there but they are not like walmart they are so so much better ,9.0,POSITIVE,related to daiso,Modern,
922,,,,,i need to find one of these near me i have been binging vivian tries on youtube and she gets stuff there all the time these are adorable ,2.0,POSITIVE,related to daiso,Dynamic,
925,,,,,i got them from a daiso in california it was a few years ago but i am sure they still sell them ,1.0,POSITIVE,related to daiso,Modern,
927,,,,,these are so adorable great job ,1.0,POSITIVE,related to daiso,Friendly,
930,,,,,that is cool i have just heard from friends stories about aliexpress being unreliable so maybe i can find something on amazon ,1.0,POSITIVE,related to daiso,Modern,
932,,,,,you may want to have a look at some weird daiso items over here ,2.0,POSITIVE,related to daiso,Modern,
934,,,,,omg yesss i love it too i could literally spend a week shopping in there xd,9.0,POSITIVE,related to daiso,Friendly,
937,,,,,i have seen similar kits some even cuter on aliexpress i am thnking about ordering some you should check it out ,2.0,POSITIVE,related to daiso,Modern,
938,,,,,i am pretty sure that is the place i bought my bike i love my japanese commuter bike i have fond memories of taking my son all over town before i could i drive there he just sat in a kid seat behind me we went everywhere i could peddle us to ,4.0,POSITIVE,related to daiso,Sporty,
941,,,,,aww that is so sweet 3,3.0,POSITIVE,related to daiso,Friendly,
942,,,,,pedal ,2.0,POSITIVE,related to daiso,Sporty,
943,,,,,oh i def could be getting store names mixed up plus the stores in japan can have other stores in them sometimes so it can be confusing which store you are actually at but the one i am thinking of is a common big store and they sell mostly home goods and i kind of thought of it as a really good sears but bigger and so much better they also have a pet section where they sell pets ,3.0,POSITIVE,related to daiso,Modern,
948,,,,,sounds like a lot of retail outlets ,46.0,POSITIVE,related to daiso,Modern,
949,,,,,entertaining read thanks,90.0,POSITIVE,related to daiso,Dynamic,
956,,,,,i worked in multiple victoria stores and all i have to say is please check this out ,10.0,POSITIVE,related to daiso,Friendly,
957,,,,,we should share more stories like this these places need to be called out ,11.0,POSITIVE,related to daiso,Aggressive,
961,,,,,this is awful i have a daiso up in the north and the girls that work there are not all asian still girls 15 to 25 but that is the reality of customer facing jobs in general look genuinely happy i e dead inside but not clearly stressed and i hope they are well paid ,10.0,POSITIVE,related to daiso,Friendly,
962,,,,,dude i think i found your one star review in indeed bravo ,3.0,POSITIVE,related to daiso,Aggressive,
972,,,,,thanks for this such an interesting read yet so sad hope this post gives others courage to talk about their stories too ,2.0,POSITIVE,related to daiso,Friendly,
975,,,,,i know two people who used to work at daisos in inner melbourne both were white females definitely seen some more white females and asian male employees at the ones i have gone into in the past so the racist hiring might be an issue local to your store but yeah everything else you have said about the shit conditions seems fairly consistent with the stuff i heard about them ,2.0,POSITIVE,related to daiso,Aggressive,
977,,,,,wild ride but wtf is daiso ,2.0,POSITIVE,related to daiso,Modern,
978,,,,,you sound like you work for raffwu regardless the eba i worked under sure as hell was not below minimum wage and i have used sda services many times over the years when my co worker was told he will not get help on his issue from them we had a good laugh and he went sda again before moving i do not follow raffwu socials any more i guess that explains why they seemed quiet now not sure who better read than dead are but good on raffwu for getting that notch in their belt i guess,2.0,POSITIVE,related to daiso,Aggressive,
980,,,,,sounds adorable and fun,-2.0,POSITIVE,related to daiso,Friendly,
982,,,,,i have been to that store many times it did not seem that bad interestingly ,-1.0,POSITIVE,related to daiso,Friendly,
999,,,,,i worked at multiple stores and quitting on a whim was the best decision for my mental health i genuinely wanted to unalive myself ,12.0,POSITIVE,related to daiso,Aggressive,
1000,,,,,yes those boras are in retail everywhere ,24.0,POSITIVE,related to daiso,Modern,
1002,,,,,this also i have been out of retail for 25 years but we used to have a union if any of you are members of the shop distributive and allied employees union then i am sure they would be keen to investigate too ,17.0,POSITIVE,related to daiso,Friendly,
1011,,,,,yes a middle aged adult who loves scolding students must make herself feel quite powerful ,17.0,POSITIVE,related to daiso,Aggressive,
1015,,,,, sounds adorable and fun omg you forgot the obligatory notations to define your post as sarcasm how dare you be so inconsiderate do not people have enough stresses in life at the moment,5.0,POSITIVE,related to daiso,Aggressive,
1016,,,,,the part i really hate is when i hear an employee defend these actions they will usually say oh it is like this in my home country it is normal or oh at least it is better than my home country mate you came to australia and the benefits of australia is the good quality of life compared to many other places and you have so many laws and rights protecting you why are you trying to waive it for no reason ,7.0,POSITIVE,related to daiso,Aggressive,
1026,,,,,the sda keen to investigate you are hilarious ,67.0,POSITIVE,related to daiso,Aggressive,
1028,,,,,sounds very american of them ,10.0,POSITIVE,related to daiso,Aggressive,
1029,,,,,it is a name that must be remembered and heard ,10.0,POSITIVE,related to daiso,Powerful,
1035,,,,,i do not disagree with that being unfair but as an asian woman i disagree with you characterising asian women as being vulnerable just because they are asian women ,2.0,POSITIVE,related to daiso,Aggressive,
1044,,,,,i currently live in japan and usually end up visiting a daiso once a month ,0.0,POSITIVE,related to daiso,Modern,
