,Unnamed: 0,subreddit,title,selftext,ups,overall_text,comment ups,sentiment,relevance,emotion,score,emotional_color,emotional color score,color
1,26,,,,,the final shape,1,POSITIVE,related to levi's jeans,Dynamic,"{'Dynamic': 0.2109181141439206, 'Modern': 0.16129032258064516, 'Elegant': 0.1588089330024814, 'Stable': 0.14640198511166252, 'Aggressive': 0.10669975186104218, 'Friendly': 0.08933002481389578, 'Sporty': 0.08188585607940446, 'Powerful': 0.04466501240694789}",Success,"{'Flamboyance': 0.07901907356948229, 'Balance': 0.0653950953678474, 'Femininity': 0.051771117166212535, 'Modesty': 0.04087193460490463, 'Success': 0.04087193460490463, 'Courage': 0.04087193460490463, 'Family': 0.035422343324250684, 'Reliable': 0.02997275204359673, 'Mystery': 0.027247956403269755, 'Anger': 0.027247956403269755, 'Passion': 0.027247956403269755, 'Joy': 0.02452316076294278, 'Happiness': 0.02452316076294278, 'Respect': 0.02452316076294278, 'Strength': 0.021798365122615803, 'Trust': 0.01634877384196185, 'Fun': 0.01634877384196185, 'Earthy': 0.013623978201634877, 'Freedom': 0.013623978201634877, 'Loyalty': 0.013623978201634877, 'Decadence': 0.013623978201634877, 'Friendly': 0.010899182561307902, 'Luxury': 0.010899182561307902, 'Danger': 0.010899182561307902, 'Fortune': 0.008174386920980926, 'Money': 0.008174386920980926, 'Cold': 0.005449591280653951, 'Peace': 0.005449591280653951, 'Energy': 0.005449591280653951, 'Warmth': 0.005449591280653951, 'Power': 0.005449591280653951, 'Wisdom': 0.005449591280653951, 'Nature': 0.005449591280653951, 'Royalty': 0.0027247956403269754, 'Self-cultivation': 0.0027247956403269754, 'Intelligence': 0.0027247956403269754, 'Growth': 0.0027247956403269754}",purple
2,33,,,,,ordered xl and it fits perfect if you want the oversize fit you should definitely order one size up ,1,POSITIVE,related to levi's jeans,Modern,,Style,,
4,48,,,,,since i am xl 2xl ish i think 2xl should be perfect gonna hit the gym soon then it will fit more and more perfect thanks brother ,1,POSITIVE,related to levi's jeans,Sporty,,Strength,,
6,67,,,,,another levi classic  ,2549,POSITIVE,related to levi's jeans,Elegant,,Courage,,
7,81,,,,,my father has this poster on the wall in of his shop he has had it since i was a little guy i was born in the late 70s good times,22,POSITIVE,related to levi's jeans,Stable,,Family,,
8,84,,,,,all i can think about now is pacino saying great ass from heat ,9,POSITIVE,related to levi's jeans,Aggressive,,Excitement,,
9,87,,,,,that is a nice bottom,35,POSITIVE,related to levi's jeans,Elegant,,Femininity,,
10,99,,,,,stupid sexy flanders,4,POSITIVE,related to levi's jeans,Elegant,,Flamboyance,,
11,111,,,,,that is a nice ad ,3,POSITIVE,related to levi's jeans,Elegant,,Excitement,,
13,124,,,,,wrangler needs one of these with brett favre,2,POSITIVE,related to levi's jeans,Sporty,,Courage,,
15,126,,,,,nice ad ,2,POSITIVE,related to levi's jeans,Friendly,,Friendly,,
16,128,,,,,that is the best ad i have ever seen ,2,POSITIVE,related to levi's jeans,Dynamic,,Excitement,,
17,130,,,,,what a fantastic ass ,2,POSITIVE,related to levi's jeans,Elegant,,Flamboyance,,
18,132,,,,, fits like the skin you are in almost certain that is the intended tagline ,2,POSITIVE,related to levi's jeans,Dynamic,,Modesty,,
19,133,,,,,it is amazing how long i was staring at that ass had to be at least 45 seconds before i broke it is spell over me ,2,POSITIVE,related to levi's jeans,Aggressive,,Passion,,
20,134,,,,,what a great ass levis the jeans you can easily take off ,2,POSITIVE,related to levi's jeans,Sporty,,Modesty,,
21,137,,,,,that ass is classic ,2,POSITIVE,related to levi's jeans,Elegant,,Flamboyance,,
22,138,,,,,that is one perfect ass,2,POSITIVE,related to levi's jeans,Elegant,,Modesty,,
23,139,,,,,that is a phenomenal 1971 butt,2,POSITIVE,related to levi's jeans,Sporty,,Joy,,
24,140,,,,,that ass is almost kate good ,2,POSITIVE,related to levi's jeans,Aggressive,,Modesty,,
25,144,,,,,best ad ever ,2,POSITIVE,related to levi's jeans,Dynamic,,Excitement,,
26,148,,,,,i would rock it,2,POSITIVE,related to levi's jeans,Dynamic,,Excitement,,
27,152,,,,,stupid sexy levi is ,2,POSITIVE,related to levi's jeans,Dynamic,,Flamboyance,,
28,155,,,,,i would buy those jeans ,2,POSITIVE,related to levi's jeans,Modern,,Style,,
29,161,,,,,that was amazing ,921,POSITIVE,related to levi's jeans,Dynamic,,Happiness,,
30,165,,,,,excellent soundtrack by mc 900ft jesus ,55,POSITIVE,related to levi's jeans,Dynamic,,Excitement,,
31,166,,,,,i remember seeing this on tv as a very young kid in the early 90s also holy fuck this should be taught as an example of the perfect commercial ,67,POSITIVE,related to levi's jeans,Dynamic,,Excitement,,
32,167,,,,,geeze that is a good ad ,117,POSITIVE,related to levi's jeans,Dynamic,,Excitement,,
33,169,,,,,holy shit i have not seen that commercial in so long thank you ,5,POSITIVE,related to levi's jeans,Friendly,,Excitement,,
35,186,,,,,they airbrushed a heart above her crack  her back dimples and the top of her crack ,5,POSITIVE,related to levi's jeans,Elegant,,Passion,,
36,188,,,,,stupid sexy flanders ,20,POSITIVE,related to levi's jeans,Elegant,,Flamboyance,,
37,204,,,,,it is worked recently for ,65,POSITIVE,related to levi's jeans,Modern,,Success,,
38,205,,,,,well seeing as how the woman in the add has a nice ass and this has been very coveted ahem asset for women for quite awhile now perhaps they are trying to sell the image of their jeans making women is rears look really nice i could be wrong but that is what i am seeing ,34,POSITIVE,related to levi's jeans,Elegant,,Femininity,,
39,207,,,,,considering how tight the pants women wear it makes perfect sense ,4,POSITIVE,related to levi's jeans,Modern,,Femininity,,
40,208,,,,,i proudly present ,306,POSITIVE,related to levi's jeans,Powerful,,Success,,
41,210,,,,,this is the greatest gif of it is kind i have seen perfect ,20,POSITIVE,related to levi's jeans,Dynamic,,Excitement,,
42,220,,,,,eating disorders became popular anorexia nervosa continued to rapidly increase into the next decade and became known as the disorder of the 80s suggesting that diseases particularly psychiatric disorders are often directly linked to cultural contexts though some aspects of anorexia exhibits both noncultural and cultural incidences by the mid 1980s college campuses instituted counseling or support systems and public awareness reached a peak when popular singer karen carpenter died of cardiac arrest  ,31,POSITIVE,related to levi's jeans,Elegant,,Decadence,,
43,224,,,,,well i once saw a fat lady wearing skin colored leggings under a long coat so  yes ,17,POSITIVE,related to levi's jeans,Elegant,,Modesty,,
44,236,,,,, says it was from 1995 which seems more accurate ,34,POSITIVE,related to levi's jeans,Modern,,Mystery,,
45,243,,,,,ah that is why your name is red you are the person who does all the amazing things that make me feel like i am doing nothing worthwhile with my life ,5,POSITIVE,related to levi's jeans,Powerful,,Respect,,
46,246,,,,,lots of jeans still have em unbranded is a brand that comes to mind bit expensive for some people but its real raw denim and has a button fly i love mine ,3,POSITIVE,related to levi's jeans,Stable,,Balance,,
47,251,,,,,he is the hero reddit needs,34,POSITIVE,related to levi's jeans,Powerful,,Courage,,
48,253,,,,,i am into it ,19,POSITIVE,related to levi's jeans,Dynamic,,Passion,,
49,257,,,,,i remember that gallery it kind of felt like a tourist trap based on prices but it was sure fun to check everything out ,3,POSITIVE,related to levi's jeans,Friendly,,Fun,,
50,262,,,,,oh god the sears catalog the lengths that i have gone to in order to jerk off have been pretty legendary before i knew about google and internet porn i had to settle for my mom is sears catalog i have a pretty funny story about going through hell trying to find the right porn to fap to if anyone is interested in hearing it ,58,POSITIVE,related to levi's jeans,Aggressive,,Modesty,,
51,263,,,,,thank you victoria secret mailer ,5,POSITIVE,related to levi's jeans,Elegant,,Femininity,,
52,266,,,,,happy birthday that ass ,156,POSITIVE,related to levi's jeans,Aggressive,,Anger,,
53,269,,,,, jim carrey ,7,POSITIVE,related to levi's jeans,Dynamic,,Excitement,,
54,282,,,,,da whole club was lookin at hurr,149,POSITIVE,related to levi's jeans,Dynamic,,Flamboyance,,
55,301,,,,,plenty of 64 year old have tight asses,19,POSITIVE,related to levi's jeans,Sporty,,Modesty,,
56,302,,,,,yeah little bit what you packing ,16,POSITIVE,related to levi's jeans,Dynamic,,Excitement,,
57,303,,,,,you mean semens huh is i get it right my main man soul brother number one ,5,POSITIVE,related to levi's jeans,Dynamic,,Anger,,
58,310,,,,,there is the corona one too with the palm tree that lights up ,22,POSITIVE,related to levi's jeans,Modern,,Nature,,
59,318,,,,,the music is from 1995 1996 falling elevators mc 900 so this makes sense ,5,POSITIVE,related to levi's jeans,Dynamic,,Excitement,,
60,321,,,,,  amazing song ,3,POSITIVE,related to levi's jeans,Dynamic,,Excitement,,
61,322,,,,,she is the awesome photographer who posts her work every now and then and it almost always makes it to the front page because she does pretty awesome work it also helps that she is attractive ,30,POSITIVE,related to levi's jeans,Dynamic,,Flamboyance,,
62,323,,,,,well she does look awesome ,4,POSITIVE,related to levi's jeans,Elegant,,Flamboyance,,
63,327,,,,,apparently levi is does ,583,POSITIVE,related to levi's jeans,Aggressive,,Loyalty,,
64,335,,,,,dude you are a hero ,11,POSITIVE,related to levi's jeans,Powerful,,Courage,,
65,336,,,,,i hope you they kept it pics ,3,POSITIVE,related to levi's jeans,Modern,,Mystery,,
67,360,,,,,it is fashion look it up ,136,POSITIVE,related to levi's jeans,Elegant,,Style,,
68,364,,,,,everywhere 1970s more like ,52,POSITIVE,related to levi's jeans,Modern,,Flamboyance,,
69,366,,,,,tight tight tight,29,POSITIVE,related to levi's jeans,Aggressive,,Balance,,
70,370,,,,, do do do do bink bink it has begun ,95,POSITIVE,related to levi's jeans,Aggressive,,Excitement,,
73,396,,,,,hmm i am a photographer i can retouch this photo by hand with an airbrush or i can grab a marker and draw on this phenomenal ass what should i do ,36,POSITIVE,related to levi's jeans,Aggressive,,Flamboyance,,
74,402,,,,,the girl with the dragon tattoo,8,POSITIVE,related to levi's jeans,Aggressive,,Mystery,,
75,403,,,,,the girl i think with the dragon tattoo ,6,POSITIVE,related to levi's jeans,Aggressive,,Mystery,,
76,404,,,,,the girl with the dragon i think tattoo,4,POSITIVE,related to levi's jeans,Dynamic,,Mystery,,
77,416,,,,,in accordance with reddit tradition i will now observe that call me by blondie 1980 is the same number of years from 2015 and 1945 ,59,POSITIVE,related to levi's jeans,Modern,,Excitement,,
78,435,,,,,r i p eric the midget ,3,POSITIVE,related to levi's jeans,Aggressive,,Respect,,
79,440,,,,,yeah bayby ,170,POSITIVE,related to levi's jeans,Aggressive,,Excitement,,
81,457,,,,,jesus man ,43,POSITIVE,related to levi's jeans,Aggressive,,Respect,,
82,462,,,,,this thread of comments is just great ,6,POSITIVE,related to levi's jeans,Friendly,,Happiness,,
84,481,,,,,i am pretty much speechless and impressed that a 59 year old grandmother not only read that post in its entirety but probably upvoted it and replied to it and related to it,5,POSITIVE,related to levi's jeans,Dynamic,,Joy,,
85,486,,,,,it is true bing wins bing is to google what gmail is to hotmail ,5,POSITIVE,related to levi's jeans,Dynamic,,Success,,
86,487,,,,,let is see the pics nate you going to let her wine after that battle ,14,POSITIVE,related to levi's jeans,Aggressive,,Courage,,
87,491,,,,,david tennant the man who single handily ignited one of the biggest fandoms on tumblr ,123,POSITIVE,related to levi's jeans,Dynamic,,Excitement,,
88,512,,,,,she knew ,4,POSITIVE,related to levi's jeans,Elegant,,Passion,,
89,528,,,,,this thread is awesome,128,POSITIVE,related to levi's jeans,Dynamic,,Excitement,,
90,533,,,,,have you ever seen taylor swift ,8,POSITIVE,related to levi's jeans,Dynamic,,Excitement,,
91,537,,,,, dank memes ftfy,6,POSITIVE,related to levi's jeans,Modern,,Fun,,
92,551,,,,,i think she sings that fireworks song or something ,5,POSITIVE,related to levi's jeans,Dynamic,,Excitement,,
94,559,,,,,still do not need washing yet,658,POSITIVE,related to levi's jeans,Friendly,,Balance,,
95,572,,,,,levi 511 slims are my fav jeans of all time not too tight not too frumpy just right ,16,POSITIVE,related to levi's jeans,Modern,,Style,,
98,580,,,,, shakes bones out of jeans,5,POSITIVE,related to levi's jeans,Dynamic,,Mystery,,
99,582,,,,,they still have the airpods pocket intact,4,POSITIVE,related to levi's jeans,Modern,,Style,,
101,592,,,,,imagine time traveling back to the 1800s and you see a dude rocking these and a t shirt ,3,POSITIVE,related to levi's jeans,Sporty,,Flamboyance,,
102,596,,,,,everytime i see levi is i think of cerro gordo now thanks brent,65,POSITIVE,related to levi's jeans,Aggressive,,Joy,,
103,597,,,,,brent is awesome ,44,POSITIVE,related to levi's jeans,Friendly,,Joy,,
104,604,,,,,exactly where my mind went haha my family lives below cerro gordo,3,POSITIVE,related to levi's jeans,Friendly,,Family,,
105,612,,,,, without belt loops ,169,POSITIVE,related to levi's jeans,Stable,,Balance,,
106,617,,,,,coincidence ,18,POSITIVE,related to levi's jeans,Dynamic,,Mystery,,
107,618,,,,,they still have the crotch rivet ,12,POSITIVE,related to levi's jeans,Aggressive,,Modesty,,
110,630,,,,,jeans were typically owned by the mines the miners would go to the mines get the jeans for the day and then change into them and use them as an outerwear once they are done with their shift they change back to their normal close and then leave the mine keep in mind that these mines are typically in the middle of nowhere even today 100 miles from any town and very often thousands of feet up in the mountains if a mine goes bust the owners take what they can to recoup cost but a lot of the stuff stays ,26,POSITIVE,related to levi's jeans,Stable,,Strength,,
111,638,,,,,he stole mickey is hands and is wearing them,7,POSITIVE,related to levi's jeans,Aggressive,,Anger,,
112,639,,,,,low rider he cool,4,POSITIVE,related to levi's jeans,Sporty,,Style,,
113,645,,,,,r rawdenim,17,POSITIVE,related to levi's jeans,Sporty,,Earthy,,
114,647,,,,,cowboys probably wore them all the time,26,POSITIVE,related to levi's jeans,Stable,,Courage,,
115,668,,,,,turns out the make them almost exactly like they used to ,101,POSITIVE,related to levi's jeans,Stable,,Balance,,
118,683,,,,,awesome ,3,POSITIVE,related to levi's jeans,Dynamic,,Excitement,,
119,707,,,,,leon the jean god tell me leon do the legs of these bad boys continue on in roomy jnco fashion or flare to a more of a structure esque boot cut ,47,POSITIVE,related to levi's jeans,Sporty,,Style,,
120,725,,,,, bring a change of pants with you when it happens you will know why ,10,POSITIVE,related to levi's jeans,Dynamic,,Danger,,
122,738,,,,,the oj simpson model ,492,POSITIVE,related to levi's jeans,Aggressive,,Danger,,
123,746,,,,,never underestimate rich hipsters,25,POSITIVE,related to levi's jeans,Modern,,Flamboyance,,
124,747,,,,,apairently this particular pair is worth north of a half million dollars,3,POSITIVE,related to levi's jeans,Elegant,,Money,,
125,751,,,,,she can take her pick ,3,POSITIVE,related to levi's jeans,Elegant,,Courage,,
126,759,,,,,just look up raw denim,3,POSITIVE,related to levi's jeans,Stable,,Earthy,,
127,764,,,,,collectors the guy who bought mine flew from japan i made him buy me a rt ticket to lax to meet him he said he had already sold them for 30k he explained that they are like art the prices always increase and it is a safe investment almost all high end denim dealers are in japan i asked if the buyer would wear them he said usually no because most old jeans are weird sizes mine were a 32 which is rare ,203,POSITIVE,related to levi's jeans,Modern,,Luxury,,
128,778,,,,, ronald reagan the actor  ,211,POSITIVE,related to levi's jeans,Dynamic,,Royalty,,
129,791,,,,,i keep a flashlight in mine ,4,POSITIVE,related to levi's jeans,Powerful,,Energy,,
130,794,,,,,just like a century ago ,6,POSITIVE,related to levi's jeans,Elegant,,Mystery,,
131,802,,,,,speak da truth,3,POSITIVE,related to levi's jeans,Powerful,,Respect,,
132,808,,,,,zippos fit there quite well ,4,POSITIVE,related to levi's jeans,Sporty,,Cold,,
133,810,,,,,a good pair still is expensive ,5,POSITIVE,related to levi's jeans,Elegant,,Luxury,,
135,818,,,,,the brotherhood of the traveling pants,3,POSITIVE,related to levi's jeans,Friendly,,Family,,
136,819,,,,, for anyone else interested it is super chill,3,POSITIVE,related to levi's jeans,Friendly,,Peace,,
139,836,,,,,the music he uses matched up with the vistas calms my soul ,131,POSITIVE,related to levi's jeans,Friendly,,Peace,,
140,839,,,,,count me in it is been a ride with him ,11,POSITIVE,related to levi's jeans,Dynamic,,Loyalty,,
141,845,,,,,i used to have a vintage clothes business in the late 90 is and they would have sold for 20k to someone in japan they would be made of a think hemp with a few extra rivets the legs in the inside would be finished with a red ribbon from the loom i bet they are still trickling up to the real price i would guess about 50k if they are a 34 it is like finding a perfect diamond in the vintage world it is so exciting that you experienced that ,3,POSITIVE,related to levi's jeans,Elegant,,Flamboyance,,
142,848,,,,,haha i will take what i can get,3,POSITIVE,related to levi's jeans,Dynamic,,Joy,,
143,857,,,,, and the women seem to be the hardest working considering many of them have holes in their levis ,2739,POSITIVE,related to levi's jeans,Aggressive,,Strength,,
144,859,,,,,even paris hilton ,263,POSITIVE,related to levi's jeans,Elegant,,Flamboyance,,
145,864,,,,,oh doc thanks i needed that ,25,POSITIVE,related to levi's jeans,Friendly,,Happiness,,
147,871,,,,,i can just imagine the smell ,48,POSITIVE,related to levi's jeans,Elegant,,Earthy,,
148,872,,,,,mmm love it when they are still warm and funky,20,POSITIVE,related to levi's jeans,Dynamic,,Passion,,
149,883,,,,,i agree with this source wearing them now ,14,POSITIVE,related to levi's jeans,Modern,,Style,,
150,893,,,,,truth in repetition ,74,POSITIVE,related to levi's jeans,Dynamic,,Trust,,
151,898,,,,,136 years 136 years,12,POSITIVE,related to levi's jeans,Stable,,Fortune,,
152,901,,,,,guys come join us over at r cerrogordo brent usually posts there and it is a great way to stay up to date ,120,POSITIVE,related to levi's jeans,Dynamic,,Friendly,,
153,914,,,,,that is hot,176,POSITIVE,related to levi's jeans,Aggressive,,Warmth,,
154,918,,,,,mandatory education ,16,POSITIVE,related to levi's jeans,Modern,,Self-cultivation,,
155,939,,,,,watching her hand stitch is just so satisfying have you ever turned on subtitles she does them herself and they can be super funny ,3,POSITIVE,related to levi's jeans,Elegant,,Fun,,
156,944,,,,,truth in repetition ,27,POSITIVE,related to levi's jeans,Dynamic,,Trust,,
157,948,,,,,joined awesome thanks ,30,POSITIVE,related to levi's jeans,Dynamic,,Excitement,,
158,959,,,,,hello fellow old redditor ,21,POSITIVE,related to levi's jeans,Friendly,,Respect,,
160,966,,,,,tiling thanks ,10,POSITIVE,related to levi's jeans,Dynamic,,Balance,,
162,969,,,,,wow the dedication to denim in that subreddit is a trip ,10,POSITIVE,related to levi's jeans,Modern,,Flamboyance,,
165,980,,,,,truth in repetition ,24,POSITIVE,related to levi's jeans,Dynamic,,Trust,,
166,999,,,,,they are durable also somehow enough warm to be worn in a wide temperature range ,56,POSITIVE,related to levi's jeans,Stable,,Balance,,
167,1000,,,,,honestly jeans are so versitile i feel like i can do gymnastics in them sometimes very breatheable feel nice keep temperature and all around you can wear them with anything if there was a single thing i could wear it would be a nice pair of jeans ,28,POSITIVE,related to levi's jeans,Sporty,,Balance,,
168,1002,,,,,growing up on a farm when you bought them back in the day they were stiff blue and sorta of heavy and cheap once you started working they broke in like a glove and got better with age all in all a perfect work pant for most situations ,7,POSITIVE,related to levi's jeans,Stable,,Earthy,,
171,1009,,,,,truth in repetition ,15,POSITIVE,related to levi's jeans,Dynamic,,Trust,,
172,1025,,,,,and they go with almost literally everything,5,POSITIVE,related to levi's jeans,Dynamic,,Balance,,
175,1037,,,,,sounds like my kinda place,4,POSITIVE,related to levi's jeans,Dynamic,,Excitement,,
176,1043,,,,,still more pocket space than women is jeans today ,3532,POSITIVE,related to levi's jeans,Modern,,Femininity,,
177,1047,,,,, hey joanne i need you to lean a little more to the right your vagina is still showing photographer,114,POSITIVE,related to levi's jeans,Elegant,,Modesty,,
178,1054,,,,,levi is commercial from  heydays,37,POSITIVE,related to levi's jeans,Sporty,,Flamboyance,,
179,1061,,,,,that is like the most perfect ass ,18,POSITIVE,related to levi's jeans,Elegant,,Flamboyance,,
180,1071,,,,,levi is showing a bit more cheek than usual ,3,POSITIVE,related to levi's jeans,Elegant,,Flamboyance,,
181,1077,,,,,i like those jeans i can not wait for that fad to catch on ,7,POSITIVE,related to levi's jeans,Modern,,Style,,
182,1078,,,,,that is a perfect butt i want one ,3,POSITIVE,related to levi's jeans,Aggressive,,Flamboyance,,
183,1091,,,,,don draper strikes again ,2,POSITIVE,related to levi's jeans,Dynamic,,Flamboyance,,
184,1093,,,,,it was a better time,2,POSITIVE,related to levi's jeans,Elegant,,Happiness,,
185,1102,,,,,smooth,23,POSITIVE,related to levi's jeans,Dynamic,,Balance,,
186,1127,,,,, levi is jeans for jlaw ,179,POSITIVE,related to levi's jeans,Modern,,Style,,
187,1135,,,,,brings back memories of the naked women bathing in milk subway ads in the 90s some people were not happy freer times ,38,POSITIVE,related to levi's jeans,Elegant,,Decadence,,
188,1146,,,,,i can just hear don draper pitching that ,16,POSITIVE,related to levi's jeans,Elegant,,Success,,
189,1169,,,,,i am into it ,1,POSITIVE,related to levi's jeans,Dynamic,,Passion,,
191,1211,,,,,i would conquer nations for nigella lawson ,2,POSITIVE,related to levi's jeans,Aggressive,,Passion,,
192,1213,,,,,i would like to be one of those artists,2,POSITIVE,related to levi's jeans,Dynamic,,Passion,,
193,1216,,,,,stupid sexy flanders ,413,POSITIVE,related to levi's jeans,Elegant,,Flamboyance,,
194,1230,,,,,i have that book it is fecking brilliant ,5,POSITIVE,related to levi's jeans,Dynamic,,Excitement,,
195,1234,,,,,yeah baby ,4,POSITIVE,related to levi's jeans,Dynamic,,Excitement,,
196,1247,,,,,that is clearly not the same picture but inspired by it ,5,POSITIVE,related to levi's jeans,Dynamic,,Excitement,,
197,1248,,,,,damned good ass for a 6 year old tho ,75,POSITIVE,related to levi's jeans,Aggressive,,Courage,,
198,1252,,,,,dude is having a day it seems ,3,POSITIVE,related to levi's jeans,Aggressive,,Anger,,
199,1269,,,,,it definitely can be ,4,POSITIVE,related to levi's jeans,Dynamic,,Excitement,,
200,1271,,,,,e good thing they fixed that,39,POSITIVE,related to levi's jeans,Stable,,Success,,
201,1274,,,,,i go cargo   ,19,POSITIVE,related to levi's jeans,Sporty,,Danger,,
202,1276,,,,, fiber,3,POSITIVE,related to levi's jeans,Stable,,Strength,,
203,1280,,,,,levi is jeans for jlaw ,204,POSITIVE,related to levi's jeans,Sporty,,Style,,
204,1285,,,,,open your mouth super big,2,POSITIVE,related to levi's jeans,Dynamic,,Excitement,,
205,1287,,,,,found the it guy,46,POSITIVE,related to levi's jeans,Modern,,Intelligence,,
206,1297,,,,,he should mail it to the levis ceo in fact he he should ask them to meet for lunch so they can touch base ceos love to touch base ,29,POSITIVE,related to levi's jeans,Powerful,,Power,,
207,1299,,,,,the game ,4,POSITIVE,related to levi's jeans,Dynamic,,Excitement,,
208,1308,,,,,she scrubs up well for a posh bird ,5,POSITIVE,related to levi's jeans,Elegant,,Flamboyance,,
209,1311,,,,,the video is funnier than i thought ,148,POSITIVE,related to levi's jeans,Dynamic,,Excitement,,
210,1322,,,,,she got it from me ,2,POSITIVE,related to levi's jeans,Aggressive,,Loyalty,,
212,1336,,,,,now you are on a list,67,POSITIVE,related to levi's jeans,Dynamic,,Respect,,
213,1339,,,,,he needs to get together with sad keanu and they can cheer each other up ,4,POSITIVE,related to levi's jeans,Friendly,,Happiness,,
214,1343,,,,,yes you do we all have all day as we put off our lives for the next blue link ,7,POSITIVE,related to levi's jeans,Dynamic,,Excitement,,
215,1344,,,,,recognise her from a single ass shot,2,POSITIVE,related to levi's jeans,Aggressive,,Femininity,,
217,1370,,,,,the unicorn of womenswear ,2,POSITIVE,related to levi's jeans,Elegant,,Femininity,,
218,1374,,,,,it feel true but it make me wonder why they do not do the same for me ,2,POSITIVE,related to levi's jeans,Friendly,,Respect,,
219,1386,,,,,am canadian ,2,POSITIVE,related to levi's jeans,Friendly,,Friendly,,
221,1389,,,,, i gotta get it wet again fucking hilarious,83,POSITIVE,related to levi's jeans,Dynamic,,Excitement,,
222,1406,,,,,that 6 year old is on my list ,23,POSITIVE,related to levi's jeans,Aggressive,,Anger,,
223,1407,,,,,add that to the invention of yoga pants and i am going to have to agree with you what a time to be alive ,122,POSITIVE,related to levi's jeans,Dynamic,,Balance,,
224,1426,,,,,sweet ,2,POSITIVE,related to levi's jeans,Elegant,,Femininity,,
225,1428,,,,,that was beautiful ,3,POSITIVE,related to levi's jeans,Elegant,,Happiness,,
227,1442,,,,,you came so  did  i  ,69,POSITIVE,related to levi's jeans,Dynamic,,Excitement,,
228,1452,,,,,holy hell that is funny,2,POSITIVE,related to levi's jeans,Friendly,,Fun,,
