,Unnamed: 0,subreddit,title,selftext,ups,overall_text,comment ups,sentiment,relevance,emotion,score,emotional_color,emotional color score,color
229,1458,,,,,twerking got big yoga pants got big kim kardashian must be thanked too she made big butts go mainstream ,32,POSITIVE,related to levi's jeans,Aggressive,,Flamboyance,,
230,1473,,,,,you know that jeans come in different lengths right ,5,POSITIVE,related to levi's jeans,Stable,,Balance,,
231,1474,,,,,god i love eshakti i swear i sound like a crazy mtm lunatic when i talk about them because i so enthusiastically love their dresses and their pockets ,2,POSITIVE,related to levi's jeans,Elegant,,Excitement,,
232,1475,,,,,achievement unlocked,44,POSITIVE,related to levi's jeans,Dynamic,,Success,,
233,1491,,,,,pretty sure jennifer lopez made them go mainstream before kim kardashian ,38,POSITIVE,related to levi's jeans,Elegant,,Flamboyance,,
234,1493,,,,,so hot right now ,3,POSITIVE,related to levi's jeans,Dynamic,,Warmth,,
235,1494,,,,,uncle ray ray is got a game ,2,POSITIVE,related to levi's jeans,Sporty,,Family,,
236,1499,,,,,this is my spirit animal,17,POSITIVE,related to levi's jeans,Dynamic,,Passion,,
240,1527,,,,,for the curious here are some great resources for levi is 501s    source i run a little vintage clothing company ,45,POSITIVE,related to levi's jeans,Modern,,Style,,
241,1528,,,,,there was a real cool documentary on jeans and how they rose to popularity i do not know if it is still on netflix or not ,33,POSITIVE,related to levi's jeans,Modern,,Style,,
242,1532,,,,,it is amazing how little has changed with the design you do not mess with success ,24,POSITIVE,related to levi's jeans,Stable,,Success,,
243,1535,,,,,r rawdenim,13,POSITIVE,related to levi's jeans,Sporty,,Earthy,,
245,1544,,,,,impressive ,5,POSITIVE,related to levi's jeans,Powerful,,Success,,
246,1548,,,,,i remember when pants were able to last this long now you are lucky to get a couple years lol ,3,POSITIVE,related to levi's jeans,Stable,,Decadence,,
247,1549,,,,,they last forever i have 2 vintage pairs from the 80 is and they look brand new,3,POSITIVE,related to levi's jeans,Stable,,Style,,
248,1557,,,,,neat they could fit their cell phones in that tiny pockette ,2,POSITIVE,related to levi's jeans,Modern,,Style,,
249,1562,,,,,the wash on them looks amazing ,2,POSITIVE,related to levi's jeans,Elegant,,Style,,
250,1567,,,,,vintage,2,POSITIVE,related to levi's jeans,Elegant,,Flamboyance,,
251,1571,,,,,i am not being sarcastic but they actually look just like the jeans in many designer stores today ,2,POSITIVE,related to levi's jeans,Modern,,Style,,
252,1573,,,,,cool,2,POSITIVE,related to levi's jeans,Modern,,Cold,,
253,1589,,,,,that is incredible they look almost exactly like the ones in wearing right now same color wear and everthing ,1,POSITIVE,related to levi's jeans,Elegant,,Style,,
254,1590,,,,,well that was a wise wardrobe investment ,1,POSITIVE,related to levi's jeans,Elegant,,Wisdom,,
255,1593,,,,,reverend blue jeans ,1,POSITIVE,related to levi's jeans,Elegant,,Flamboyance,,
257,1595,,,,, not to sound like an ass on reddit but no dude welcome it is what we do ,1,POSITIVE,related to levi's jeans,Friendly,,Anger,,
258,1597,,,,,yeah very cool but what is the fit i only wear bootcut ,1,POSITIVE,related to levi's jeans,Sporty,,Style,,
259,1599,,,,,best i can do is 15 bucks,1,POSITIVE,related to levi's jeans,Friendly,,Money,,
260,1600,,,,,give pre warn a whole new meaning,1,POSITIVE,related to levi's jeans,Aggressive,,Excitement,,
261,1602,,,,, new jeans by kanye west dollar8 000 for a pair ,1,POSITIVE,related to levi's jeans,Modern,,Luxury,,
262,1603,,,,,looks like brand new,1,POSITIVE,related to levi's jeans,Modern,,Excitement,,
263,1606,,,,,meh would still wear them,1,POSITIVE,related to levi's jeans,Friendly,,Style,,
264,1607,,,,,oooooo vintage ,1,POSITIVE,related to levi's jeans,Elegant,,Flamboyance,,
265,1610,,,,,they look in better condition than the ones i have from last year ,1,POSITIVE,related to levi's jeans,Stable,,Growth,,
266,1614,,,,,they look quite similar to modern jeans ,1,POSITIVE,related to levi's jeans,Modern,,Style,,
267,1621,,,,, enduring,1,POSITIVE,related to levi's jeans,Stable,,Strength,,
268,1623,,,,,that is the kind of levi is that are built to last,1,POSITIVE,related to levi's jeans,Stable,,Reliable,,
269,1630,,,,,i get a pair of joycons,1,POSITIVE,related to levi's jeans,Dynamic,,Excitement,,
270,1633,,,,,soon to be reunited with their original owner keanu reeves,1,POSITIVE,related to levi's jeans,Friendly,,Joy,,
271,1635,,,,,bet you i can one older omw to goodwill ,1,POSITIVE,related to levi's jeans,Friendly,,Family,,
273,1639,,,,,oh wow trousers from not very long ago cool ,1,POSITIVE,related to levi's jeans,Modern,,Style,,
274,1641,,,,,goddamn look at the pristine well built and excellent quality,1,POSITIVE,related to levi's jeans,Elegant,,Success,,
275,1646,,,,,how would you date check jeans ,1,POSITIVE,related to levi's jeans,Sporty,,Style,,
276,1652,,,,,theres somethin so funny about imagining a dude in the 1800s wearing jeans,1,POSITIVE,related to levi's jeans,Modern,,Fun,,
277,1654,,,,,looks exactly like my current pair ,1,POSITIVE,related to levi's jeans,Modern,,Style,,
278,1655,,,,,sweet somebody found my jeans ,1,POSITIVE,related to levi's jeans,Friendly,,Joy,,
279,1660,,,,,fascinating no idea i was interested in the oldest pair of jeans here i sit though amazed someone would go to such lengths to preserve pants ,1,POSITIVE,related to levi's jeans,Elegant,,Modesty,,
280,1661,,,,,still look good to go,1,POSITIVE,related to levi's jeans,Elegant,,Excitement,,
281,1668,,,,,i think i had a pair of suspender jeans as a kid in the 90s i loved em because my gramps always wore suspenders so it made me feel like him,20,POSITIVE,related to levi's jeans,Elegant,,Family,,
282,1683,,,,,49ers burning their nuts on mk 1 levi is is my favorite gold rush fact ,1,POSITIVE,related to levi's jeans,Sporty,,Excitement,,
283,1684,,,,,levi is even made ,1,POSITIVE,related to levi's jeans,Aggressive,,Balance,,
284,1687,,,,,this shit is so cool,1,POSITIVE,related to levi's jeans,Dynamic,,Excitement,,
285,1694,,,,,beautiful town the ruins are really cool ,1,POSITIVE,related to levi's jeans,Elegant,,Mystery,,
288,1733,,,,,just like the acoustics in here ,1,POSITIVE,related to levi's jeans,Dynamic,,Balance,,
289,1734,,,,,try prison blues they are pretty nice ,1,POSITIVE,related to levi's jeans,Stable,,Freedom,,
290,1766,,,,,enjoy was just there a couple weeks ago for the tour de france stage the roman history and buildings are great ,2,POSITIVE,related to levi's jeans,Dynamic,,Excitement,,
291,1767,,,,,wow that would be amazing ,1,POSITIVE,related to levi's jeans,Dynamic,,Excitement,,
292,1769,,,,,this is reality today,11,POSITIVE,related to levi's jeans,Modern,,Anger,,
295,1783,,,,,6 figures if you find a pair wow ,31,POSITIVE,related to levi's jeans,Powerful,,Excitement,,
297,1799,,,,,huh seems the 33 is are more popular than i assumed i thought i was the only one that liked them,2,POSITIVE,related to levi's jeans,Dynamic,,Joy,,
299,1801,,,,,truly ahead of their time ,3,POSITIVE,related to levi's jeans,Modern,,Wisdom,,
300,1806,,,,,now that is numberwang,5,POSITIVE,related to levi's jeans,Dynamic,,Excitement,,
301,1819,,,,,i dig em ,1,POSITIVE,related to levi's jeans,Dynamic,,Passion,,
302,1821,,,,,that is why you do not put your belts on super tight just enough to hug your hips fortunately i have got very manly child bearing hips ,10,POSITIVE,related to levi's jeans,Aggressive,,Courage,,
304,1839,,,,,done bud how about this sunday ,5,POSITIVE,related to levi's jeans,Friendly,,Excitement,,
305,1848,,,,,i always got 2 sizes to big then washed them always fit right ,3,POSITIVE,related to levi's jeans,Stable,,Balance,,
306,1853,,,,,bingo how fun ,128,POSITIVE,related to levi's jeans,Friendly,,Fun,,
307,1858,,,,, not to sound like an ass on reddit but no dude welcome it is what we do ,219,POSITIVE,related to levi's jeans,Friendly,,Anger,,
308,1862,,,,,very cool i think i read it in a comment section somewhere on here i am definitely no expert thanks for the info and a better understanding,13,POSITIVE,related to levi's jeans,Modern,,Balance,,
309,1888,,,,,also dearborn denim made in chicago ,2,POSITIVE,related to levi's jeans,Modern,,Style,,
310,1889,,,,,so weird i just saw ib yesterday such a great movie ,16,POSITIVE,related to levi's jeans,Dynamic,,Excitement,,
311,1898,,,,,call me old school but i prefer legro,85,POSITIVE,related to levi's jeans,Elegant,,Balance,,
312,1914,,,,,i watched ib with my wife last night it was her first time ever seeing it and i thought i knew the woman ,2,POSITIVE,related to levi's jeans,Dynamic,,Family,,
313,1915,,,,,my favorite qt movie i just saw once upon a time in hollywood and it was terrific ,2,POSITIVE,related to levi's jeans,Dynamic,,Excitement,,
314,1919,,,,,i welcome it with a single raised finger ,28,POSITIVE,related to levi's jeans,Friendly,,Excitement,,
315,1923,,,,,on this blessed day,2,POSITIVE,related to levi's jeans,Friendly,,Happiness,,
316,1925,,,,,ve hav vays of makink you cum ,14,POSITIVE,related to levi's jeans,Aggressive,,Anger,,
317,1929,,,,,bravo ,1,POSITIVE,related to levi's jeans,Aggressive,,Courage,,
320,1940,,,,,pinky is up ,13,POSITIVE,related to levi's jeans,Elegant,,Femininity,,
321,1948,,,,,1940s motorcycle culture was heavily influenced by the war as most members were veterans so this tracks ,7,POSITIVE,related to levi's jeans,Aggressive,,Courage,,
322,1951,,,,,i like brave stars they are around the dollar90 price point and come in a nice range of weights and fits,1,POSITIVE,related to levi's jeans,Sporty,,Courage,,
323,1970,,,,,celeste is what bianchi bikes calls their blue ,1,POSITIVE,related to levi's jeans,Elegant,,Balance,,
325,1980,,,,,yep known ang levi is as the 1st jean maker you normally see sa thrift stores yung levi is jeans i suggest that you get the 100percent denim para long lasting i own almost 30 pairs but mix ng non denim and denim btw i work for levi is and i really love the brand ask away if you want to ,10,POSITIVE,related to levi's jeans,Stable,,Style,,
327,1986,,,,,yes my dad is still using his 501s from 2003 2004 ,5,POSITIVE,related to levi's jeans,Stable,,Modesty,,
328,1987,,,,,i have invested in two levis the 501 is and 724 flare jeans it is cheap if you get it in the us especially in the outlet stores i got mine for dollar80 ea it is very comfortable and the quality is very good i am overall happy with my purchase ,6,POSITIVE,related to levi's jeans,Friendly,,Happiness,,
329,1988,,,,,yes they are worth it the cuts are classic and they really last if you know how to take care of them ,5,POSITIVE,related to levi's jeans,Stable,,Reliable,,
330,1990,,,,,yes the older ones though my mom has tons of levi is giordano that is still mint condition very intact and thick strong jean cloth the new ones i purchased one only is thinner quality ,5,POSITIVE,related to levi's jeans,Stable,,Strength,,
331,1992,,,,,levis are good for the long haul they simply refuse to wear out ,4,POSITIVE,related to levi's jeans,Stable,,Reliable,,
332,1995,,,,,100percent yes i have levi is from my mom in the 90s that are still super good ,4,POSITIVE,related to levi's jeans,Elegant,,Family,,
333,1999,,,,,yes for me all of my jean clothes are from them and superb talaga material basta you know how take good care of them ,3,POSITIVE,related to levi's jeans,Elegant,,Style,,
335,2003,,,,,for me you are with that price range i will go with american eagle yung flex line kung mahilig ka sa stretchy na jeans ang comfy and solid ung kapal ,3,POSITIVE,related to levi's jeans,Sporty,,Excitement,,
336,2006,,,,,i remember my dad buying one in the 09s era now is at peace with papa god pero iyong jeans nagagamit pa ng older brother ko dinadala lang namin sa store for alterations and minor repairs when necessary ps jeans is about 19 years old to date ,3,POSITIVE,related to levi's jeans,Stable,,Family,,
337,2007,,,,,got my levi is sa sm for 2k lang meron din outlets mas mura kapag broken sizes i love my levi is ganda ng fit ,3,POSITIVE,related to levi's jeans,Stable,,Style,,
338,2008,,,,,jeans are durable enough to became a farmer is and carpenter is working clothes and students love a nice pair of jeans for its durability and comfort and levi is is a good pair of jeans ,3,POSITIVE,related to levi's jeans,Stable,,Strength,,
339,2009,,,,,totally had a pair of levi is jeans for 9 almost 10 years and it remained intact,3,POSITIVE,related to levi's jeans,Stable,,Reliable,,
340,2010,,,,,yes this guess and american eagle basta denim tumatagal talaga worth it,3,POSITIVE,related to levi's jeans,Sporty,,Style,,
342,2014,,,,,as an american i find it hilarious sometimes what nonamericans think of certain brands levis were one step above wranglers they are like what your mom would buy bc let is face it moms are cheap want good middle line jeans buy diesel lucky or ariat ,3,POSITIVE,related to levi's jeans,Elegant,,Style,,
344,2018,,,,,yes they are meant to last a lifetime and mas maganda pag paulit ulit na suot hehe pwede na now unlike before when covid was still rampant need labhan lagi ,2,POSITIVE,related to levi's jeans,Stable,,Trust,,
345,2020,,,,,yes super worth it i had my levi is jeans in size 24 2011 good as new until now and pandemic period tumaba ako nagkapuson and i have to let it go pero ang hirap ending i gave it to my niece pero parang alangan pa sa kanya pero magagamit pa niya yun for 10 15yrs ,2,POSITIVE,related to levi's jeans,Stable,,Modesty,,
346,2022,,,,,i would recommend levi is but vintage can not say anything about the new lines but if you can get your hands on a true vintage pair it should last you a lifetime mine is true to size and no flaws pa rin parang the more i wear it the more gorgeous it looks on me haha,2,POSITIVE,related to levi's jeans,Elegant,,Style,,
347,2026,,,,,idk how frequent ito mangyari sa jeans industry pero nakakatatlong levi is na ako na palipit buti di gaano halata kaya nasusuot ko pa nayayamot lang ako pag nakikita ko na nasa harapan na yung tahi na dapat nasangilid the 501s are good though ,2,POSITIVE,related to levi's jeans,Stable,,Modesty,,
348,2029,,,,,hell yes soft yung denim and hindi siya makati very durable construction ,2,POSITIVE,related to levi's jeans,Stable,,Strength,,
349,2033,,,,,yes na yes habang naluluma mas nagiging fashionable,2,POSITIVE,related to levi's jeans,Modern,,Flamboyance,,
350,2036,,,,,absolutely their made and crafted made in japan line is the best in terms of quality it is truly unparalleled and great value for money i have a lot of their other series particularly the ones from their boyfriend jeans 711 skinny and 311 shaping skinny jeans lineup the materials used for the boyfriend 711 and 311 jeans vary and incorporate diff technologies like their cool and stretch tech but their durability is still very much proven and tested the denim brands i use are levi is bobson momotaro jeans japan blue jeans hudson true religion citizens of humanity 7 for all mankind and emporio armani jeans but my favorite among all those brands is still levi is ,2,POSITIVE,related to levi's jeans,Modern,,Style,,
351,2038,,,,,yes yes yes 100percent my dad passed down his high waisted levi is jeans to me that he used to wear when him and my mom were still dating pa to give u an estimate it is probably older than my sister pa and she just turned 27 this november lol and now i use it with cropped tees and my sambas  bottomline the only jeans he wear are levi is lang talaga that is how he trusts the brand and it is an investment na rin cus it will last u a lifetime if taken care of,2,POSITIVE,related to levi's jeans,Stable,,Trust,,
352,2040,,,,,yes levis is the real jean just make sure na kunin mo 100percent cotton and not yung may halong stretch,2,POSITIVE,related to levi's jeans,Stable,,Reliable,,
353,2041,,,,,yung levis ng mom ko from the 90s nagagamit ko pa hanggang ngayon fav jeans ko sya like bagay sa lahat ng klase ng tops around 1k daw nya nabili yun nung time nya and super worth it daw 33,2,POSITIVE,related to levi's jeans,Elegant,,Style,,
354,2044,,,,,yes super worth it namana pa namin yung 5 levi is pants ni tita noong dalaga pa siya hehe parang brand new pa rin cs of its quality ,2,POSITIVE,related to levi's jeans,Elegant,,Family,,
355,2046,,,,,yes  wala akong masyadong jeans kasi most of them are levi is super worth it though pricey kasi pangmatagalan wide variety sa style but not so much sa color also good fitting too ,2,POSITIVE,related to levi's jeans,Modern,,Style,,
357,2049,,,,, you might want to consider evisu or one of our locals leon denim,2,POSITIVE,related to levi's jeans,Modern,,Style,,
362,2072,,,,,yesss one of the worth it investments yan i just recently bought levi is 501 ibang iba yung quality compared to the usual fashion brands go for it isang beses kalang bibili nan and it would last you so many years you can peek my profile and my recent posting for a sample of levi is 501 ,1,POSITIVE,related to levi's jeans,Modern,,Style,,
363,2074,,,,,levis yan ehhh in terms of quality pa lang lamang na kesa ibang brand,1,POSITIVE,related to levi's jeans,Stable,,Reliable,,
364,2075,,,,,i had my first levi is when i was in hs and until now it is still good almost 2 decades na pero mukha pa ring bago i wanna hand me down it to my niece soon ,1,POSITIVE,related to levi's jeans,Stable,,Family,,
365,2085,,,,,i have 311 and 312 super worth it ,1,POSITIVE,related to levi's jeans,Powerful,,Success,,
366,2086,,,,,very worth it my pairs are almost 3 yrs old and still good after daily wear just avoid washing it frequently as it might fade the color ,1,POSITIVE,related to levi's jeans,Stable,,Reliable,,
369,2093,,,,,basically it will last a lifetime worth it,1,POSITIVE,related to levi's jeans,Stable,,Success,,
370,2096,,,,,yes worth the price i have mine since 2019 and di pa siya kupas and wala pa rin punit or what ,1,POSITIVE,related to levi's jeans,Stable,,Reliable,,
371,2099,,,,,that would depend on where you put your worth coins my dad got me into levis since i was a kid he taught that yes they are expensive but they are an investment i am in my late 20 is and he still has many of the levis pants he bought before i was born marami na syang binigay sa ibang mga pinsan ko since dad is a big guy and i am a hobbit take care of the jeans and they will last you a long time ,1,POSITIVE,related to levi's jeans,Stable,,Reliable,,
373,2103,,,,,yes one of the jeans na kahit super daming laba di nagfefade,1,POSITIVE,related to levi's jeans,Stable,,Balance,,
374,2105,,,,,i wore mine for 7 years i would say they are comfortable than most jeans and very durable ,1,POSITIVE,related to levi's jeans,Stable,,Reliable,,
375,2107,,,,,price is definitely worth it i had one of my fave pair of jeans around junior high school and now i am currently working and ayan they are still durable and nice pa din suotin ,1,POSITIVE,related to levi's jeans,Stable,,Loyalty,,
378,2120,,,,,i guess you could say yes years ago pero ngayon talaga wala na yung quality they are known for ,2,POSITIVE,related to levi's jeans,Modern,,Decadence,,
379,2124,,,,,as a filipino i find it hilarious when non filipino is speak about what they think is cheap when they do not earn and spend in peso op is asking about the quality being worth the price that should tell you a lot ,4,POSITIVE,related to levi's jeans,Friendly,,Respect,,
380,2130,,,,,mas mahal pa sa levi is ,2,POSITIVE,related to levi's jeans,Elegant,,Family,,
381,2132,,,,,rarely washing jeans good for the jeans not for your hygiene yuck but levis jeans are awesome op totally worth it ,6,POSITIVE,related to levi's jeans,Modern,,Modesty,,
382,2136,,,,,hi how much is the 501 usually aiming to buy one this christmas ,1,POSITIVE,related to levi's jeans,Friendly,,Fortune,,
383,2144,,,,,i beg to differ they feel the same to me my new ones quality is faaaar better than zara mango and uniqlo ,1,POSITIVE,related to levi's jeans,Modern,,Luxury,,
384,2162,,,,,idk man my jeans are all good,2,POSITIVE,related to levi's jeans,Sporty,,Balance,,
385,2168,,,,,online starts at 8k a piece the best,1,POSITIVE,related to levi's jeans,Modern,,Success,,
386,2170,,,,,nagkakaron po ba sila ng huge sales ,1,POSITIVE,related to levi's jeans,Powerful,,Fortune,,
387,2179,,,,,super worth the price yung ribcage bell na flare pants i just got mine too and naisuot ko na makapal yung tela pera comfy pa rin isuot ,1,POSITIVE,related to levi's jeans,Elegant,,Happiness,,
390,2193,,,,,level up to cargo pants you will not regret it,47,POSITIVE,related to levi's jeans,Sporty,,Style,,
391,2195,,,,,i would always buy men skinny jeans because it fits me and cuz of the big pockets,9,POSITIVE,related to levi's jeans,Sporty,,Style,,
392,2202,,,,,i remember last year when we had a no backpack day at school and i decided to only bring my ipad to take notes and stuff i managed to fit it inside my jean is pocket a full ipad inside my jean is pocket you can fit so much inside them it is incredible ,17,POSITIVE,related to levi's jeans,Modern,,Freedom,,
393,2203,,,,,is this why mom jeans have become so popular ,25,POSITIVE,related to levi's jeans,Modern,,Style,,
395,2222,,,,,clearly big pant is in kahoots with big purse to sell more handbags ,3,POSITIVE,related to levi's jeans,Modern,,Mystery,,
396,2224,,,,,so all i have to do is make a clothing company that puts big pockets on female pants and i will be rich right ,3,POSITIVE,related to levi's jeans,Modern,,Femininity,,
397,2234,,,,,you are allowed to wear either pair ,4,POSITIVE,related to levi's jeans,Sporty,,Balance,,
400,2293,,,,,because female jeans hug the body and large items in large pockets spoil the profile anyway you are large enough to fit into men is jeans so no issues there,2,POSITIVE,related to levi's jeans,Sporty,,Femininity,,
402,2299,,,,,and this is why i like to wear male jeans more then any other plus for me i like the baggy ones cuz they fit my style lol,2,POSITIVE,related to levi's jeans,Sporty,,Style,,
403,2319,,,,,i have this really really good idea for everyone complaining about this you band together and make a fashion women is jeans manufacturing company and make it have bigger pockets it is genius cuz not only will y all be pioneers but then the competing companies will be forced to make women is jeans with larger pockets to compete ,2,POSITIVE,related to levi's jeans,Modern,,Freedom,,
404,2323,,,,,buy men is make them make the changes i honestly carried big rocks in my men is pants when doing ym garden ,2,POSITIVE,related to levi's jeans,Aggressive,,Anger,,
405,2326,,,,,yeah but how tight are those women is jeans intended to fit it makes sense to me for tight jeans to have smaller pockets cause most people would not carry bulky items in the pockets if the items are just gonna look like they are vaccuum sealed to their leg in tight jeans plus at least in america every woman i know carries a bag of some kind so a lot of women are not relying on pants pockets to store keys wallets etc small pockets on women is jeans makes sense to me in several situations ,2,POSITIVE,related to levi's jeans,Modern,,Femininity,,
407,2369,,,,,a purse only you can change this with your buying habits  but we all know many women like how they look in jeans with little to no pockets shows off the curves better ,2,POSITIVE,related to levi's jeans,Elegant,,Femininity,,
408,2377,,,,,as a man i can confirm this ,267,POSITIVE,related to levi's jeans,Aggressive,,Femininity,,
409,2380,,,,,do not forget to include the saej1995 74 3 hp with 35percent rated operating capacity compact track loader,82,POSITIVE,related to levi's jeans,Powerful,,Power,,
410,2381,,,,,it is where we keep the audacity,37,POSITIVE,related to levi's jeans,Aggressive,,Courage,,
411,2389,,,,,do not forget the hammer do not leave home without one ,2,POSITIVE,related to levi's jeans,Aggressive,,Danger,,
412,2397,,,,,shrinkflation hits every industry you can still get nice thick denim but most companies are just chasing that sweet sweet profit ,15,POSITIVE,related to levi's jeans,Modern,,Decadence,,
414,2414,,,,,i got this done and it is wonderful i have large pockets now and do not need to carry a bag around all the time ,3,POSITIVE,related to levi's jeans,Stable,,Balance,,
415,2420,,,,,i have tried on male jeans and none of them fit comfortably with my body size my grandfather is the same height as i am 5 3 and we are different sizes in some respects he is about 120lbs and i am 105lbs and i have a slightly bigger shoe size but even he has to buy women is clothes sometimes because he will have difficulty finding men is clothes in his size i have bought clothes for him and because i have taller hips than him the tops will be too long on me but fit him perfectly ,12,POSITIVE,related to levi's jeans,Stable,,Modesty,,
416,2421,,,,,but i want to wear skin tight stretch jeans i just also want them to fit my phone,7,POSITIVE,related to levi's jeans,Sporty,,Style,,
417,2430,,,,,yup it really is just this simple economics customer is always right and the customer has spoken and voted loudly as to what they wanted and they want a specific fit and specific look over practical use so this is the product you get vote with your wallet if you want it to change if it does not change much then you know how the rest of women are also voting pretty simple ,2,POSITIVE,related to levi's jeans,Elegant,,Flamboyance,,
