,Unnamed: 0,subreddit,title,selftext,ups,overall_text,comment ups,sentiment,relevance,emotion,score,emotional_color,emotional color score,color
418,2434,,,,,yes you are precisely right women want pants with pockets as long as those pants are still tight and the pockets do not mess with the outline of those pants which can not exist and the majority of women have shown what side of the compromise they wish to lean towards although it does suck for women that are willing to make the tradeoff because they are a much smaller market so even if they are willing to have worse looking pants they still get worse choices for those pants,18,POSITIVE,related to levi's jeans,Modern,,Femininity,,
420,2461,,,,,this is it tho women is form fit men is waist fit ,11,POSITIVE,related to levi's jeans,Sporty,,Femininity,,
421,2464,,,,,they do everyone complaining about jeans with tiny pockets needs to realize that they chose those ones and their choices are what is driving the market ,6,POSITIVE,related to levi's jeans,Modern,,Freedom,,
423,2471,,,,,and the cool stick we find in forest,34,POSITIVE,related to levi's jeans,Stable,,Nature,,
424,2472,,,,,as another man i can also confirm this ,67,POSITIVE,related to levi's jeans,Powerful,,Loyalty,,
425,2482,,,,,it is the most important ,5,POSITIVE,related to levi's jeans,Powerful,,Success,,
426,2490,,,,,but only on thursdays do not want to get fat ,16,POSITIVE,related to levi's jeans,Friendly,,Balance,,
427,2493,,,,,or just look at the weight of the denim before you buy it if you go get a pair of jeans with a 15 oz fabric weight they are not going to be thin regardless ,127,POSITIVE,related to levi's jeans,Stable,,Balance,,
428,2494,,,,,also wranglers still makes some women is jeans that are 100percent cotton i am a huge fan ,4,POSITIVE,related to levi's jeans,Stable,,Femininity,,
431,2502,,,,,pocket thieves love it,127,POSITIVE,related to levi's jeans,Sporty,,Money,,
433,2504,,,,,google women is jeans with pockets notice the hundreds of sites that will happily sell you them ,7,POSITIVE,related to levi's jeans,Modern,,Femininity,,
434,2512,,,,,in a better world definitely  was a nice read on the topic of women is pockets seems like the started out large and became smaller to conform to more form fitting fashion ,3,POSITIVE,related to levi's jeans,Elegant,,Femininity,,
436,2521,,,,,betabrand yoga denim they have skinnies and the pockets fit my pixel 6 no problem,5,POSITIVE,related to levi's jeans,Modern,,Style,,
437,2534,,,,,dude just buy jeans you like and that fit independent of being on one side of the store or the other if you buy shit you do not like the retailer thinks it is what you want simple yeh ,30,POSITIVE,related to levi's jeans,Modern,,Freedom,,
439,2569,,,,,thoroughly enjoyed that,6,POSITIVE,related to levi's jeans,Friendly,,Joy,,
441,2572,,,,,as someone identifying as a man i can also confirm this ,30,POSITIVE,related to levi's jeans,Aggressive,,Courage,,
442,2579,,,,,it is in our very jeans ,2,POSITIVE,related to levi's jeans,Sporty,,Family,,
443,2580,,,,,i can not comment on the brand you wear but mine are boss and they feel high quality and no less durable than my older jeans i actually fell over on pavement yesterday and normally i would expect a graze or hole in my jeans from the pavement but did not have any ,2,POSITIVE,related to levi's jeans,Stable,,Reliable,,
444,2583,,,,,i made it pretty clear what i was talking about the jeans levis makes and sells directly online and at higher end stores is different than the ones at the outlet store congratulations you got lucky on the first pair levis vs levis premium vs levis strauss ,7,POSITIVE,related to levi's jeans,Modern,,Style,,
446,2621,,,,,well played ,16,POSITIVE,related to levi's jeans,Dynamic,,Success,,
448,2632,,,,,a lot of pedaling lotta booty muscle ,18,POSITIVE,related to levi's jeans,Sporty,,Energy,,
449,2641,,,,,nice ,4,POSITIVE,related to levi's jeans,Friendly,,Friendly,,
452,2652,,,,,good point ,13,POSITIVE,related to levi's jeans,Friendly,,Respect,,
453,2654,,,,,as a well played man i too can confirm this ,15,POSITIVE,related to levi's jeans,Powerful,,Courage,,