,Unnamed: 0.1,Unnamed: 0,subreddit,title,selftext,ups,overall_text,comment ups,sentiment,relevance,emotion,score,emotional_color,emotional color score,color
164,187,787,,,,, brief description conclusion three in a shoot again if you want surprise yourself or your kids for upcoming holidays there you go nike sb continues its collaborative dominance with the upcoming the powerpuff girls x nike sb dunk low collection inspired by the trio of superheroes made of sugar spice and everything nice each colorway of the pack draws from the show is characters featuring blue pink and green versions of the sb dunks the characters hair colors land on the shoe is swoosh and laces while a black midsole accompanies each pair additionally the character is signature eyes adorn the shoe is heel tab the powerpuff girls x nike sb dunk low will release on december 14 this year  review  overall dunk shape looks good accurate toebox looks good and has a nice classic dunk shape not too thick all colors and details looks accurate all around the shoe materials looks and feels premium swooshes are even not too low and they have a good shape laces with heart on the shoes looks exactly as it should perforation hole looks good and not too thick midsole looks good and it had accurate colors and lines eyes on the heels and embroidery looks amazing tongue tags looks good insoles looks good and has a nice details sole is firm and steady as retails all in all textures looks great customer service was top notch the whole conversation was smooth and every question i asked met my needs they use high quality and most reliable shipping services like fedex dhl aramex royal mail etc and after your package is shipped they will give you a tracking code where you can track your package anytime qc photos are of high quality with a professional camera taken from all possible angles 360 degress where you can clearly see the condition from every angle and quickly decide whether it is gl or rl they have no problem listening to advice or even if you rl a pair they will always without any hesitation change to a new pair until they finally reach your satisfaction a great quality that i really appreciate is that og has pre exchanged a pair if it sees any flaws could not recommend more and you will be satisfied as i am every time good luck  timelines  10 10 2023 ordered paid 13 10 2023 qc received  16 10 2023 received tracking 24 10 2023 received package  w2c price  whatsapp 86 189 2422 2160 price each pair is 145dollar discounted with repdad code is 135dollar shipped you will got amazing vip treatment super fast shipping insured and secured with aramex dhl fedex usps,1,POSITIVE,related to nike reviews,Dynamic,,Excitement,,
165,189,789,,,,,instant cop ,2,POSITIVE,related to nike reviews,Sporty,,Danger,,
166,190,798,,,,,my favorite dunks together with lobsters definitely nice to have it in collection,2,POSITIVE,related to nike reviews,Sporty,,Excitement,,
167,191,799,,,,,i need those sbs in my life,2,POSITIVE,related to nike reviews,Dynamic,,Excitement,,
168,193,801,,,,,these are filthy good ,2,POSITIVE,related to nike reviews,Dynamic,,Decadence,,
169,194,802,,,,,solid review mate on my wish list for sure,2,POSITIVE,related to nike reviews,Stable,,Success,,
170,195,808,,,,,blue is my favorite blossom also not bad ,2,POSITIVE,related to nike reviews,Elegant,,Joy,,
171,196,809,,,,,awesome review and sneakers ,2,POSITIVE,related to nike reviews,Sporty,,Excitement,,
172,197,814,,,,,stunning ,2,POSITIVE,related to nike reviews,Elegant,,Flamboyance,,
173,198,816,,,,,ah powerpuffs beautiful memories d,2,POSITIVE,related to nike reviews,Powerful,,Joy,,
174,199,818,,,,,easy favorite dunks recently,2,POSITIVE,related to nike reviews,Dynamic,,Excitement,,
175,200,819,,,,,nice review and photos ,2,POSITIVE,related to nike reviews,Friendly,,Friendly,,
176,201,821,,,,,who knew the power of cartoons would collide with the world of sneakers nike really knows how to keep us on our toes with these powerpuff girls themed sb dunks rocking nostalgia and style all in one ,2,POSITIVE,related to nike reviews,Powerful,,Excitement,,
177,202,824,,,,,dooooope ,2,POSITIVE,related to nike reviews,Dynamic,,Excitement,,
178,203,825,,,,,solid,2,POSITIVE,related to nike reviews,Stable,,Strength,,
179,204,826,,,,,straight fire ,2,POSITIVE,related to nike reviews,Aggressive,,Excitement,,
180,206,831,,,,,love them noicee ,2,POSITIVE,related to nike reviews,Friendly,,Passion,,
181,207,832,,,,,fire pairs ,2,POSITIVE,related to nike reviews,Aggressive,,Passion,,
182,208,835,,,,,how do the eye balls on the back look ,2,POSITIVE,related to nike reviews,Aggressive,,Mystery,,
183,209,836,,,,,damn solid by daughter would love these trio ,2,POSITIVE,related to nike reviews,Elegant,,Joy,,
184,210,838,,,,,wow,2,POSITIVE,related to nike reviews,Dynamic,,Excitement,,
185,211,839,,,,,first time buyer how to place an order ,2,POSITIVE,related to nike reviews,Friendly,,Friendly,,
186,212,840,,,,,great pair of dunks,2,POSITIVE,related to nike reviews,Sporty,,Excitement,,
187,213,841,,,,,amazing looks ,2,POSITIVE,related to nike reviews,Elegant,,Excitement,,
188,214,844,,,,,these are so fire,2,POSITIVE,related to nike reviews,Dynamic,,Excitement,,
189,215,846,,,,,really good,0,POSITIVE,related to nike reviews,Powerful,,Success,,
190,216,847,,,,, please read the rules important guidelines your cooperation is appreciated all quality control qc requests are required to adhere to a specific format to ensure clarity and consistency within our community to request a qc please include the following criteria 1 full shoe name clearly mention the complete name of the sneaker model you are requesting a qc for this helps others understand which product you are evaluating 2 price in yuan  provide the price of the sneaker in chinese yuan this is crucial information for other members who may be interested in purchasing the same item 3 seller specify the name of the seller from whom you are purchasing or considering purchasing the sneakers this assists in evaluating the source and reputation of the seller 4 agent mention the name of the agent you are using for this transaction this adds transparency and allows others to assess the reliability of the agent 5 include the link include a link to the product page or listing for the sneakers this enables others to view the item themselves and offer more accurate feedback 6 use the appropriate qc flair ensure that your qc post is correctly categorized by using the appropriate qc flair this helps organize and filter posts within the community please note that any qc requests that do not follow this specified format may be removed without prior warning this ensures that all qc requests provide essential information making it easier for our community members to provide valuable feedback and assistance we appreciate your cooperation in maintaining the quality of our community requests not following this format will be removed i am a bot and this action was performed automatically please message compose to r repsneakersdogs if you have any questions or concerns ,1,POSITIVE,related to nike reviews,Dynamic,,Respect,,
191,217,848,,,,, welcome to r repsneakersdogs a community for replica sneaker enthusiasts  check out these useful r repsneakersdogs resources enter this weeks giveaway from kameymall agent client  established seller list esl trusted seller list  use code repsneakersdogs to get 5percent off on shipping unlimited  no threshold uses sign up on panda buy panda buy agent  sign up here for dollar92 off your total kameymall agent  here is a quick and easy step by step guide on how to order from an agent  here is a quick and easy step by step guide on how to order from a middleman  i am a bot and this action was performed automatically please message compose to r repsneakersdogs if you have any questions or concerns ,1,POSITIVE,related to nike reviews,Modern,,Trust,,
193,219,856,,,,,easy,1,POSITIVE,related to nike reviews,Friendly,,Fun,,
194,220,857,,,,,do not wait too long ,1,POSITIVE,related to nike reviews,Aggressive,,Danger,,
195,221,864,,,,,oh yeah that is a facts ,1,POSITIVE,related to nike reviews,Powerful,,Wisdom,,
196,222,865,,,,,go for it ,1,POSITIVE,related to nike reviews,Dynamic,,Passion,,
197,223,871,,,,,100percent,1,POSITIVE,related to nike reviews,Modern,,Success,,
198,225,884,,,,,100percent,1,POSITIVE,related to nike reviews,Modern,,Success,,
199,226,916,,,,,welcome to  check out the links below      i am a bot and this action was performed automatically please message compose to r sneakerreps if you have any questions or concerns ,1,POSITIVE,related to nike reviews,Dynamic,,Excitement,,
200,227,918,,,,,dang looks clean,3,POSITIVE,related to nike reviews,Elegant,,Style,,
201,228,919,,,,,great looking pair  ,2,POSITIVE,related to nike reviews,Elegant,,Style,,
202,229,921,,,,,looks dope bro amazing review as always,2,POSITIVE,related to nike reviews,Dynamic,,Excitement,,
203,230,922,,,,,l fam here joined the club ,2,POSITIVE,related to nike reviews,Friendly,,Family,,
204,231,924,,,,,nice review bro these are dope ,2,POSITIVE,related to nike reviews,Dynamic,,Excitement,,
205,232,925,,,,,looks clean,2,POSITIVE,related to nike reviews,Elegant,,Peace,,
206,234,929,,,,,nice pairs bro ,2,POSITIVE,related to nike reviews,Elegant,,Happiness,,
207,235,934,,,,,great review and photos as always ,2,POSITIVE,related to nike reviews,Friendly,,Friendly,,
208,236,942,,,,,nice plate ,2,POSITIVE,related to nike reviews,Elegant,,Friendly,,
209,237,945,,,,,looks clean,2,POSITIVE,related to nike reviews,Elegant,,Peace,,
210,238,947,,,,,fire pair ,2,POSITIVE,related to nike reviews,Aggressive,,Passion,,
211,239,954,,,,, brief description happy release day to one of absolutely stunning pairs and one of my favorite sb is in 2023 by far  born out of necessity the nike sb x tightbooth dunk low pro draws from the freedom of nighttime in the streets textural overlays emulate the metal grates encountered and employed during after dark sessions reflective design swoosh panels a co branded tongue and subtle hits of safety orange bring the spirit and synergy of tightbooth is visual identity to the iconic dunk review  overall shape looks great accurate toebox has a beautiful shape and it is not too thick toebox perforation holes looks amazing and they are not too thick black suede upper looks quality and leather on the swoosh looks great an orange tightbooth tag under the swoosh looks good as well tongue tags looks good inner tongue tags also the same swoosh looks great it is well placed and has a good shape color looks accurate there is nothing much to say heels embroidery is clean and looks good midsole color is good sole color is good as well squishiness is steady and strong as retails customer service was top notch the whole conversation was smooth and every question i asked met my needs they use high quality and most reliable shipping services like fedex dhl aramex royal mail etc and after delivery they will give you a tracking code where you can track your package anytime qc photos are of high quality with a professional camera taken from all possible angles where you can clearly see the condition of the shoe and quickly decide whether it is gl or rl they have no problem listening to advice or even if you rl a pair they will always without any hesitation change to a new pair until they finally reach your satisfaction a great quality that i really appreciate is that dw has pre exchanged a pair if it sees any flaws  timelines  25 08 2023 ordered paid 28 08 2023 qc received  30 08 2023 received tracking 03 09 2023 received package  w2c price  wap 86 157 5087 4699 web firstaj  com price normal price is 130dollar but using code repdad shipped price with aramex dhl fedex ups usps will be 125dollar,1,POSITIVE,related to nike reviews,Sporty,,Excitement,,
212,240,959,,,,,pretty much ,1,POSITIVE,related to nike reviews,Elegant,,Happiness,,
213,241,961,,,,,welcome bro,1,POSITIVE,related to nike reviews,Friendly,,Excitement,,
214,242,985,,,,,retail is sold out price is 200dollar and it will go up,0,POSITIVE,related to nike reviews,Aggressive,,Growth,,
215,243,990,,,,,would be dope yes,2,POSITIVE,related to nike reviews,Dynamic,,Excitement,,
216,244,993,,,,,retail is dollar135,4,POSITIVE,related to nike reviews,Friendly,,Money,,
217,245,994,,,,,sold out,0,POSITIVE,related to nike reviews,Modern,,Success,,
218,247,1000,,,,,nice bro great review ,2,POSITIVE,related to nike reviews,Friendly,,Friendly,,
219,248,1003,,,,,wow these are fire ,2,POSITIVE,related to nike reviews,Aggressive,,Passion,,
220,249,1012,,,,,time to double up on these,2,POSITIVE,related to nike reviews,Dynamic,,Excitement,,
221,250,1016,,,,,nice pair ,2,POSITIVE,related to nike reviews,Elegant,,Friendly,,
222,251,1017,,,,,looks slick bro amazing review as always,2,POSITIVE,related to nike reviews,Modern,,Flamboyance,,
223,252,1020,,,,,one of my favorite dunks so far ,2,POSITIVE,related to nike reviews,Dynamic,,Excitement,,
224,253,1021,,,,,dope photos bro and nice review ,2,POSITIVE,related to nike reviews,Modern,,Excitement,,
225,254,1022,,,,,nice review bro these are dope ,2,POSITIVE,related to nike reviews,Dynamic,,Excitement,,
226,255,1023,,,,,very nice ,2,POSITIVE,related to nike reviews,Elegant,,Happiness,,
227,256,1028,,,,,great looking pair ,2,POSITIVE,related to nike reviews,Elegant,,Style,,
228,257,1030,,,,,looking great ,2,POSITIVE,related to nike reviews,Elegant,,Happiness,,
229,258,1033,,,,,clean pair ,2,POSITIVE,related to nike reviews,Elegant,,Modesty,,
230,259,1035,,,,,man these are beautiful ,2,POSITIVE,related to nike reviews,Elegant,,Nature,,
231,260,1036,,,,,cleanest dunks i have seen today ,2,POSITIVE,related to nike reviews,Dynamic,,Excitement,,
233,262,1039,,,,, welcome to r repsneakersdogs a community for replica sneaker enthusiasts  check out these useful r repsneakersdogs resources  established seller list esl trusted seller list  use code repsneakersdogs to get 5percent off on shipping unlimited  no threshold uses sign up on panda buy panda buy agent  sign up here for dollar92 off your total kameymall agent  here is a quick and easy step by step guide on how to order from an agent  here is a quick and easy step by step guide on how to order from a middleman  i am a bot and this action was performed automatically please message compose to r repsneakersdogs if you have any questions or concerns ,1,POSITIVE,related to nike reviews,Modern,,Trust,,
234,263,1042,,,,,so dope right,1,POSITIVE,related to nike reviews,Dynamic,,Excitement,,
235,264,1051,,,,,100percent,1,POSITIVE,related to nike reviews,Modern,,Success,,
236,265,1056,,,,,now is the right time indeed ,1,POSITIVE,related to nike reviews,Dynamic,,Success,,
237,266,1063,,,,,100percent,1,POSITIVE,related to nike reviews,Modern,,Success,,
238,267,1081,,,,,stunning ,1,POSITIVE,related to nike reviews,Elegant,,Flamboyance,,
239,268,1084,,,,, thanks you are welcome ,1,POSITIVE,related to nike reviews,Friendly,,Friendly,,
240,269,1090,,,,,i have the nike air zoom tempo nextpercent and i swear by them in otf similar shoes with the zoom cushing towards the top part of the foot that helps the impact when landing on the treadmill prior to these i ran in hoka bondi 6 is at otf these are more stylish and lighter than the bondi is the only con is they are slightly wide at that zoom bubble when you strap your feet in on the rower that is my otf review for the nike air zoom tempo nextpercent similar to the shoes you are considering i know people dislike nikes in otf but these are different plus after 2 3 weeks of getting dirty i throw them in a mesh drawstring bag and into the washer machine they come out new every wash ,1,POSITIVE,related to nike reviews,Sporty,,Style,,
241,270,1092,,,,,honestly the free motion by nike i have found to be really good depending on what you are looking for they are almost water shoe esq which i like because of the flexability but also great support on the arch and great grip ,1,POSITIVE,related to nike reviews,Sporty,,Balance,,
242,271,1097,,,,,actually i love them for rowing and they are fine on the floor unfortunately not very good for running they are a little bit stiff  i always get compliments on them,2,POSITIVE,related to nike reviews,Sporty,,Style,,
243,272,1105,,,,,  w haul,3,POSITIVE,related to nike reviews,Sporty,,Excitement,,
244,273,1106,,,,,hey fire hall  i was wondering is the balenciaga hoodie true to size,2,POSITIVE,related to nike reviews,Modern,,Style,,
245,274,1111,,,,,hey i was looking at the vintage nike crew neck and on panda buy it gave me a warning did it also give you a warning i am new to this ,0,POSITIVE,related to nike reviews,Sporty,,Balance,,
246,275,1114,,,,,amazing haul and nice slides show,1,POSITIVE,related to nike reviews,Elegant,,Excitement,,
247,276,1117,,,,,the only thing g i do not like is how it looks going around the mocha bro but i am starting to think that all of them like that because i have seen many mostly the cheaper 1 you know what i means but other than that man u goody but still walk slow no rush great haul no harm no foul ,1,POSITIVE,related to nike reviews,Sporty,,Anger,,
248,277,1118,,,,,really nice slide show you got here the best one so far i think,1,POSITIVE,related to nike reviews,Elegant,,Happiness,,
249,279,1124,,,,,how accurate is the stussy sweater when compared to retail ,1,POSITIVE,related to nike reviews,Modern,,Style,,
250,280,1148,,,,,came here from your recent haul just for the chrome heart pants,1,POSITIVE,related to nike reviews,Aggressive,,Style,,
252,282,1152,,,,,still a fire haul tho,6,POSITIVE,related to nike reviews,Aggressive,,Excitement,,
253,284,1165,,,,,they are 104cm in a small,1,POSITIVE,related to nike reviews,Sporty,,Balance,,
254,287,1176,,,,,glad you like it thank you for the compliment ,2,POSITIVE,related to nike reviews,Friendly,,Happiness,,
255,290,1185,,,,,yes it is pretty thick,1,POSITIVE,related to nike reviews,Powerful,,Anger,,
256,291,1186,,,,,i would go 1 size up,2,POSITIVE,related to nike reviews,Stable,,Balance,,
257,292,1188,,,,,it was a large for my cousin he is 5ft 9in and 180lbs,2,POSITIVE,related to nike reviews,Sporty,,Family,,
258,293,1203,,,,,it was for my cousin he is around 5 9 180lbs and he got a size large,1,POSITIVE,related to nike reviews,Sporty,,Courage,,
259,294,1207,,,,,still cheaper than resale tho so i think it is worth it,1,POSITIVE,related to nike reviews,Friendly,,Success,,
260,295,1211,,,,,seems like wow 10 lebron 20 and curry 9 are highest rated this year edit forgot about the luka1 looking at the a rating,19,POSITIVE,related to nike reviews,Dynamic,,Excitement,,
261,297,1221,,,,,i have the l20 and luka 1s and honestly prefer the lukas and their half the price ,10,POSITIVE,related to nike reviews,Sporty,,Money,,
262,298,1223,,,,,i just wore my pair for the first time tonight they definitely fit snug and the first two pickup games 12min my feet were cramping lol but around the third fourth game they finally broke in and they felt like a more cushioned kobe 6 protro love them can not wait to grab more colorways ,10,POSITIVE,related to nike reviews,Sporty,,Excitement,,
263,302,1240,,,,,are these good for flat feet ,2,POSITIVE,related to nike reviews,Stable,,Balance,,
264,303,1242,,,,,which attribute is the most important if i look for a shoe with good bounce ,2,POSITIVE,related to nike reviews,Dynamic,,Energy,,
265,304,1250,,,,,luka got 90 100,4,POSITIVE,related to nike reviews,Dynamic,,Success,,
266,305,1256,,,,,the kyries feel way more responsive in the forefoot i did not feel that springiness of the zoom in the brons as much unless i am putting a lot of force on them,3,POSITIVE,related to nike reviews,Dynamic,,Energy,,
267,306,1258,,,,,the kd14s feel bouncier but i think the lebrons might feel closer to them after some break in when the cushlon bottoms a bit as of right now the lebrons feel pretty plush but the cushioning is great,2,POSITIVE,related to nike reviews,Dynamic,,Excitement,,
268,307,1267,,,,,i have not used the brons but i have a pair of wade 10s and i love them i normally play in low tops but the wades are super light have great traction my only knock is the laces are hella long and hard to swap lol,6,POSITIVE,related to nike reviews,Sporty,,Excitement,,
269,308,1268,,,,,i have used both initially the lebron 20s feel better but after two weeks of wear of both the way of wade 10s feel better the wow10s get better every single wear while the lebron 20s are still good but not without flaw wow10s are lighter too,3,POSITIVE,related to nike reviews,Dynamic,,Excitement,,
270,309,1278,,,,,harden vol 7 is are a good option they have great courtfeel and elite traction,1,POSITIVE,related to nike reviews,Sporty,,Strength,,
271,311,1281,,,,,i had the same problem but only for my right shoe lol its such a tease cause the left one feels so good and locked down ,1,POSITIVE,related to nike reviews,Sporty,,Balance,,
272,312,1282,,,,,try double tying at the top,1,POSITIVE,related to nike reviews,Sporty,,Balance,,
273,313,1283,,,,,thanks for the honest review man i will keep looking for other shoes ,2,POSITIVE,related to nike reviews,Friendly,,Respect,,
274,314,1286,,,,,i got the ep version and i played around 7 times with it in both indoor and outdoor courts it is working great for me but i do advise staying away from dusty courts ,1,POSITIVE,related to nike reviews,Sporty,,Reliable,,