,Unnamed: 0.1,Unnamed: 0,subreddit,title,selftext,ups,overall_text,comment ups,sentiment,relevance,emotion,score,emotional_color,emotional color score,color
1,3,14,,,,,i definitely fw this no doubt looks really clean ,2,POSITIVE,related to nike reviews,Modern,"{'Sporty': 0.21561338289962825, 'Elegant': 0.1895910780669145, 'Dynamic': 0.1821561338289963, 'Friendly': 0.16356877323420074, 'Modern': 0.10408921933085502, 'Aggressive': 0.07434944237918216, 'Stable': 0.04460966542750929, 'Powerful': 0.026022304832713755}",Excitement,"{''Style': 0.15789473684210525, 'Success': 0.09022556390977443, 'Friendly': 0.09022556390977443, 'Balance': 0.06766917293233082, 'Flamboyance': 0.04887218045112782, 'Happiness': 0.045112781954887216, 'Respect': 0.03759398496240601, 'Passion': 0.03007518796992481, 'Anger': 0.02631578947368421, 'Fun': 0.018796992481203006, 'Joy': 0.015037593984962405, 'Money': 0.011278195488721804, 'Luxury': 0.011278195488721804, 'Loyalty': 0.011278195488721804, 'Strength': 0.011278195488721804, 'Trust': 0.011278195488721804, 'Family': 0.011278195488721804, 'Fortune': 0.007518796992481203, 'Peace': 0.007518796992481203, 'Danger': 0.007518796992481203, 'Modesty': 0.007518796992481203, 'Energy': 0.007518796992481203, 'Mystery': 0.007518796992481203, 'Reliable': 0.007518796992481203, 'Wisdom': 0.007518796992481203, 'Royalty': 0.0037593984962406013, 'Cold': 0.0037593984962406013, 'Decadence': 0.0037593984962406013, 'Warmth': 0.0037593984962406013, 'Growth': 0.0037593984962406013, 'Nature': 0.0037593984962406013, 'Courage': 0.0037593984962406013, 'Virtue': 0.0037593984962406013}",black
2,5,34,,,,,wht are ur specs looks great and good review bro,1,POSITIVE,related to nike reviews,Dynamic,,Friendly,,
3,6,39,,,,,what do you think is the best size for 165cm and 50 kg,1,POSITIVE,related to nike reviews,Stable,,Balance,,
4,7,43,,,,,i am 172cm 64kg should i go s or m i have been stressing the past couple hours just on the sizing for this some input would be appreciated thanks ,1,POSITIVE,related to nike reviews,Sporty,,Anger,,
5,10,50,,,,,that is not the coldest we had this week ,21,POSITIVE,related to nike reviews,Stable,,Cold,,
6,11,52,,,,,ive been looking into reps for this for a while and its a relief to see that they got the eyehole size down also really good review im pretty sold on this also what size did you get what shorts are you wearing in the imgur pics i like them ,16,POSITIVE,related to nike reviews,Sporty,,Excitement,,
7,12,53,,,,,a whole essay nice 9 10  giphy 3o7bty8hn1lxzjwvuq ,5,POSITIVE,related to nike reviews,Dynamic,,Happiness,,
8,13,61,,,,,i have ambitions first batch in black seems pretty identical but this one seems to have a better balaclava shape as in the balaclava hood is a little tighter to the head and the face hole on his is smaller ambitions size is still pretty good though it is just sometimes my nose pokes out but it is also really comfortable around my neck and not tight and i do not wear the balaclava part all the time the details and quality look similar though also i think ambition ended up fixing the face hole before it was a complete gamble if yours would be good or not ,2,POSITIVE,related to nike reviews,Modern,,Balance,,
9,14,67,,,,,yeah m gonna be good,2,POSITIVE,related to nike reviews,Friendly,,Happiness,,
10,15,68,,,,,true to size i am 183 cm 60 kg size m fits perfectly,1,POSITIVE,related to nike reviews,Sporty,,Balance,,
11,16,77,,,,,thank you bro really appreciate that ,1,POSITIVE,related to nike reviews,Friendly,,Respect,,
12,17,82,,,,,l for sure,1,POSITIVE,related to nike reviews,Dynamic,,Loyalty,,
13,19,113,,,,,yeah man yeah got it now honestly a little too big arms too long and length but i roll up the sleeves and the bottom which does not look bad either makes it have an oversized feel but if your similar to me size wise i would get a small,1,POSITIVE,related to nike reviews,Aggressive,,Balance,,
14,20,117,,,,,i had the black one for a year now currently in croatia and it is way too hot but i will use it during winter in sweden in a couple of months it is a great piece that got me into reps i got mine from dragon someting something store,1,POSITIVE,related to nike reviews,Modern,,Warmth,,
15,22,127,,,,,i think l will fit you like m fitted me,1,POSITIVE,related to nike reviews,Dynamic,,Friendly,,
16,23,128,,,,,size m bro,1,POSITIVE,related to nike reviews,Sporty,,Anger,,
17,24,140,,,,,thank u bro appreciated as always,2,POSITIVE,related to nike reviews,Friendly,,Respect,,
18,25,143,,,,,no problem bro ,1,POSITIVE,related to nike reviews,Dynamic,,Happiness,,
19,26,144,,,,,turtle neck looks really cool,6,POSITIVE,related to nike reviews,Elegant,,Style,,
20,27,145,,,,,appreciate it a lot thank you bro ,3,POSITIVE,related to nike reviews,Friendly,,Respect,,
21,28,146,,,,,finally someone appreciated the turtleneck mode ,5,POSITIVE,related to nike reviews,Elegant,,Style,,
22,29,149,,,,,oh yes the world famous brand of there vigil went crazy on that piece,137,POSITIVE,related to nike reviews,Aggressive,,Excitement,,
23,30,157,,,,,2016 haul bro,6,POSITIVE,related to nike reviews,Sporty,,Fortune,,
24,31,161,,,,,now this is a good slideshow not filled with unfunny memes and other extra stuff just a simple review,3,POSITIVE,related to nike reviews,Elegant,,Success,,
25,32,168,,,,,jesu s is btirhday iscrhistmas ,2,POSITIVE,related to nike reviews,Friendly,,Joy,,
26,33,172,,,,,w haul,2,POSITIVE,related to nike reviews,Sporty,,Excitement,,
27,34,176,,,,,are the travis 1s good,1,POSITIVE,related to nike reviews,Sporty,,Style,,
28,35,177,,,,,do af1 fit tts ,1,POSITIVE,related to nike reviews,Sporty,,Style,,
29,36,178,,,,,hey bro are the yeezys good quality,1,POSITIVE,related to nike reviews,Modern,,Style,,
30,37,182,,,,,love the little accessories being posted here theyre so coollmao,1,POSITIVE,related to nike reviews,Elegant,,Flamboyance,,
31,38,188,,,,,what is the price for shipping to canada,1,POSITIVE,related to nike reviews,Friendly,,Money,,
32,39,190,,,,,how does the vlone fit ,1,POSITIVE,related to nike reviews,Sporty,,Style,,
33,40,191,,,,,i was gonna buy my first haul from pandabuy and was wandering what is the best shipping to use i live on east coast usa,1,POSITIVE,related to nike reviews,Modern,,Friendly,,
34,41,192,,,,,yeezys good ,1,POSITIVE,related to nike reviews,Modern,,Style,,
35,42,203,,,,,and for dollar4 it feels higher quality than most dollar15 cases from amazon ,10,POSITIVE,related to nike reviews,Elegant,,Luxury,,
37,44,212,,,,,people say vlone and off white clothes are bad quality but it looks good to me let me give it a few wears and see,1,POSITIVE,related to nike reviews,Modern,,Style,,
38,45,216,,,,,yessssirrrr hella good for the price,2,POSITIVE,related to nike reviews,Friendly,,Success,,
39,46,221,,,,,yea they fit just like my real pair thats the same size,1,POSITIVE,related to nike reviews,Sporty,,Style,,
40,47,222,,,,,they look and feel good quality but i have not walked in them yet ,1,POSITIVE,related to nike reviews,Stable,,Style,,
41,49,229,,,,,people have told me they look good they feel good too in hand and on feet you should give it a go the price is good for what it provides,2,POSITIVE,related to nike reviews,Elegant,,Style,,
42,50,230,,,,,tts i would say i got a small and it fits just like all my other small clothes,1,POSITIVE,related to nike reviews,Sporty,,Balance,,
43,51,232,,,,,usually euro sizes,1,POSITIVE,related to nike reviews,Modern,,Style,,
44,53,243,,,,,hard to see from the photo but damn those are the best toeboxes i have seen on travs,1,POSITIVE,related to nike reviews,Aggressive,,Flamboyance,,
45,54,246,,,,,hey are the yeezys tts or size up ,1,POSITIVE,related to nike reviews,Sporty,,Style,,
46,55,247,,,,,ah makes sense ig like touching wise is it soft bruh i do not even have airpods yet might just buy for future thanks g ,1,POSITIVE,related to nike reviews,Modern,,Wisdom,,
47,56,254,,,,,i went tts and it fit me perfectly,1,POSITIVE,related to nike reviews,Sporty,,Style,,
48,57,264,,,,,nice haul my friend about the dunks sizing are you 43 in retail dunks also because i am 43 at retail dunks but 44 in general so i am wondering what m batch size i should get ,12,POSITIVE,related to nike reviews,Sporty,,Friendly,,
49,58,265,,,,,bro got reps instead of getting bitches,12,POSITIVE,related to nike reviews,Aggressive,,Respect,,
50,59,269,,,,,pull the other one big boned haha solid haul w2c that suit though,4,POSITIVE,related to nike reviews,Stable,,Fun,,
51,60,278,,,,,i am l with shorts usually so i should size down i got an essentials hoodie in xl and it is way massive,2,POSITIVE,related to nike reviews,Sporty,,Balance,,
52,61,279,,,,,looking sharpe ,2,POSITIVE,related to nike reviews,Elegant,,Style,,
53,62,285,,,,,nice review bro enjoy your haul tldr posted a nice comment to avoid my next haul being seized ,1,POSITIVE,related to nike reviews,Friendly,,Friendly,,
54,63,286,,,,,nice haul with subtle but clean pieces when you say they fit small do you mean that even after you double sized up they still fit small you and i have very similar builds so i am jw,1,POSITIVE,related to nike reviews,Elegant,,Style,,
55,64,287,,,,,w haul,1,POSITIVE,related to nike reviews,Sporty,,Excitement,,
56,65,291,,,,,whats the fit on the shorts like ,1,POSITIVE,related to nike reviews,Sporty,,Balance,,
57,66,297,,,,,bro got the npc haul,1,POSITIVE,related to nike reviews,Dynamic,,Excitement,,
58,67,304,,,,,is the seller of the dunks well known good quality stuff i am looking at the jordan 4 is in his shop rn,1,POSITIVE,related to nike reviews,Sporty,,Reliable,,
59,68,322,,,,,how does the sizing work on the dunks on panda buy i just got one size selection great haul tho ,1,POSITIVE,related to nike reviews,Sporty,,Style,,
60,69,324,,,,,i am new to the whole pandabuy thing does anyone know how i can choose the shoe size for the bone grey dunks ,1,POSITIVE,related to nike reviews,Sporty,,Style,,
61,70,326,,,,,w haul,1,POSITIVE,related to nike reviews,Sporty,,Excitement,,
62,71,338,,,,,great haul though ,5,POSITIVE,related to nike reviews,Friendly,,Success,,
63,74,358,,,,,velvet,1,POSITIVE,related to nike reviews,Elegant,,Flamboyance,,
64,75,364,,,,,thank you enjoy your haul ,2,POSITIVE,related to nike reviews,Dynamic,,Excitement,,
66,77,378,,,,,did you order xxl how does it fit ,1,POSITIVE,related to nike reviews,Sporty,,Friendly,,
67,78,380,,,,, brief description happy release day to one of absolutely stunning pairs and one of my favorite sb is in 2023 by far  born out of necessity the nike sb x tightbooth dunk low pro draws from the freedom of nighttime in the streets textural overlays emulate the metal grates encountered and employed during after dark sessions reflective design swoosh panels a co branded tongue and subtle hits of safety orange bring the spirit and synergy of tightbooth is visual identity to the iconic dunk review  overall shape looks great accurate toebox has a beautiful shape and it is not too thick toebox perforation holes looks amazing and they are not too thick black suede upper looks quality and leather on the swoosh looks great an orange tightbooth tag under the swoosh looks good as well tongue tags looks good inner tongue tags also the same swoosh looks great it is well placed and has a good shape color looks accurate there is nothing much to say heels embroidery is clean and looks good midsole color is good sole color is good as well squishiness is steady and strong as retails customer service was top notch the whole conversation was smooth and every question i asked met my needs they use high quality and most reliable shipping services like fedex dhl aramex royal mail etc and after delivery they will give you a tracking code where you can track your package anytime qc photos are of high quality with a professional camera taken from all possible angles where you can clearly see the condition of the shoe and quickly decide whether it is gl or rl they have no problem listening to advice or even if you rl a pair they will always without any hesitation change to a new pair until they finally reach your satisfaction a great quality that i really appreciate is that dw has pre exchanged a pair if it sees any flaws  timelines  25 08 2023 ordered paid 28 08 2023 qc received  30 08 2023 received tracking 03 09 2023 received package  w2c price  wap 86 157 5087 4699 web firstaj  com price normal price is 130dollar but using code repdad shipped price with aramex dhl fedex ups usps will be 125dollar,1,POSITIVE,related to nike reviews,Sporty,,Excitement,,
68,79,382,,,,,nice one love that design ,3,POSITIVE,related to nike reviews,Elegant,,Friendly,,
69,80,384,,,,,stunning pair ,3,POSITIVE,related to nike reviews,Elegant,,Flamboyance,,
70,81,385,,,,,well i got an l but i already have rep pair so i am good hahah ,3,POSITIVE,related to nike reviews,Dynamic,,Loyalty,,
71,83,390,,,,,great review bro ,3,POSITIVE,related to nike reviews,Friendly,,Friendly,,
72,84,396,,,,,dope bro great review ,2,POSITIVE,related to nike reviews,Dynamic,,Excitement,,
73,85,397,,,,, close i been to winning hahaha,2,POSITIVE,related to nike reviews,Dynamic,,Success,,
74,86,400,,,,, l but pair is in my haul d,2,POSITIVE,related to nike reviews,Dynamic,,Anger,,
75,87,412,,,,,i ordered hopefully mine comes out as good as the one you got ,2,POSITIVE,related to nike reviews,Elegant,,Excitement,,
76,88,415,,,,,dang looks clean,2,POSITIVE,related to nike reviews,Elegant,,Style,,
77,89,420,,,,,these are so fire,2,POSITIVE,related to nike reviews,Dynamic,,Passion,,
78,90,422,,,,,great looking photos fam and nice photos too ,2,POSITIVE,related to nike reviews,Elegant,,Friendly,,
79,92,425,,,,,tightbooths ,2,POSITIVE,related to nike reviews,Sporty,,Excitement,,
80,93,430,,,,,clean review bro ,2,POSITIVE,related to nike reviews,Friendly,,Friendly,,
81,94,432,,,,,hey firstaj great review on the nike sb dunk i totally agree with your take on the sneakers the design is fire and the colorway is on point these kicks definitely stand out from the crowd plus the comfort level is off the charts can not wait to rock these and turn some heads thanks for the detailed review ,2,POSITIVE,related to nike reviews,Dynamic,,Excitement,,
82,95,434,,,,,great pair ,2,POSITIVE,related to nike reviews,Elegant,,Success,,
83,96,438,,,,,cool looking shoe ,2,POSITIVE,related to nike reviews,Modern,,Style,,
84,97,439,,,,,looks clean,2,POSITIVE,related to nike reviews,Elegant,,Happiness,,
85,98,443,,,,,awesome review and pics as always bro,2,POSITIVE,related to nike reviews,Friendly,,Friendly,,
86,99,444,,,,,these might as well be retail amazing huge gl ,2,POSITIVE,related to nike reviews,Modern,,Excitement,,
87,101,446,,,,, welcome to r repsneakersdogs a community for replica sneaker enthusiasts  check out these useful r repsneakersdogs resources  established seller list esl trusted seller list  use code repsneakersdogs to get 5percent off on shipping unlimited  no threshold uses sign up on panda buy panda buy agent  sign up here for dollar92 off your total kameymall agent  here is a quick and easy step by step guide on how to order from an agent  here is a quick and easy step by step guide on how to order from a middleman  i am a bot and this action was performed automatically please message compose to r repsneakersdogs if you have any questions or concerns ,1,POSITIVE,related to nike reviews,Modern,,Trust,,
88,102,447,,,,,nike sb dunk is straight fire the design and colorway are on point giving it a unique and eye catching look the attention to detail is impressive making it a must have for sneakerheads plus the comfort level is off the charts ensuring you will be stylin and profilin all day long grab a pair and step up your sneaker game p s did you know that nike sb dunks were originally designed for skateboarding it is a cool fact that adds to the sneaker is street cred keep shredding and stay fresh ,1,POSITIVE,related to nike reviews,Sporty,,Excitement,,
89,103,451,,,,,100percent,1,POSITIVE,related to nike reviews,Modern,,Success,,
90,104,456,,,,,good point ,1,POSITIVE,related to nike reviews,Friendly,,Respect,,
91,105,479,,,,,they wil he is a great seller ,1,POSITIVE,related to nike reviews,Friendly,,Success,,
92,106,484,,,,,good idea ,1,POSITIVE,related to nike reviews,Friendly,,Success,,
93,107,489,,,,,i appreciate ,1,POSITIVE,related to nike reviews,Friendly,,Respect,,
94,108,495,,,,,ayyeee,1,POSITIVE,related to nike reviews,Dynamic,,Excitement,,
95,109,497,,,,,niceee,1,POSITIVE,related to nike reviews,Friendly,,Friendly,,
96,110,508,,,,,good idea ,2,POSITIVE,related to nike reviews,Friendly,,Success,,
97,111,511,,,,,easily ,2,POSITIVE,related to nike reviews,Friendly,,Excitement,,
98,112,514,,,,,is the swoosh reflective tho ,2,POSITIVE,related to nike reviews,Sporty,,Style,,
99,113,517,,,,,heheh nice bro welcome ,1,POSITIVE,related to nike reviews,Friendly,,Friendly,,
100,114,519,,,,,good luck ,2,POSITIVE,related to nike reviews,Friendly,,Success,,
101,115,522,,,,,appreciate you,1,POSITIVE,related to nike reviews,Friendly,,Respect,,
102,116,529,,,,,til how to motivate myself to work hard,5,POSITIVE,related to nike reviews,Powerful,,Success,,
103,117,532,,,,,you see these everywhere on expensive items ,2,POSITIVE,related to nike reviews,Elegant,,Luxury,,
104,118,533,,,,,from reddit to facebook and back to reddit the circle is complete ,2,POSITIVE,related to nike reviews,Dynamic,,Mystery,,
105,119,534,,,,,those prices are astronomical ,2,POSITIVE,related to nike reviews,Modern,,Fortune,,
106,120,537,,,,,worth it though,1,POSITIVE,related to nike reviews,Dynamic,,Success,,
109,124,551,,,,,geez nike is laughing all the way to the bank  ,-7,POSITIVE,related to nike reviews,Sporty,,Success,,
111,126,558,,,,,the nerve of some people ,12,POSITIVE,related to nike reviews,Aggressive,,Anger,,
112,127,580,,,,,i know they seem so wholesome ,6,POSITIVE,related to nike reviews,Friendly,,Virtue,,
113,128,606,,,,,there is a huge difference in any and any highly anticipated do not put this off like i am the one that read into anything wrong ,1,POSITIVE,related to nike reviews,Dynamic,,Excitement,,
114,129,607,frugalmalefashion,nike af1 oil green deal review and 5 outfit ideas ,quality is a1 fit tts they are suede so a nicer weather shoe but fall appropriate i also threw together 5 ways i would wear them but i think they look best with a basic blue jean white shirt combo  ,302,nike af1 oil green deal review and 5 outfit ideas . quality is a1 fit tts they are suede so a nicer weather shoe but fall appropriate i also threw together 5 ways i would wear them but i think they look best with a basic blue jean white shirt combo  ,,POSITIVE,related to nike reviews,Sporty,,Style,,
115,130,608,,,,,that 1 4 zip fit ,105,POSITIVE,related to nike reviews,Sporty,,Style,,
116,131,609,,,,,nice color blocking,24,POSITIVE,related to nike reviews,Elegant,,Style,,
117,132,611,,,,,zelensky looking ass in the last one i like your outfits man great purchase ,13,POSITIVE,related to nike reviews,Elegant,,Flamboyance,,
118,133,613,,,,,this is a good post ,12,POSITIVE,related to nike reviews,Friendly,,Happiness,,
119,134,615,,,,, 2 3 casual subtle drip ,3,POSITIVE,related to nike reviews,Elegant,,Flamboyance,,
120,135,616,,,,,when i saw the shoes i thought their color might make it difficult to find outfits for but you totally nailed it man ,3,POSITIVE,related to nike reviews,Elegant,,Style,,
121,136,617,,,,,i like the blue white green colors together they just compliment each other so well ,3,POSITIVE,related to nike reviews,Elegant,,Balance,,
122,137,620,,,,,king,7,POSITIVE,related to nike reviews,Elegant,,Royalty,,
123,138,621,,,,,just dip them in coffee  ,2,POSITIVE,related to nike reviews,Elegant,,Balance,,
124,139,622,,,,,upvote for pats fan i was actually looking at one of those hats earlier second fit did you get it on bodega ,2,POSITIVE,related to nike reviews,Sporty,,Friendly,,
125,140,623,,,,,my guy creating a look book i love it,2,POSITIVE,related to nike reviews,Elegant,,Style,,
126,141,631,,,,,looking fly my guy,2,POSITIVE,related to nike reviews,Elegant,,Flamboyance,,
127,142,632,,,,,niceee,2,POSITIVE,related to nike reviews,Friendly,,Friendly,,
128,143,634,,,,,the last fit looks the nicest matching the pullover ,2,POSITIVE,related to nike reviews,Elegant,,Style,,
129,144,639,,,,,you look like you could use a more mature fashion style and number 4 is the proof that sounds mean but you would it is really going from good to better you look great and the shoes are nice they could use some darker colors though ,2,POSITIVE,related to nike reviews,Elegant,,Flamboyance,,
130,145,640,,,,,that last fit is the best one,1,POSITIVE,related to nike reviews,Sporty,,Success,,
131,146,646,,,,,little guy,-3,POSITIVE,related to nike reviews,Sporty,,Family,,
132,147,653,,,,,tried and true levis 501 ,11,POSITIVE,related to nike reviews,Stable,,Style,,
133,148,655,,,,, some would work better with another layer but thanks ,3,POSITIVE,related to nike reviews,Dynamic,,Passion,,
134,149,657,,,,,i wear white shoes a lot and do not disagree with you i like the variety ,14,POSITIVE,related to nike reviews,Modern,,Balance,,
135,150,658,,,,,variety is nice and sometimes it is nice to have a silly uniquely colored piece,3,POSITIVE,related to nike reviews,Elegant,,Flamboyance,,
136,151,659,,,,,i got it at burlington actually kind of a cool find for dollar12 99,2,POSITIVE,related to nike reviews,Modern,,Fun,,
137,152,668,,,,,gotta stay faithful ,1,POSITIVE,related to nike reviews,Stable,,Loyalty,,
138,153,669,,,,,appreciate the feedback i work from home a lot so tend to lean casual ,1,POSITIVE,related to nike reviews,Friendly,,Friendly,,
139,154,670,,,,,its def the most obvious match shirt to shoes but ya it works well ,1,POSITIVE,related to nike reviews,Dynamic,,Balance,,
140,155,671,,,,,was on nike com,1,POSITIVE,related to nike reviews,Sporty,,Style,,
141,157,680,,,,,stay strong brother i pray our o line can get in sync we have the talent just need it to mesh so we can execute ,3,POSITIVE,related to nike reviews,Stable,,Strength,,
142,158,692,,,,,i love 501s but man as a chunkier dude i always have camel nuts with them ,4,POSITIVE,related to nike reviews,Aggressive,,Modesty,,
143,160,697,,,,,i enjoyed this slideshiw,53,POSITIVE,related to nike reviews,Dynamic,,Fun,,
144,161,698,,,,,loved the slides m guy,21,POSITIVE,related to nike reviews,Friendly,,Happiness,,
145,162,699,,,,,massive w,11,POSITIVE,related to nike reviews,Aggressive,,Excitement,,
146,165,707,,,,,w2c dunks,2,POSITIVE,related to nike reviews,Sporty,,Style,,
147,166,710,,,,,you deserved the award just because of sex bismillah rock lee level you nailed it,2,POSITIVE,related to nike reviews,Aggressive,,Respect,,
148,167,712,,,,,nice haul love the goyard ,2,POSITIVE,related to nike reviews,Elegant,,Luxury,,
149,168,713,,,,,hey friend thanks for taking the time and wrote us such a good review it is awesome if you have any doubts regarding your orders parcels later just feel free to check with us d,2,POSITIVE,related to nike reviews,Friendly,,Friendly,,
150,169,714,,,,,agree wholeheartedly with the taste in this haul my man,1,POSITIVE,related to nike reviews,Friendly,,Style,,
151,170,717,,,,,the a in the beanie is a bit off and i think some of the colors are fantasy but still a nice find,1,POSITIVE,related to nike reviews,Elegant,,Style,,
152,171,722,,,,,those pants look sick nice haul ,1,POSITIVE,related to nike reviews,Aggressive,,Excitement,,
153,172,729,,,,,saw the bayern kit so insta up vote,1,POSITIVE,related to nike reviews,Sporty,,Flamboyance,,
154,173,733,,,,,this is properrrrr,1,POSITIVE,related to nike reviews,Dynamic,,Excitement,,
155,175,741,,,,,love the kith hoodie i have it in blue but i am gonna get the black,1,POSITIVE,related to nike reviews,Modern,,Excitement,,
156,176,742,,,,,is the length good at least on the han solo joggers,1,POSITIVE,related to nike reviews,Sporty,,Style,,
157,177,753,,,,,manto do timao ta chavao,1,POSITIVE,related to nike reviews,Aggressive,,Passion,,
158,178,756,,,,,new link for the nike joggers ,1,POSITIVE,related to nike reviews,Sporty,,Style,,
159,181,763,,,,,say that again see what happens,3,POSITIVE,related to nike reviews,Aggressive,,Anger,,
160,182,764,,,,,corinthians is meme in brazil bro,1,POSITIVE,related to nike reviews,Dynamic,,Fun,,
161,183,766,,,,,you choose what to buy the items you choose are your haul,2,POSITIVE,related to nike reviews,Dynamic,,Excitement,,
162,185,779,,,,,cheers man i will go with the 42 5 then great haul btw ,1,POSITIVE,related to nike reviews,Friendly,,Excitement,,
163,186,781,,,,,yeah i have the xxl carted figure i would be safe that way thanks for the response ,1,POSITIVE,related to nike reviews,Stable,,Excitement,,
